"No.","Time","Source","Destination","Protocol","Length","Time since reference or first frame","Info"
"89","1.039366","10.0.0.14","206.247.61.33","TCP","68","1.039366000","48200  >  443 [ACK] Seq=1 Ack=73 Win=501 Len=0 TSval=1279067693 TSecr=3341572386"
"94","1.065425","10.0.0.14","206.247.61.33","TLSv1.2","111","1.065425000","Application Data"
"126","1.316461","10.0.0.14","206.247.61.33","TLSv1.2","111","1.316461000","Application Data"
"160","1.577181","10.0.0.14","206.247.61.33","TLSv1.2","106","1.577181000","Application Data"
"191","1.787374","10.0.0.14","206.247.61.33","TCP","68","1.787374000","48200  >  443 [ACK] Seq=125 Ack=232 Win=501 Len=0 TSval=1279068441 TSecr=3341573099"
"192","1.787606","10.0.0.14","206.247.61.33","TLSv1.2","135","1.787606000","Application Data"
"227","2.079124","10.0.0.14","206.247.61.33","TLSv1.2","111","2.079124000","Application Data"
"260","2.324628","10.0.0.14","206.247.61.33","TLSv1.2","111","2.324628000","Application Data"
"300","2.571483","10.0.0.14","206.247.61.33","TLSv1.2","111","2.571483000","Application Data"
"306","2.640664","10.0.0.14","206.247.61.33","TLSv1.2","106","2.640664000","Application Data"
"315","2.674679","2a06:c701:472d:c000:6fff:6e94:31da:5893","2407:30c0:182::aa72:3406","TCP","88","2.674679000","[TCP ACKed unseen segment] 57128  >  443 [ACK] Seq=1 Ack=2 Win=501 Len=0 TSval=1675745644 TSecr=4056555975"
"325","2.769889","10.0.0.14","206.247.61.33","TCP","68","2.769889000","48214  >  443 [ACK] Seq=39 Ack=50 Win=501 Len=0 TSval=1279069424 TSecr=3341574115"
"326","2.770137","10.0.0.14","206.247.61.33","TLSv1.2","135","2.770137000","Application Data"
"334","2.838079","10.0.0.14","206.247.61.33","TCP","68","2.838079000","48214  >  443 [ACK] Seq=106 Ack=88 Win=501 Len=0 TSval=1279069492 TSecr=3341574137"
"362","3.039400","10.0.0.14","206.247.61.33","TLSv1.2","111","3.039400000","Application Data"
"372","3.126090","2a06:c701:472d:c000:6fff:6e94:31da:5893","2a03:2880:f242:c8:face:b00c:0:167","TCP","88","3.126090000","41846  >  443 [ACK] Seq=1 Ack=78 Win=501 Len=0 TSval=3686276663 TSecr=439474345"
"437","3.753215","2a06:c701:472d:c000:6fff:6e94:31da:5893","2a03:2880:f242:c8:face:b00c:0:167","TCP","88","3.753215000","41846  >  443 [ACK] Seq=1 Ack=810 Win=496 Len=0 TSval=3686277290 TSecr=439475001"
"450","3.901290","2a06:c701:472d:c000:6fff:6e94:31da:5893","2a03:2880:f242:c8:face:b00c:0:167","TCP","88","3.901290000","41846  >  443 [ACK] Seq=1 Ack=1577 Win=493 Len=0 TSval=3686277438 TSecr=439475148"
"494","4.422638","2a06:c701:472d:c000:6fff:6e94:31da:5893","2a03:2880:f242:c8:face:b00c:0:167","TLSv1.2","179","4.422638000","Application Data"
"539","4.718058","2a06:c701:472d:c000:6fff:6e94:31da:5893","2407:30c0:182::aa72:3404","TCP","88","4.718058000","45500  >  443 [ACK] Seq=1 Ack=1 Win=501 Len=0 TSval=217222250 TSecr=2074973576"
"607","4.965844","2a06:c701:472d:c000:6fff:6e94:31da:5893","2600:9000:2024:a00:e:4185:5680:93a1","TLSv1.2","156","4.965844000","Application Data"
"608","4.969473","2a06:c701:472d:c000:6fff:6e94:31da:5893","2600:9000:2024:a00:e:4185:5680:93a1","TLSv1.2","189","4.969473000","Application Data, Application Data"
"615","4.974454","2a06:c701:472d:c000:6fff:6e94:31da:5893","2a03:2880:f242:c8:face:b00c:0:167","TLSv1.2","163","4.974454000","Application Data"
"627","4.988856","2a06:c701:472d:c000:6fff:6e94:31da:5893","2a03:2880:f242:c8:face:b00c:0:167","TLSv1.2","184","4.988856000","Application Data"
"653","5.042005","2a06:c701:472d:c000:6fff:6e94:31da:5893","2600:9000:2024:a00:e:4185:5680:93a1","TCP","88","5.042005000","43746  >  443 [ACK] Seq=170 Ack=40 Win=501 Len=0 TSval=2199288833 TSecr=3864262490"
"661","5.098041","10.0.0.14","206.247.61.33","TCP","68","5.098041000","48200  >  443 [ACK] Seq=364 Ack=592 Win=501 Len=0 TSval=1279071752 TSecr=3341576388"
"662","5.114138","10.0.0.14","206.247.61.33","TLSv1.2","111","5.114138000","Application Data"
"665","5.127410","2a06:c701:472d:c000:6fff:6e94:31da:5893","2600:9000:2024:a00:e:4185:5680:93a1","TCP","88","5.127410000","43746  >  443 [ACK] Seq=170 Ack=1068 Win=493 Len=0 TSval=2199288918 TSecr=3864262573"
"667","5.128261","2a06:c701:472d:c000:6fff:6e94:31da:5893","2600:9000:2024:a00:e:4185:5680:93a1","TCP","88","5.128261000","43746  >  443 [ACK] Seq=170 Ack=2099 Win=493 Len=0 TSval=2199288919 TSecr=3864262574"
"673","5.129166","2a06:c701:472d:c000:6fff:6e94:31da:5893","2600:9000:2024:a00:e:4185:5680:93a1","TLSv1.2","123","5.129166000","Application Data"
"677","5.129662","2a06:c701:472d:c000:6fff:6e94:31da:5893","2600:9000:2024:a00:e:4185:5680:93a1","TLSv1.2","123","5.129662000","Application Data"
"679","5.132560","2a06:c701:472d:c000:6fff:6e94:31da:5893","2a03:2880:f242:c8:face:b00c:0:167","TCP","88","5.132560000","41846  >  443 [ACK] Seq=263 Ack=2837 Win=493 Len=0 TSval=3686278669 TSecr=439476393"
"711","5.340580","10.0.0.14","206.247.61.33","TLSv1.2","106","5.340580000","Application Data"
"746","5.600009","10.0.0.14","206.247.61.33","TCP","68","5.600009000","48200  >  443 [ACK] Seq=445 Ack=641 Win=501 Len=0 TSval=1279072254 TSecr=3341576883"
"749","5.600077","10.0.0.14","206.247.61.33","TCP","68","5.600077000","48200  >  443 [ACK] Seq=445 Ack=679 Win=501 Len=0 TSval=1279072254 TSecr=3341576892"
"750","5.600211","10.0.0.14","206.247.61.33","TLSv1.2","135","5.600211000","Application Data"
"831","6.396490","10.0.0.14","206.247.61.33","TLSv1.2","106","6.396490000","Application Data"
"849","6.525756","10.0.0.14","206.247.61.33","TCP","68","6.525756000","48214  >  443 [ACK] Seq=144 Ack=137 Win=501 Len=0 TSval=1279073180 TSecr=3341577870"
"850","6.525972","10.0.0.14","206.247.61.33","TLSv1.2","135","6.525972000","Application Data"
"867","6.598055","10.0.0.14","206.247.61.33","TCP","68","6.598055000","48214  >  443 [ACK] Seq=211 Ack=175 Win=501 Len=0 TSval=1279073252 TSecr=3341577891"
"896","6.720136","10.0.0.14","206.247.61.33","TLSv1.2","139","6.720136000","Application Data"
"900","6.745518","2a06:c701:472d:c000:6fff:6e94:31da:5893","2a03:2880:f242:c8:face:b00c:0:167","TCP","88","6.745518000","41846  >  443 [ACK] Seq=263 Ack=2916 Win=493 Len=0 TSval=3686280282 TSecr=439478006"
"914","6.885008","10.0.0.14","206.247.61.33","TLSv1.2","111","6.885008000","Application Data"
"942","7.039316","10.0.0.14","206.247.61.33","TCP","68","7.039316000","48200  >  443 [ACK] Seq=626 Ack=898 Win=501 Len=0 TSval=1279073693 TSecr=3341578385"
"943","7.039416","10.0.0.14","206.247.61.33","TLSv1.2","111","7.039416000","Application Data"
"953","7.119245","10.0.0.14","206.247.61.33","TLSv1.2","794","7.119245000","Application Data"
"954","7.121438","10.0.0.14","206.247.61.33","TLSv1.2","257","7.121438000","Application Data"
"976","7.288592","10.0.0.14","206.247.61.33","TLSv1.2","111","7.288592000","Application Data"
"985","7.338044","10.0.0.14","206.247.61.33","TCP","68","7.338044000","48200  >  443 [ACK] Seq=1627 Ack=1000 Win=501 Len=0 TSval=1279073992 TSecr=3341578645"
"1053","7.799072","10.0.0.14","13.226.2.61","TCP","76","7.799072000","40916  >  443 [SYN] Seq=0 Win=64240 Len=0 MSS=1460 SACK_PERM=1 TSval=257512187 TSecr=0 WS=128"
"1057","7.814520","10.0.0.14","13.226.2.61","TCP","68","7.814520000","40916  >  443 [ACK] Seq=1 Ack=1 Win=64256 Len=0 TSval=257512202 TSecr=129825321"
"1058","7.815180","10.0.0.14","13.226.2.61","TLSv1.3","585","7.815180000","Client Hello"
"1063","7.834602","10.0.0.14","13.226.2.61","TCP","68","7.834602000","40916  >  443 [ACK] Seq=518 Ack=235 Win=64128 Len=0 TSval=257512222 TSecr=129825341"
"1064","7.835311","10.0.0.14","13.226.2.61","TLSv1.3","132","7.835311000","Change Cipher Spec, Application Data"
"1065","7.835629","10.0.0.14","13.226.2.61","TLSv1.3","166","7.835629000","Application Data"
"1066","7.838605","10.0.0.14","13.226.2.61","TLSv1.3","967","7.838605000","Application Data"
"1076","7.854401","10.0.0.14","13.226.2.61","TCP","68","7.854401000","40916  >  443 [ACK] Seq=1579 Ack=474 Win=64128 Len=0 TSval=257512242 TSecr=129825360"
"1077","7.854557","10.0.0.14","13.226.2.61","TLSv1.3","99","7.854557000","Application Data"
"1081","7.857487","10.0.0.14","13.226.2.61","TLSv1.3","103","7.857487000","Application Data"
"1153","8.439500","10.0.0.14","104.121.10.34","TLSv1.2","713","8.439500000","Application Data"
"1187","8.700118","10.0.0.14","104.121.10.34","TCP","68","8.700118000","40162  >  443 [ACK] Seq=646 Ack=1735 Win=501 Len=0 TSval=3060878858 TSecr=1792860486"
"1188","8.705231","10.0.0.14","104.121.10.34","TLSv1.2","735","8.705231000","Application Data"
"1201","8.792183","10.0.0.14","206.247.61.33","TCP","68","8.792183000","48200  >  443 [ACK] Seq=1627 Ack=1072 Win=501 Len=0 TSval=1279075446 TSecr=3341580139"
"1202","8.792414","10.0.0.14","206.247.61.33","TLSv1.2","111","8.792414000","Application Data"
"1226","8.970841","10.0.0.14","104.121.10.34","TCP","68","8.970841000","40162  >  443 [ACK] Seq=1313 Ack=3651 Win=501 Len=0 TSval=3060879129 TSecr=1792860757"
"1228","8.975076","10.0.0.14","104.121.10.34","TCP","68","8.975076000","40162  >  443 [ACK] Seq=1313 Ack=6449 Win=501 Len=0 TSval=3060879133 TSecr=1792860758"
"1230","8.976767","10.0.0.14","104.121.10.34","TCP","68","8.976767000","40162  >  443 [ACK] Seq=1313 Ack=9247 Win=501 Len=0 TSval=3060879135 TSecr=1792860762"
"1232","8.979428","10.0.0.14","104.121.10.34","TCP","68","8.979428000","40162  >  443 [ACK] Seq=1313 Ack=12045 Win=501 Len=0 TSval=3060879137 TSecr=1792860766"
"1241","9.026065","10.0.0.14","104.121.10.34","TCP","68","9.026065000","40162  >  443 [ACK] Seq=1313 Ack=13189 Win=501 Len=0 TSval=3060879184 TSecr=1792860770"
"1244","9.042816","10.0.0.14","206.247.61.33","TLSv1.2","111","9.042816000","Application Data"
"1253","9.096111","10.0.0.14","206.247.61.33","TLSv1.2","106","9.096111000","Application Data"
"1278","9.282379","10.0.0.14","206.247.61.33","TCP","68","9.282379000","48200  >  443 [ACK] Seq=1751 Ack=1231 Win=501 Len=0 TSval=1279075936 TSecr=3341580597"
"1279","9.282540","10.0.0.14","206.247.61.33","TLSv1.2","135","9.282540000","Application Data"
"1310","9.506789","10.0.0.14","140.82.114.26","TLSv1.2","97","9.506789000","Application Data"
"1312","9.515552","2a06:c701:472d:c000:6fff:6e94:31da:5893","2407:30c0:182::aa72:3404","TCP","88","9.515552000","[TCP Previous segment not captured] 45500  >  443 [ACK] Seq=2 Ack=1 Win=501 Len=0 TSval=217227047 TSecr=2075018693"
"1316","9.542303","10.0.0.14","206.247.61.33","TLSv1.2","111","9.542303000","Application Data"
"1394","10.146009","10.0.0.14","206.247.61.33","TLSv1.2","106","10.146009000","Application Data"
"1410","10.271128","10.0.0.14","206.247.61.33","TCP","68","10.271128000","48214  >  443 [ACK] Seq=249 Ack=224 Win=501 Len=0 TSval=1279076925 TSecr=3341581617"
"1411","10.271317","10.0.0.14","206.247.61.33","TLSv1.2","135","10.271317000","Application Data"
"1418","10.342076","10.0.0.14","206.247.61.33","TCP","68","10.342076000","48214  >  443 [ACK] Seq=316 Ack=262 Win=501 Len=0 TSval=1279076996 TSecr=3341581641"
"1438","10.496828","10.0.0.14","206.247.61.33","TLSv1.2","237","10.496828000","Application Data"
"1450","10.589175","2a06:c701:472d:c000:6fff:6e94:31da:5893","2a03:2880:f242:c8:face:b00c:0:167","TCP","88","10.589175000","41846  >  443 [ACK] Seq=263 Ack=2993 Win=493 Len=0 TSval=3686284126 TSecr=439481848"
"1467","10.710065","10.0.0.14","206.247.61.33","TCP","68","10.710065000","48200  >  443 [ACK] Seq=2030 Ack=1346 Win=501 Len=0 TSval=1279077364 TSecr=3341582001"
"1495","11.038899","10.0.0.14","206.247.61.33","TCP","68","11.038899000","48200  >  443 [ACK] Seq=2030 Ack=1418 Win=501 Len=0 TSval=1279077693 TSecr=3341582384"
"1497","11.058570","10.0.0.14","206.247.61.33","TLSv1.2","111","11.058570000","Application Data"
"1636","12.873400","10.0.0.14","206.247.61.33","TLSv1.2","106","12.873400000","Application Data"
"1641","12.910058","2a06:c701:472d:c000:6fff:6e94:31da:5893","2a00:1450:4028:809::200e","TCP","88","12.910058000","50790  >  443 [ACK] Seq=1 Ack=1 Win=501 Len=0 TSval=531331939 TSecr=2567270185"
"1642","12.914019","2a06:c701:472d:c000:6fff:6e94:31da:5893","2a00:1450:4025:402::bc","TCP","88","12.914019000","33154  >  443 [ACK] Seq=1 Ack=1 Win=501 Len=0 TSval=3190974169 TSecr=2727965753"
"1644","12.914137","2a06:c701:472d:c000:6fff:6e94:31da:5893","2407:30c0:182::aa72:3406","TCP","88","12.914137000","[TCP ACKed unseen segment] 57144  >  443 [ACK] Seq=1 Ack=2 Win=501 Len=0 TSval=1675755883 TSecr=4056673719"
"1660","13.029362","10.0.0.14","206.247.61.33","TCP","68","13.029362000","48200  >  443 [ACK] Seq=2111 Ack=1505 Win=501 Len=0 TSval=1279079683 TSecr=3341584374"
"1661","13.029491","10.0.0.14","206.247.61.33","TLSv1.2","135","13.029491000","Application Data"
"1665","13.082138","10.0.0.14","206.247.61.33","TCP","68","13.082138000","48200  >  443 [ACK] Seq=2178 Ack=1577 Win=501 Len=0 TSval=1279079736 TSecr=3341584387"
"1667","13.082496","10.0.0.14","206.247.61.33","TLSv1.2","111","13.082496000","Application Data"
"1742","13.865823","10.0.0.14","206.247.61.33","TLSv1.2","106","13.865823000","Application Data"
"1755","14.014827","10.0.0.14","206.247.61.33","TCP","68","14.014827000","48214  >  443 [ACK] Seq=354 Ack=300 Win=501 Len=0 TSval=1279080669 TSecr=3341585360"
"1758","14.020857","10.0.0.14","206.247.61.33","TCP","68","14.020857000","48214  >  443 [ACK] Seq=354 Ack=349 Win=501 Len=0 TSval=1279080675 TSecr=3341585366"
"1759","14.021085","10.0.0.14","206.247.61.33","TLSv1.2","135","14.021085000","Application Data"
"1804","14.569828","10.0.0.14","206.247.61.33","TLSv1.2","476","14.569828000","Application Data"
"1818","14.725850","10.0.0.14","206.247.61.33","TCP","68","14.725850000","48200  >  443 [ACK] Seq=2629 Ack=1620 Win=501 Len=0 TSval=1279081380 TSecr=3341586072"
"1824","14.781975","2a06:c701:472d:c000:6fff:6e94:31da:5893","2a03:2880:f242:c8:face:b00c:0:167","TLSv1.2","159","14.781975000","Application Data"
"1839","14.962021","2a06:c701:472d:c000:6fff:6e94:31da:5893","2a03:2880:f242:c8:face:b00c:0:167","TCP","88","14.962021000","54798  >  443 [ACK] Seq=1 Ack=1 Win=501 Len=0 TSval=3686288499 TSecr=3556357524"
"1896","15.520998","10.0.0.14","206.247.61.33","TLSv1.2","265","15.520998000","Application Data"
"1900","15.546062","10.0.0.14","206.247.61.33","TCP","68","15.546062000","48200  >  443 [ACK] Seq=2826 Ack=1692 Win=501 Len=0 TSval=1279082200 TSecr=3341586893"
"1902","15.546098","10.0.0.14","206.247.61.33","TCP","68","15.546098000","48200  >  443 [ACK] Seq=2826 Ack=1760 Win=501 Len=0 TSval=1279082200 TSecr=3341586893"
"1905","15.576912","10.0.0.14","206.247.61.33","TLSv1.2","111","15.576912000","Application Data"
"1926","15.722050","10.0.0.14","206.247.61.33","TCP","68","15.722050000","48200  >  443 [ACK] Seq=2869 Ack=1803 Win=501 Len=0 TSval=1279082376 TSecr=3341587027"
"2029","16.568808","10.0.0.14","206.247.61.33","TLSv1.2","106","16.568808000","Application Data"
"2052","16.721781","10.0.0.14","206.247.61.33","TCP","68","16.721781000","48200  >  443 [ACK] Seq=2907 Ack=1841 Win=501 Len=0 TSval=1279083376 TSecr=3341588068"
"2059","16.783988","10.0.0.14","206.247.61.33","TCP","68","16.783988000","48200  >  443 [ACK] Seq=2907 Ack=1890 Win=501 Len=0 TSval=1279083438 TSecr=3341588131"
"2060","16.784191","10.0.0.14","206.247.61.33","TLSv1.2","135","16.784191000","Application Data"
"2065","16.818095","10.0.0.14","206.247.61.33","TLSv1.2","111","16.818095000","Application Data"
"2089","17.042945","10.0.0.14","206.247.61.33","TLSv1.2","111","17.042945000","Application Data"
"2117","17.272073","10.0.0.14","206.247.61.33","TLSv1.2","111","17.272073000","Application Data"
"2124","17.324025","10.0.0.14","206.247.61.33","TLSv1.2","111","17.324025000","Application Data"
"2171","17.571615","10.0.0.14","206.247.61.33","TLSv1.2","111","17.571615000","Application Data"
"2178","17.623074","10.0.0.14","206.247.61.33","TLSv1.2","106","17.623074000","Application Data"
"2200","17.772964","10.0.0.14","206.247.61.33","TLSv1.2","135","17.772964000","Application Data"
"2208","17.814097","10.0.0.14","206.247.61.33","TCP","68","17.814097000","48214  >  443 [ACK] Seq=526 Ack=436 Win=501 Len=0 TSval=1279084468 TSecr=3341589118"
"2235","18.034854","2a06:c701:472d:c000:6fff:6e94:31da:5893","2407:30c0:182::aa72:3406","TCP","88","18.034854000","[TCP Dup ACK 315#1] [TCP ACKed unseen segment] 57128  >  443 [ACK] Seq=1 Ack=2 Win=501 Len=0 TSval=1675761004 TSecr=4056555975"
"2318","19.086077","10.0.0.14","206.247.61.33","TCP","68","19.086077000","48200  >  443 [ACK] Seq=3189 Ack=2309 Win=501 Len=0 TSval=1279085740 TSecr=3341590391"
"2320","19.088923","10.0.0.14","206.247.61.33","TLSv1.2","111","19.088923000","Application Data"
"2378","19.519664","10.0.0.14","206.247.61.33","TLSv1.2","139","19.519664000","Application Data"
"2385","19.544192","10.0.0.14","206.247.61.33","TCP","68","19.544192000","48200  >  443 [ACK] Seq=3303 Ack=2381 Win=501 Len=0 TSval=1279086198 TSecr=3341590890"
"2388","19.578306","10.0.0.14","206.247.61.33","TLSv1.2","111","19.578306000","Application Data"
"2404","19.677096","10.0.0.14","206.247.61.33","TCP","68","19.677096000","48200  >  443 [ACK] Seq=3346 Ack=2495 Win=501 Len=0 TSval=1279086331 TSecr=3341591023"
"2405","19.677196","10.0.0.14","206.247.61.33","TLSv1.2","111","19.677196000","Application Data"
"2426","19.830082","10.0.0.14","206.247.61.33","TCP","68","19.830082000","48200  >  443 [ACK] Seq=3389 Ack=2567 Win=501 Len=0 TSval=1279086484 TSecr=3341591136"
"2429","19.842729","10.0.0.14","206.247.61.33","TLSv1.2","111","19.842729000","Application Data"
"2480","20.336708","10.0.0.14","206.247.61.33","TLSv1.2","106","20.336708000","Application Data"
"2502","20.489875","10.0.0.14","206.247.61.33","TCP","68","20.489875000","48200  >  443 [ACK] Seq=3470 Ack=2605 Win=501 Len=0 TSval=1279087144 TSecr=3341591837"
"2505","20.529928","10.0.0.14","206.247.61.33","TCP","68","20.529928000","48200  >  443 [ACK] Seq=3470 Ack=2654 Win=501 Len=0 TSval=1279087184 TSecr=3341591876"
"2506","20.530168","10.0.0.14","206.247.61.33","TLSv1.2","135","20.530168000","Application Data"
"2534","20.869706","10.0.0.14","206.247.61.33","TLSv1.2","798","20.869706000","Application Data"
"2552","21.043213","10.0.0.14","206.247.61.33","TCP","68","21.043213000","48200  >  443 [ACK] Seq=4267 Ack=2769 Win=501 Len=0 TSval=1279087697 TSecr=3341592380"
"2556","21.085101","10.0.0.14","206.247.61.33","TLSv1.2","111","21.085101000","Application Data"
"2595","21.382873","10.0.0.14","206.247.61.33","TLSv1.2","106","21.382873000","Application Data"
"2611","21.546418","10.0.0.14","206.247.61.33","TCP","68","21.546418000","48214  >  443 [ACK] Seq=564 Ack=485 Win=501 Len=0 TSval=1279088200 TSecr=3341592872"
"2612","21.546650","10.0.0.14","206.247.61.33","TLSv1.2","135","21.546650000","Application Data"
"2618","21.598118","10.0.0.14","206.247.61.33","TCP","68","21.598118000","48214  >  443 [ACK] Seq=631 Ack=523 Win=501 Len=0 TSval=1279088252 TSecr=3341592900"
"2733","23.082122","10.0.0.14","206.247.61.33","TCP","68","23.082122000","48200  >  443 [ACK] Seq=4310 Ack=2841 Win=501 Len=0 TSval=1279089736 TSecr=3341594388"
"2736","23.096083","10.0.0.14","206.247.61.33","TLSv1.2","111","23.096083000","Application Data"
"2742","23.150082","2a06:c701:472d:c000:6fff:6e94:31da:5893","2a00:1450:4028:808::2003","TCP","88","23.150082000","54488  >  443 [ACK] Seq=1 Ack=1 Win=501 Len=0 TSval=1142473828 TSecr=323254610"
"2821","24.127857","10.0.0.14","206.247.61.33","TLSv1.2","106","24.127857000","Application Data"
"2837","24.281222","10.0.0.14","206.247.61.33","TCP","68","24.281222000","48200  >  443 [ACK] Seq=4391 Ack=2879 Win=501 Len=0 TSval=1279090935 TSecr=3341595628"
"2839","24.281278","10.0.0.14","206.247.61.33","TCP","68","24.281278000","48200  >  443 [ACK] Seq=4391 Ack=2928 Win=501 Len=0 TSval=1279090935 TSecr=3341595628"
"2840","24.281438","10.0.0.14","206.247.61.33","TLSv1.2","135","24.281438000","Application Data"
"2898","24.876018","2a06:c701:472d:c000:6fff:6e94:31da:5893","2407:30c0:182::aa72:3404","TCP","88","24.876018000","[TCP Keep-Alive ACK] 45500  >  443 [ACK] Seq=2 Ack=1 Win=501 Len=0 TSval=217242408 TSecr=2075018693"
"2942","25.146166","10.0.0.14","206.247.61.33","TLSv1.2","106","25.146166000","Application Data"
"2953","25.269205","10.0.0.14","206.247.61.33","TCP","68","25.269205000","48214  >  443 [ACK] Seq=669 Ack=572 Win=501 Len=0 TSval=1279091923 TSecr=3341596614"
"2954","25.269427","10.0.0.14","206.247.61.33","TLSv1.2","135","25.269427000","Application Data"
"2961","25.350130","10.0.0.14","206.247.61.33","TCP","68","25.350130000","48214  >  443 [ACK] Seq=736 Ack=610 Win=501 Len=0 TSval=1279092004 TSecr=3341596641"
"3122","27.366044","10.0.0.14","206.247.61.33","TCP","68","27.366044000","48200  >  443 [ACK] Seq=4458 Ack=2987 Win=501 Len=0 TSval=1279094020 TSecr=3341598662"
"3123","27.377858","10.0.0.14","206.247.61.33","TLSv1.2","111","27.377858000","Application Data"
"3166","27.861620","10.0.0.14","206.247.61.33","TLSv1.2","106","27.861620000","Application Data"
"3180","28.014664","10.0.0.14","206.247.61.33","TCP","68","28.014664000","48200  >  443 [ACK] Seq=4539 Ack=3025 Win=501 Len=0 TSval=1279094669 TSecr=3341599361"
"3185","28.034430","10.0.0.14","206.247.61.33","TCP","68","28.034430000","48200  >  443 [ACK] Seq=4539 Ack=3074 Win=501 Len=0 TSval=1279094688 TSecr=3341599381"
"3186","28.034685","10.0.0.14","206.247.61.33","TLSv1.2","135","28.034685000","Application Data"
"3215","28.273897","2a06:c701:472d:c000:6fff:6e94:31da:5893","2407:30c0:182::aa72:3406","TCP","88","28.273897000","[TCP Dup ACK 1644#1] [TCP ACKed unseen segment] 57144  >  443 [ACK] Seq=1 Ack=2 Win=501 Len=0 TSval=1675771243 TSecr=4056673719"
"3219","28.290622","10.0.0.14","206.247.61.33","TCP","68","28.290622000","48200  >  443 [ACK] Seq=4606 Ack=3214 Win=501 Len=0 TSval=1279094944 TSecr=3341599637"
"3222","28.307398","10.0.0.14","206.247.61.33","TLSv1.2","111","28.307398000","Application Data"
"3287","28.804204","10.0.0.14","206.247.61.33","TLSv1.2","111","28.804204000","Application Data"
"3307","28.906865","10.0.0.14","206.247.61.33","TLSv1.2","106","28.906865000","Application Data"
"3325","29.022736","10.0.0.14","206.247.61.33","TCP","68","29.022736000","48214  >  443 [ACK] Seq=774 Ack=659 Win=501 Len=0 TSval=1279095677 TSecr=3341600365"
"3326","29.022941","10.0.0.14","206.247.61.33","TLSv1.2","135","29.022941000","Application Data"
"3332","29.057097","10.0.0.14","206.247.61.33","TLSv1.2","111","29.057097000","Application Data"
"3342","29.114112","10.0.0.14","206.247.61.33","TCP","68","29.114112000","48214  >  443 [ACK] Seq=841 Ack=697 Win=501 Len=0 TSval=1279095768 TSecr=3341600402"
"3361","29.294100","10.0.0.14","142.251.142.195","TCP","68","29.294100000","59140  >  443 [ACK] Seq=1 Ack=1 Win=501 Len=0 TSval=3786698900 TSecr=833662504"
"3385","29.569906","10.0.0.14","206.247.61.33","TLSv1.2","475","29.569906000","Application Data"
"3402","29.770081","10.0.0.14","206.247.61.33","TCP","68","29.770081000","48200  >  443 [ACK] Seq=5142 Ack=3401 Win=501 Len=0 TSval=1279096424 TSecr=3341601075"
"3498","30.796038","10.0.0.14","206.247.61.33","TCP","68","30.796038000","48200  >  443 [ACK] Seq=5142 Ack=3473 Win=501 Len=0 TSval=1279097450 TSecr=3341602143"
"3501","30.817537","10.0.0.14","206.247.61.33","TLSv1.2","111","30.817537000","Application Data"
"3534","31.061079","10.0.0.14","206.247.61.33","TLSv1.2","111","31.061079000","Application Data"
"3587","31.587544","10.0.0.14","206.247.61.33","TLSv1.2","106","31.587544000","Application Data"
"3588","31.587658","10.0.0.14","206.247.61.33","TLSv1.2","111","31.587658000","Application Data"
"3606","31.785905","10.0.0.14","206.247.61.33","TCP","68","31.785905000","48200  >  443 [ACK] Seq=5309 Ack=3700 Win=501 Len=0 TSval=1279098440 TSecr=3341603087"
"3607","31.786158","10.0.0.14","206.247.61.33","TLSv1.2","135","31.786158000","Application Data"
"3646","32.269353","10.0.0.14","206.247.61.33","TLSv1.2","139","32.269353000","Application Data"
"3665","32.427822","10.0.0.14","206.247.61.33","TCP","68","32.427822000","48200  >  443 [ACK] Seq=5447 Ack=3814 Win=501 Len=0 TSval=1279099082 TSecr=3341603774"
"3670","32.502907","10.0.0.14","206.247.61.33","TLSv1.2","111","32.502907000","Application Data"
"3689","32.618498","10.0.0.14","206.247.61.33","TLSv1.2","106","32.618498000","Application Data"
"3706","32.767922","10.0.0.14","206.247.61.33","TCP","68","32.767922000","48214  >  443 [ACK] Seq=879 Ack=735 Win=501 Len=0 TSval=1279099422 TSecr=3341604113"
"3711","32.778160","10.0.0.14","206.247.61.33","TCP","68","32.778160000","48214  >  443 [ACK] Seq=879 Ack=784 Win=501 Len=0 TSval=1279099432 TSecr=3341604124"
"3712","32.778375","10.0.0.14","206.247.61.33","TLSv1.2","135","32.778375000","Application Data"
"3760","33.076011","10.0.0.14","206.247.61.33","TLSv1.2","111","33.076011000","Application Data"
"3814","33.404879","2a06:c701:472d:c000:6fff:6e94:31da:5893","2407:30c0:182::aa72:3406","TCP","88","33.404879000","[TCP Dup ACK 315#2] [TCP ACKed unseen segment] 57128  >  443 [ACK] Seq=1 Ack=2 Win=501 Len=0 TSval=1675776374 TSecr=4056555975"
"3834","33.589053","10.0.0.14","206.247.61.33","TLSv1.2","111","33.589053000","Application Data"
"3866","33.694930","2a06:c701:472d:c000:6fff:6e94:31da:5893","2407:30c0:182::aa72:3404","TLSv1.2","2406","33.694930000","Application Data"
"3867","33.697337","2a06:c701:472d:c000:6fff:6e94:31da:5893","2407:30c0:182::aa72:3404","TLSv1.2","127","33.697337000","Application Data"
"3912","33.762083","2a06:c701:472d:c000:6fff:6e94:31da:5893","2407:30c0:182::aa72:3404","TCP","88","33.762083000","45500  >  443 [ACK] Seq=2359 Ack=40 Win=501 Len=0 TSval=217251294 TSecr=2075047616"
"3977","33.925709","2a06:c701:472d:c000:6fff:6e94:31da:5893","2407:30c0:182::aa72:3404","TCP","88","33.925709000","45500  >  443 [ACK] Seq=2359 Ack=1388 Win=493 Len=0 TSval=217251458 TSecr=2075047827"
"3980","33.927870","2a06:c701:472d:c000:6fff:6e94:31da:5893","2407:30c0:182::aa72:3404","TCP","88","33.927870000","45500  >  443 [ACK] Seq=2359 Ack=6780 Win=451 Len=0 TSval=217251460 TSecr=2075047827"
"3984","33.928377","2a06:c701:472d:c000:6fff:6e94:31da:5893","2407:30c0:182::aa72:3404","TCP","88","33.928377000","45500  >  443 [ACK] Seq=2359 Ack=8128 Win=493 Len=0 TSval=217251460 TSecr=2075047827"
"3985","33.928399","2a06:c701:472d:c000:6fff:6e94:31da:5893","2407:30c0:182::aa72:3404","TCP","88","33.928399000","45500  >  443 [ACK] Seq=2359 Ack=8232 Win=493 Len=0 TSval=217251460 TSecr=2075047827"
"3986","33.928411","2a06:c701:472d:c000:6fff:6e94:31da:5893","2407:30c0:182::aa72:3404","TCP","88","33.928411000","45500  >  443 [ACK] Seq=2359 Ack=8317 Win=493 Len=0 TSval=217251460 TSecr=2075047827"
"3994","33.941417","2a06:c701:472d:c000:6fff:6e94:31da:5893","2407:30c0:182::aa72:3404","TLSv1.2","123","33.941417000","Application Data"
"3999","33.961351","2a06:c701:472d:c000:6fff:6e94:31da:5893","2a03:2880:f242:c8:face:b00c:0:167","TCP","100","33.961351000","[TCP Previous segment not captured] 54798  >  443 [ACK] Seq=2 Ack=1 Win=501 Len=0 TSval=3686307498 TSecr=3556403554 SLE=40 SRE=41"
"4001","33.962834","2a06:c701:472d:c000:6fff:6e94:31da:5893","2a03:2880:f242:c8:face:b00c:0:167","TCP","88","33.962834000","54798  >  443 [ACK] Seq=2 Ack=41 Win=501 Len=0 TSval=3686307500 TSecr=3556422500"
"4002","33.962981","2a06:c701:472d:c000:6fff:6e94:31da:5893","2a03:2880:f242:c8:face:b00c:0:167","TCP","88","33.962981000","54798  >  443 [FIN, ACK] Seq=2 Ack=41 Win=501 Len=0 TSval=3686307500 TSecr=3556422500"
"4005","33.970558","10.0.0.14","52.84.151.30","TCP","76","33.970558000","57366  >  443 [SYN] Seq=0 Win=64240 Len=0 MSS=1460 SACK_PERM=1 TSval=1886225451 TSecr=0 WS=128"
"4008","33.976610","10.0.0.14","52.84.151.30","TCP","76","33.976610000","57382  >  443 [SYN] Seq=0 Win=64240 Len=0 MSS=1460 SACK_PERM=1 TSval=1886225457 TSecr=0 WS=128"
"4009","33.976844","10.0.0.14","52.84.151.30","TCP","76","33.976844000","57394  >  443 [SYN] Seq=0 Win=64240 Len=0 MSS=1460 SACK_PERM=1 TSval=1886225458 TSecr=0 WS=128"
"4017","34.025978","10.0.0.14","52.84.151.30","TCP","68","34.025978000","57366  >  443 [ACK] Seq=1 Ack=1 Win=64256 Len=0 TSval=1886225507 TSecr=1527797378"
"4018","34.026936","10.0.0.14","52.84.151.30","TLSv1.3","585","34.026936000","Client Hello"
"4023","34.039206","10.0.0.14","52.84.151.30","TCP","68","34.039206000","57382  >  443 [ACK] Seq=1 Ack=1 Win=64256 Len=0 TSval=1886225520 TSecr=157524730"
"4025","34.039462","10.0.0.14","52.84.151.30","TCP","68","34.039462000","57394  >  443 [ACK] Seq=1 Ack=1 Win=64256 Len=0 TSval=1886225520 TSecr=1781432975"
"4026","34.039747","10.0.0.14","52.84.151.30","TLSv1.3","585","34.039747000","Client Hello"
"4028","34.040118","10.0.0.14","52.84.151.30","TLSv1.3","585","34.040118000","Client Hello"
"4032","34.069801","10.0.0.14","206.247.61.33","TLSv1.2","111","34.069801000","Application Data"
"4037","34.087164","10.0.0.14","52.84.151.30","TCP","68","34.087164000","57366  >  443 [ACK] Seq=518 Ack=235 Win=64128 Len=0 TSval=1886225568 TSecr=1527797439"
"4038","34.087715","10.0.0.14","52.84.151.30","TLSv1.3","132","34.087715000","Change Cipher Spec, Application Data"
"4039","34.088044","10.0.0.14","52.84.151.30","TLSv1.3","166","34.088044000","Application Data"
"4040","34.088119","10.0.0.14","52.84.151.30","TCP","68","34.088119000","57382  >  443 [FIN, ACK] Seq=518 Ack=1 Win=64256 Len=0 TSval=1886225569 TSecr=157524730"
"4041","34.088210","10.0.0.14","52.84.151.30","TCP","68","34.088210000","57394  >  443 [FIN, ACK] Seq=518 Ack=1 Win=64256 Len=0 TSval=1886225569 TSecr=1781432975"
"4042","34.088702","10.0.0.14","52.84.151.30","TLSv1.3","1863","34.088702000","Application Data"
"4043","34.090252","10.0.0.14","52.84.151.30","TLSv1.3","418","34.090252000","Application Data, Application Data"
"4047","34.101117","10.0.0.14","52.84.151.30","TCP","56","34.101117000","57382  >  443 [RST] Seq=518 Win=0 Len=0"
"4050","34.101794","10.0.0.14","52.84.151.30","TCP","56","34.101794000","57382  >  443 [RST] Seq=518 Win=0 Len=0"
"4052","34.101829","10.0.0.14","52.84.151.30","TCP","56","34.101829000","57382  >  443 [RST] Seq=518 Win=0 Len=0"
"4055","34.103054","10.0.0.14","52.84.151.30","TCP","56","34.103054000","57382  >  443 [RST] Seq=518 Win=0 Len=0"
"4058","34.104757","10.0.0.14","52.84.151.30","TCP","56","34.104757000","57394  >  443 [RST] Seq=518 Win=0 Len=0"
"4060","34.106459","10.0.0.14","52.84.151.30","TCP","56","34.106459000","57394  >  443 [RST] Seq=518 Win=0 Len=0"
"4062","34.106502","10.0.0.14","52.84.151.30","TCP","56","34.106502000","57394  >  443 [RST] Seq=518 Win=0 Len=0"
"4064","34.107197","10.0.0.14","52.84.151.30","TCP","56","34.107197000","57394  >  443 [RST] Seq=518 Win=0 Len=0"
"4074","34.143932","10.0.0.14","52.84.151.30","TCP","68","34.143932000","57366  >  443 [ACK] Seq=2825 Ack=443 Win=64128 Len=0 TSval=1886225625 TSecr=1527797496"
"4076","34.144214","10.0.0.14","52.84.151.30","TLSv1.3","99","34.144214000","Application Data"
"4082","34.150918","10.0.0.14","52.84.151.30","TCP","68","34.150918000","57366  >  443 [ACK] Seq=2856 Ack=993 Win=64128 Len=0 TSval=1886225632 TSecr=1527797496"
"4083","34.151264","10.0.0.14","52.84.151.30","TLSv1.3","103","34.151264000","Application Data"
"4086","34.157108","10.0.0.14","52.84.151.30","TCP","68","34.157108000","57366  >  443 [ACK] Seq=2891 Ack=2026 Win=64128 Len=0 TSval=1886225638 TSecr=1527797504"
"4087","34.158210","10.0.0.14","52.84.151.30","TLSv1.3","103","34.158210000","Application Data"
"4088","34.158559","10.0.0.14","52.84.151.30","TLSv1.3","103","34.158559000","Application Data"
"4097","34.184080","10.0.0.14","52.84.151.30","TLSv1.3","1855","34.184080000","Application Data"
"4098","34.186598","10.0.0.14","52.84.151.30","TLSv1.3","285","34.186598000","Application Data"
"4116","34.249904","10.0.0.14","52.84.151.30","TLSv1.3","103","34.249904000","Application Data"
"4118","34.252136","10.0.0.14","52.84.151.30","TLSv1.3","103","34.252136000","Application Data"
"4147","34.357972","2a06:c701:472d:c000:6fff:6e94:31da:5893","2a03:2880:f242:c8:face:b00c:0:167","TLSv1.2","158","34.357972000","Application Data"
"4184","34.461530","2a06:c701:472d:c000:6fff:6e94:31da:5893","2606:4700::6812:a972","TCP","96","34.461530000","38386  >  443 [SYN] Seq=0 Win=64800 Len=0 MSS=1440 SACK_PERM=1 TSval=1321973196 TSecr=0 WS=128"
"4197","34.474931","2a06:c701:472d:c000:6fff:6e94:31da:5893","2606:4700::6812:a972","TCP","88","34.474931000","38386  >  443 [ACK] Seq=1 Ack=1 Win=64896 Len=0 TSval=1321973210 TSecr=3241500235"
"4198","34.475086","10.0.0.14","34.98.108.207","TCP","76","34.475086000","52150  >  443 [SYN] Seq=0 Win=64240 Len=0 MSS=1460 SACK_PERM=1 TSval=2118339887 TSecr=0 WS=128"
"4199","34.475425","2a06:c701:472d:c000:6fff:6e94:31da:5893","2606:4700::6812:a972","TLSv1.3","642","34.475425000","Client Hello"
"4204","34.489903","10.0.0.14","34.98.108.207","TCP","68","34.489903000","52150  >  443 [ACK] Seq=1 Ack=1 Win=64256 Len=0 TSval=2118339902 TSecr=3773206432"
"4205","34.490333","10.0.0.14","34.98.108.207","TLSv1.3","656","34.490333000","Client Hello"
"4210","34.495549","2a06:c701:472d:c000:6fff:6e94:31da:5893","2606:4700::6812:a972","TCP","88","34.495549000","38386  >  443 [ACK] Seq=555 Ack=213 Win=64768 Len=0 TSval=1321973230 TSecr=3241500254"
"4211","34.495818","2a06:c701:472d:c000:6fff:6e94:31da:5893","2606:4700::6812:a972","TLSv1.3","152","34.495818000","Change Cipher Spec, Application Data"
"4212","34.496075","2a06:c701:472d:c000:6fff:6e94:31da:5893","2a00:1450:4028:802::2008","TCP","96","34.496075000","47980  >  443 [SYN] Seq=0 Win=64800 Len=0 MSS=1440 SACK_PERM=1 TSval=1800919232 TSecr=0 WS=128"
"4213","34.496102","2a06:c701:472d:c000:6fff:6e94:31da:5893","2606:4700::6812:a972","TLSv1.3","186","34.496102000","Application Data"
"4214","34.496251","2a06:c701:472d:c000:6fff:6e94:31da:5893","2606:4700::6812:a972","TLSv1.3","613","34.496251000","Application Data"
"4217","34.504488","2a06:c701:472d:c000:6fff:6e94:31da:5893","2a03:2880:f242:c8:face:b00c:0:167","TCP","88","34.504488000","41846  >  443 [ACK] Seq=404 Ack=3065 Win=501 Len=0 TSval=3686308041 TSecr=439505765"
"4221","34.515294","2a06:c701:472d:c000:6fff:6e94:31da:5893","2606:4700::6812:a972","TLSv1.3","119","34.515294000","Application Data"
"4224","34.515697","2a06:c701:472d:c000:6fff:6e94:31da:5893","2a00:1450:4028:802::2008","TCP","88","34.515697000","47980  >  443 [ACK] Seq=1 Ack=1 Win=64896 Len=0 TSval=1800919252 TSecr=3308376412"
"4225","34.516010","2a06:c701:472d:c000:6fff:6e94:31da:5893","2a00:1450:4028:802::2008","TLSv1.3","605","34.516010000","Client Hello"
"4234","34.532625","2a06:c701:472d:c000:6fff:6e94:31da:5893","2606:4700::6812:a972","TCP","88","34.532625000","38386  >  443 [ACK] Seq=1273 Ack=1314 Win=64128 Len=0 TSval=1321973268 TSecr=3241500270"
"4235","34.532937","2a06:c701:472d:c000:6fff:6e94:31da:5893","2606:4700::6812:a972","TLSv1.3","123","34.532937000","Application Data"
"4259","34.568980","10.0.0.14","34.98.108.207","TCP","68","34.568980000","52150  >  443 [ACK] Seq=589 Ack=213 Win=64128 Len=0 TSval=2118339981 TSecr=3773206512"
"4260","34.569432","10.0.0.14","34.98.108.207","TLSv1.3","132","34.569432000","Change Cipher Spec, Application Data"
"4268","34.578069","10.0.0.14","206.247.61.33","TLSv1.2","111","34.578069000","Application Data"
"4275","34.597673","2a06:c701:472d:c000:6fff:6e94:31da:5893","2a00:1450:4028:802::2008","TCP","88","34.597673000","47980  >  443 [ACK] Seq=518 Ack=1209 Win=63744 Len=0 TSval=1800919333 TSecr=3308376496"
"4278","34.598298","2a06:c701:472d:c000:6fff:6e94:31da:5893","2a00:1450:4028:802::2008","TCP","88","34.598298000","47980  >  443 [ACK] Seq=518 Ack=2417 Win=63104 Len=0 TSval=1800919334 TSecr=3308376496"
"4279","34.598308","2a06:c701:472d:c000:6fff:6e94:31da:5893","2a00:1450:4028:802::2008","TCP","88","34.598308000","47980  >  443 [ACK] Seq=518 Ack=4814 Win=60800 Len=0 TSval=1800919334 TSecr=3308376496"
"4281","34.598698","2a06:c701:472d:c000:6fff:6e94:31da:5893","2a00:1450:4028:802::2008","TLSv1.3","162","34.598698000","Change Cipher Spec, Application Data"
"4289","34.619274","10.0.0.14","206.247.61.33","TLSv1.2","799","34.619274000","Application Data"
"4290","34.626040","10.0.0.14","34.98.108.207","TCP","68","34.626040000","52150  >  443 [ACK] Seq=653 Ack=799 Win=64128 Len=0 TSval=2118340038 TSecr=3773206527"
"4300","34.658019","2a06:c701:472d:c000:6fff:6e94:31da:5893","2a00:1450:4028:802::2008","TCP","88","34.658019000","47980  >  443 [ACK] Seq=592 Ack=5790 Win=64128 Len=0 TSval=1800919394 TSecr=3308376514"
"4400","34.822028","10.0.0.14","206.247.61.33","TCP","68","34.822028000","48200  >  443 [ACK] Seq=6393 Ack=4145 Win=501 Len=0 TSval=1279101476 TSecr=3341606125"
"4525","35.045042","10.0.0.14","206.247.61.33","TCP","68","35.045042000","48200  >  443 [ACK] Seq=6393 Ack=4217 Win=501 Len=0 TSval=1279101699 TSecr=3341606391"
"4545","35.074777","10.0.0.14","206.247.61.33","TLSv1.2","111","35.074777000","Application Data"
"4582","35.133068","2a06:c701:472d:c000:6fff:6e94:31da:5893","2a00:1450:4028:809::2003","TCP","96","35.133068000","55570  >  443 [SYN] Seq=0 Win=64800 Len=0 MSS=1440 SACK_PERM=1 TSval=1980626783 TSecr=0 WS=128"
"4583","35.133164","2a06:c701:472d:c000:6fff:6e94:31da:5893","2a00:1450:4028:808::200e","TCP","96","35.133164000","59260  >  443 [SYN] Seq=0 Win=64800 Len=0 MSS=1440 SACK_PERM=1 TSval=1524734887 TSecr=0 WS=128"
"4588","35.145689","2a06:c701:472d:c000:6fff:6e94:31da:5893","2a00:1450:4028:809::2003","TCP","88","35.145689000","55570  >  443 [ACK] Seq=1 Ack=1 Win=64896 Len=0 TSval=1980626796 TSecr=2868684257"
"4589","35.146032","2a06:c701:472d:c000:6fff:6e94:31da:5893","2a00:1450:4028:809::2003","TLSv1.3","605","35.146032000","Client Hello"
"4591","35.151302","2a06:c701:472d:c000:6fff:6e94:31da:5893","2a00:1450:4028:808::200e","TCP","88","35.151302000","59260  >  443 [ACK] Seq=1 Ack=1 Win=64896 Len=0 TSval=1524734905 TSecr=3130407457"
"4592","35.151574","2a06:c701:472d:c000:6fff:6e94:31da:5893","2a00:1450:4028:808::200e","TLSv1.3","605","35.151574000","Client Hello"
"4606","35.221777","2a06:c701:472d:c000:6fff:6e94:31da:5893","2a00:1450:4025:401::9b","TCP","96","35.221777000","42322  >  443 [SYN] Seq=0 Win=64800 Len=0 MSS=1440 SACK_PERM=1 TSval=2653214078 TSecr=0 WS=128"
"4652","35.239359","2a06:c701:472d:c000:6fff:6e94:31da:5893","2a00:1450:4028:808::200e","TCP","88","35.239359000","59260  >  443 [ACK] Seq=518 Ack=2417 Win=62592 Len=0 TSval=1524734993 TSecr=3130407545"
"4655","35.241980","2a06:c701:472d:c000:6fff:6e94:31da:5893","2a00:1450:4028:808::200e","TCP","88","35.241980000","59260  >  443 [ACK] Seq=518 Ack=4833 Win=61056 Len=0 TSval=1524734996 TSecr=3130407545"
"4656","35.242068","2a06:c701:472d:c000:6fff:6e94:31da:5893","2a00:1450:4028:808::200e","TCP","88","35.242068000","59260  >  443 [ACK] Seq=518 Ack=6041 Win=59904 Len=0 TSval=1524734996 TSecr=3130407545"
"4660","35.244366","2a06:c701:472d:c000:6fff:6e94:31da:5893","2a00:1450:4028:808::200e","TCP","88","35.244366000","59260  >  443 [ACK] Seq=518 Ack=6942 Win=63104 Len=0 TSval=1524734998 TSecr=3130407545"
"4661","35.244377","2a06:c701:472d:c000:6fff:6e94:31da:5893","2a00:1450:4028:809::2003","TCP","88","35.244377000","55570  >  443 [ACK] Seq=518 Ack=1209 Win=63744 Len=0 TSval=1980626894 TSecr=2868684346"
"4662","35.244388","2a06:c701:472d:c000:6fff:6e94:31da:5893","2a00:1450:4028:809::2003","TCP","100","35.244388000","[TCP Dup ACK 4661#1] 55570  >  443 [ACK] Seq=518 Ack=1209 Win=63744 Len=0 TSval=1980626894 TSecr=2868684346 SLE=2417 SRE=4469"
"4663","35.244948","2a06:c701:472d:c000:6fff:6e94:31da:5893","2a00:1450:4028:808::200e","TLSv1.3","162","35.244948000","Change Cipher Spec, Application Data"
"4665","35.248212","2a06:c701:472d:c000:6fff:6e94:31da:5893","2a00:1450:4028:809::2003","TCP","88","35.248212000","55570  >  443 [ACK] Seq=518 Ack=4469 Win=60544 Len=0 TSval=1980626898 TSecr=2868684346"
"4666","35.248605","2a06:c701:472d:c000:6fff:6e94:31da:5893","2a00:1450:4028:809::2003","TLSv1.3","162","35.248605000","Change Cipher Spec, Application Data"
"4700","35.303883","2a06:c701:472d:c000:6fff:6e94:31da:5893","2a00:1450:4025:401::9b","TCP","88","35.303883000","42322  >  443 [ACK] Seq=1 Ack=1 Win=64896 Len=0 TSval=2653214160 TSecr=3189292514"
"4701","35.304091","2a06:c701:472d:c000:6fff:6e94:31da:5893","2a00:1450:4025:401::9b","TLSv1.3","605","35.304091000","Client Hello"
"4708","35.314013","2a06:c701:472d:c000:6fff:6e94:31da:5893","2a00:1450:4028:808::200e","TCP","88","35.314013000","59260  >  443 [ACK] Seq=592 Ack=7910 Win=64128 Len=0 TSval=1524735068 TSecr=3130407572"
"4714","35.334374","10.0.0.14","206.247.61.33","TLSv1.2","106","35.334374000","Application Data"
"4731","35.392796","2a06:c701:472d:c000:6fff:6e94:31da:5893","2a00:1450:4025:401::9b","TCP","88","35.392796000","42322  >  443 [ACK] Seq=518 Ack=2417 Win=62592 Len=0 TSval=2653214249 TSecr=3189292600"
"4732","35.392828","2a06:c701:472d:c000:6fff:6e94:31da:5893","2a00:1450:4025:401::9b","TCP","88","35.392828000","42322  >  443 [ACK] Seq=518 Ack=3625 Win=61440 Len=0 TSval=2653214249 TSecr=3189292600"
"4735","35.397146","2a06:c701:472d:c000:6fff:6e94:31da:5893","2a00:1450:4025:401::9b","TCP","88","35.397146000","42322  >  443 [ACK] Seq=518 Ack=4709 Win=63104 Len=0 TSval=2653214253 TSecr=3189292600"
"4736","35.397593","2a06:c701:472d:c000:6fff:6e94:31da:5893","2a00:1450:4025:401::9b","TLSv1.3","162","35.397593000","Change Cipher Spec, Application Data"
"4760","35.527685","10.0.0.14","206.247.61.33","TCP","68","35.527685000","48200  >  443 [ACK] Seq=6474 Ack=4304 Win=501 Len=0 TSval=1279102182 TSecr=3341606834"
"4761","35.527896","10.0.0.14","206.247.61.33","TLSv1.2","135","35.527896000","Application Data"
"4768","35.574078","2a06:c701:472d:c000:6fff:6e94:31da:5893","2a00:1450:4025:401::9b","TCP","88","35.574078000","42322  >  443 [ACK] Seq=592 Ack=5683 Win=64128 Len=0 TSval=2653214430 TSecr=3189292740"
"4827","36.094101","10.0.0.14","206.247.61.33","TCP","68","36.094101000","48200  >  443 [ACK] Seq=6541 Ack=4376 Win=501 Len=0 TSval=1279102748 TSecr=3341607389"
"4828","36.110563","10.0.0.14","206.247.61.33","TLSv1.2","111","36.110563000","Application Data"
"4871","36.410405","10.0.0.14","206.247.61.33","TLSv1.2","106","36.410405000","Application Data"
"4886","36.528404","10.0.0.14","206.247.61.33","TLSv1.2","135","36.528404000","Application Data"
"4902","36.727296","2a06:c701:472d:c000:6fff:6e94:31da:5893","2a03:2880:f242:c8:face:b00c:0:167","TCP","88","36.727296000","41846  >  443 [ACK] Seq=404 Ack=3781 Win=496 Len=0 TSval=3686310264 TSecr=439507918"
"4911","36.750080","2a06:c701:472d:c000:6fff:6e94:31da:5893","2a03:2880:f242:c8:face:b00c:0:167","TCP","88","36.750080000","41846  >  443 [ACK] Seq=404 Ack=4548 Win=493 Len=0 TSval=3686310287 TSecr=439508009"
"4915","36.769985","2a06:c701:472d:c000:6fff:6e94:31da:5893","2a03:2880:f242:c8:face:b00c:0:167","TCP","100","36.769985000","[TCP Window Update] 41846  >  443 [ACK] Seq=404 Ack=4548 Win=501 Len=0 TSval=3686310307 TSecr=439508031 SLE=3781 SRE=4548"
"4916","36.774037","10.0.0.14","206.247.61.33","TCP","68","36.774037000","48214  >  443 [ACK] Seq=1051 Ack=871 Win=501 Len=0 TSval=1279103428 TSecr=3341608021"
"4945","37.135076","10.0.0.14","206.247.61.33","TCP","68","37.135076000","48200  >  443 [ACK] Seq=6584 Ack=4448 Win=501 Len=0 TSval=1279103789 TSecr=3341608393"
"4954","37.203225","10.0.0.14","206.247.61.33","TLSv1.2","111","37.203225000","Application Data"
"4957","37.219678","2a06:c701:472d:c000:6fff:6e94:31da:5893","2a03:2880:f242:c8:face:b00c:0:167","TLSv1.2","179","37.219678000","Application Data"
"4988","37.505625","2a06:c701:472d:c000:6fff:6e94:31da:5893","2a03:2880:f242:c8:face:b00c:0:167","TLSv1.2","184","37.505625000","Application Data"
"5000","37.569631","10.0.0.14","206.247.61.33","TCP","68","37.569631000","48200  >  443 [ACK] Seq=6627 Ack=4507 Win=501 Len=0 TSval=1279104223 TSecr=3341608914"
"5005","37.590230","10.0.0.14","206.247.61.33","TLSv1.2","111","37.590230000","Application Data"
"5051","37.853076","2a06:c701:472d:c000:6fff:6e94:31da:5893","2a00:1450:4028:808::2003","TCP","88","37.853076000","[TCP Previous segment not captured] 54488  >  443 [FIN, ACK] Seq=2 Ack=74 Win=501 Len=0 TSval=1142488531 TSecr=323314355"
"5053","37.868187","2a06:c701:472d:c000:6fff:6e94:31da:5893","2a00:1450:4028:808::2003","TCP","88","37.868187000","54488  >  443 [ACK] Seq=3 Ack=75 Win=501 Len=0 TSval=1142488546 TSecr=323314370"
"5147","39.038671","10.0.0.14","206.247.61.33","TLSv1.2","111","39.038671000","Application Data"
"5152","39.100250","10.0.0.14","206.247.61.33","TLSv1.2","106","39.100250000","Application Data"
"5170","39.286601","10.0.0.14","206.247.61.33","TCP","68","39.286601000","48200  >  443 [ACK] Seq=6751 Ack=4666 Win=501 Len=0 TSval=1279105940 TSecr=3341610600"
"5171","39.286734","10.0.0.14","206.247.61.33","TLSv1.2","135","39.286734000","Application Data"
"5200","39.534079","10.0.0.14","54.205.213.190","TCP","68","39.534079000","51892  >  443 [ACK] Seq=1 Ack=1 Win=501 Len=0 TSval=3369203996 TSecr=2326251847"
"5201","39.534113","10.0.0.14","35.174.127.31","TCP","68","39.534113000","35604  >  443 [ACK] Seq=1 Ack=1 Win=501 Len=0 TSval=3404540868 TSecr=350664605"
"5202","39.534148","10.0.0.14","54.205.213.190","TCP","68","39.534148000","51890  >  443 [ACK] Seq=1 Ack=1 Win=501 Len=0 TSval=3369203996 TSecr=2326251996"
"5280","40.171612","10.0.0.14","206.247.61.33","TLSv1.2","106","40.171612000","Application Data"
"5292","40.276199","10.0.0.14","206.247.61.33","TCP","68","40.276199000","48214  >  443 [ACK] Seq=1089 Ack=920 Win=501 Len=0 TSval=1279106930 TSecr=3341611621"
"5293","40.276443","10.0.0.14","206.247.61.33","TLSv1.2","135","40.276443000","Application Data"
"5306","40.410038","10.0.0.14","206.247.61.33","TCP","68","40.410038000","48214  >  443 [ACK] Seq=1156 Ack=958 Win=501 Len=0 TSval=1279107064 TSecr=3341611666"
"5320","40.547187","10.0.0.14","206.247.61.33","TCP","68","40.547187000","48200  >  443 [ACK] Seq=6818 Ack=4806 Win=501 Len=0 TSval=1279107201 TSecr=3341611893"
"5321","40.547317","10.0.0.14","206.247.61.33","TLSv1.2","111","40.547317000","Application Data"
"5624","42.852027","10.0.0.14","206.247.61.33","TLSv1.2","106","42.852027000","Application Data"
"5651","43.037014","10.0.0.14","206.247.61.33","TCP","68","43.037014000","48200  >  443 [ACK] Seq=6899 Ack=4893 Win=501 Len=0 TSval=1279109691 TSecr=3341614352"
"5652","43.037278","10.0.0.14","206.247.61.33","TLSv1.2","135","43.037278000","Application Data"
"5656","43.050180","10.0.0.14","206.247.61.33","TLSv1.2","111","43.050180000","Application Data"
"5666","43.107061","2a06:c701:472d:c000:6fff:6e94:31da:5893","2a03:2880:f242:c8:face:b00c:0:167","TLSv1.2","159","43.107061000","Application Data"
"5682","43.219745","2a06:c701:472d:c000:6fff:6e94:31da:5893","2a03:2880:f242:c8:face:b00c:0:167","TLSv1.2","196","43.219745000","Application Data"
"5693","43.366363","2a06:c701:472d:c000:6fff:6e94:31da:5893","2a03:2880:f242:c8:face:b00c:0:167","TCP","88","43.366363000","41846  >  443 [ACK] Seq=770 Ack=4643 Win=501 Len=0 TSval=3686316903 TSecr=439514627"
"5723","43.635330","2a06:c701:472d:c000:6fff:6e94:31da:5893","2407:30c0:182::aa72:3406","TCP","88","43.635330000","[TCP Dup ACK 1644#2] [TCP ACKed unseen segment] 57144  >  443 [ACK] Seq=1 Ack=2 Win=501 Len=0 TSval=1675786604 TSecr=4056673719"
"5746","43.795455","10.0.0.14","206.247.61.33","TCP","68","43.795455000","48200  >  443 [ACK] Seq=7009 Ack=5105 Win=501 Len=0 TSval=1279110449 TSecr=3341615142"
"5749","43.807639","10.0.0.14","206.247.61.33","TLSv1.2","111","43.807639000","Application Data"
"5769","43.899854","10.0.0.14","206.247.61.33","TLSv1.2","106","43.899854000","Application Data"
"5788","44.026264","10.0.0.14","206.247.61.33","TCP","68","44.026264000","48214  >  443 [ACK] Seq=1194 Ack=1007 Win=501 Len=0 TSval=1279110680 TSecr=3341615371"
"5789","44.026626","10.0.0.14","206.247.61.33","TLSv1.2","135","44.026626000","Application Data"
"5797","44.090063","10.0.0.14","206.247.61.33","TCP","68","44.090063000","48214  >  443 [ACK] Seq=1261 Ack=1045 Win=501 Len=0 TSval=1279110744 TSecr=3341615395"
"5805","44.142038","10.0.0.14","3.227.82.29","TCP","68","44.142038000","48496  >  443 [ACK] Seq=1 Ack=1 Win=501 Len=0 TSval=2204794240 TSecr=3717415634"
"5855","44.570154","10.0.0.14","206.247.61.33","TLSv1.2","111","44.570154000","Application Data"
"5857","44.570325","10.0.0.14","206.247.61.33","TLSv1.2","476","44.570325000","Application Data"
"5877","44.774057","10.0.0.14","206.247.61.33","TCP","68","44.774057000","48200  >  443 [ACK] Seq=7503 Ack=5220 Win=501 Len=0 TSval=1279111428 TSecr=3341616080"
"5904","45.045392","10.0.0.14","206.247.61.33","TCP","68","45.045392000","48200  >  443 [ACK] Seq=7503 Ack=5292 Win=501 Len=0 TSval=1279111699 TSecr=3341616392"
"5906","45.057103","10.0.0.14","206.247.61.33","TLSv1.2","111","45.057103000","Application Data"
"5917","45.070108","10.0.0.14","206.247.61.33","TLSv1.2","139","45.070108000","Application Data"
"5934","45.214069","2a06:c701:472d:c000:6fff:6e94:31da:5893","2a00:1450:4028:809::2003","TCP","88","45.214069000","55570  >  443 [ACK] Seq=592 Ack=4470 Win=64128 Len=0 TSval=1980636864 TSecr=2868694284"
"5943","45.225475","10.0.0.14","206.247.61.33","TLSv1.2","111","45.225475000","Application Data"
"5966","45.516407","2a06:c701:472d:c000:6fff:6e94:31da:5893","2a03:2880:f242:c8:face:b00c:0:167","TLSv1.2","261","45.516407000","Application Data"
"5979","45.669145","2a06:c701:472d:c000:6fff:6e94:31da:5893","2a03:2880:f242:c8:face:b00c:0:167","TCP","88","45.669145000","41846  >  443 [ACK] Seq=943 Ack=4738 Win=501 Len=0 TSval=3686319206 TSecr=439516930"
"5984","45.739991","10.0.0.14","206.247.61.33","TLSv1.2","266","45.739991000","Application Data"
"6003","45.958076","10.0.0.14","206.247.61.33","TCP","68","45.958076000","48200  >  443 [ACK] Seq=7858 Ack=5414 Win=501 Len=0 TSval=1279112612 TSecr=3341617258"
"6024","46.171403","2a06:c701:472d:c000:6fff:6e94:31da:5893","2a03:2880:f242:c8:face:b00c:0:167","TCP","88","46.171403000","41846  >  443 [ACK] Seq=943 Ack=4815 Win=501 Len=0 TSval=3686319708 TSecr=439517432"
"6059","46.579162","10.0.0.14","206.247.61.33","TLSv1.2","106","46.579162000","Application Data"
"6073","46.736505","10.0.0.14","206.247.61.33","TCP","68","46.736505000","48200  >  443 [ACK] Seq=7896 Ack=5452 Win=501 Len=0 TSval=1279113390 TSecr=3341618079"
"6080","46.785838","10.0.0.14","206.247.61.33","TCP","68","46.785838000","48200  >  443 [ACK] Seq=7896 Ack=5501 Win=501 Len=0 TSval=1279113440 TSecr=3341618132"
"6081","46.786109","10.0.0.14","206.247.61.33","TLSv1.2","135","46.786109000","Application Data"
"6107","47.087415","10.0.0.14","206.247.61.33","TLSv1.2","111","47.087415000","Application Data"
"6172","47.612553","10.0.0.14","206.247.61.33","TLSv1.2","106","47.612553000","Application Data"
"6177","47.673096","10.0.0.14","206.247.61.33","TLSv1.2","111","47.673096000","Application Data"
"6187","47.769909","10.0.0.14","206.247.61.33","TCP","68","47.769909000","48214  >  443 [ACK] Seq=1299 Ack=1083 Win=501 Len=0 TSval=1279114424 TSecr=3341619107"
"6191","47.776432","10.0.0.14","206.247.61.33","TCP","68","47.776432000","48214  >  443 [ACK] Seq=1299 Ack=1132 Win=501 Len=0 TSval=1279114430 TSecr=3341619122"
"6193","47.776666","10.0.0.14","206.247.61.33","TLSv1.2","135","47.776666000","Application Data"
"6245","48.319698","10.0.0.14","206.247.61.33","TLSv1.2","797","48.319698000","Application Data"
"6262","48.526070","10.0.0.14","206.247.61.33","TCP","68","48.526070000","48200  >  443 [ACK] Seq=8778 Ack=5675 Win=501 Len=0 TSval=1279115180 TSecr=3341619830"
"6279","48.755409","2a06:c701:472d:c000:6fff:6e94:31da:5893","2407:30c0:182::aa72:3406","TCP","88","48.755409000","[TCP Dup ACK 315#3] [TCP ACKed unseen segment] 57128  >  443 [ACK] Seq=1 Ack=2 Win=501 Len=0 TSval=1675791724 TSecr=4056555975"
"6337","49.451009","2a06:c701:472d:c000:6fff:6e94:31da:5893","2407:30c0:182::aa72:3404","TCP","88","49.451009000","[TCP Keep-Alive ACK] 45500  >  443 [ACK] Seq=2394 Ack=8317 Win=501 Len=0 TSval=217266983 TSecr=2075047896"
"6401","50.337988","10.0.0.14","206.247.61.33","TLSv1.2","106","50.337988000","Application Data"
"6416","50.491491","10.0.0.14","206.247.61.33","TCP","68","50.491491000","48200  >  443 [ACK] Seq=8816 Ack=5713 Win=501 Len=0 TSval=1279117145 TSecr=3341621838"
"6421","50.527970","10.0.0.14","206.247.61.33","TCP","68","50.527970000","48200  >  443 [ACK] Seq=8816 Ack=5762 Win=501 Len=0 TSval=1279117182 TSecr=3341621874"
"6422","50.528209","10.0.0.14","206.247.61.33","TLSv1.2","135","50.528209000","Application Data"
"6504","51.379424","10.0.0.14","206.247.61.33","TLSv1.2","106","51.379424000","Application Data"
"6516","51.525019","10.0.0.14","206.247.61.33","TLSv1.2","135","51.525019000","Application Data"
"6523","51.570108","10.0.0.14","206.247.61.33","TCP","68","51.570108000","48214  >  443 [ACK] Seq=1471 Ack=1219 Win=501 Len=0 TSval=1279118224 TSecr=3341622874"
"6540","51.822084","2a06:c701:472d:c000:6fff:6e94:31da:5893","2600:9000:2024:a00:e:4185:5680:93a1","TCP","88","51.822084000","[TCP Keep-Alive] 43746  >  443 [ACK] Seq=239 Ack=2099 Win=501 Len=0 TSval=2199335613 TSecr=3864262636"
"6587","52.465230","2a06:c701:472d:c000:6fff:6e94:31da:5893","2a00:1450:4028:809::2003","TCP","88","52.465230000","55570  >  443 [FIN, ACK] Seq=592 Ack=4470 Win=64128 Len=0 TSval=1980644115 TSecr=2868694284"
"6630","52.785824","10.0.0.14","52.204.76.25","TCP","76","52.785824000","44940  >  443 [SYN] Seq=0 Win=64240 Len=0 MSS=1460 SACK_PERM=1 TSval=3497324538 TSecr=0 WS=128"
"6631","52.786131","10.0.0.14","52.204.76.25","TCP","76","52.786131000","44942  >  443 [SYN] Seq=0 Win=64240 Len=0 MSS=1460 SACK_PERM=1 TSval=3497324538 TSecr=0 WS=128"
"6642","52.935172","10.0.0.14","52.204.76.25","TCP","68","52.935172000","44940  >  443 [ACK] Seq=1 Ack=1 Win=64256 Len=0 TSval=3497324687 TSecr=1693265291"
"6643","52.935765","10.0.0.14","52.204.76.25","TLSv1.2","585","52.935765000","Client Hello"
"6647","52.945112","10.0.0.14","52.204.76.25","TCP","68","52.945112000","44942  >  443 [ACK] Seq=1 Ack=1 Win=64256 Len=0 TSval=3497324697 TSecr=1693265301"
"6648","52.945710","10.0.0.14","52.204.76.25","TLSv1.2","585","52.945710000","Client Hello"
"6659","53.085684","2a06:c701:472d:c000:6fff:6e94:31da:5893","2a03:2880:f242:c8:face:b00c:0:167","TCP","88","53.085684000","41846  >  443 [ACK] Seq=943 Ack=4892 Win=501 Len=0 TSval=3686326623 TSecr=439524342"
"6662","53.105741","10.0.0.14","52.204.76.25","TCP","68","53.105741000","44940  >  443 [ACK] Seq=518 Ack=4198 Win=60160 Len=0 TSval=3497324858 TSecr=1693265450"
"6666","53.106734","10.0.0.14","52.204.76.25","TCP","68","53.106734000","44940  >  443 [ACK] Seq=518 Ack=5597 Win=63104 Len=0 TSval=3497324859 TSecr=1693265450"
"6668","53.106773","10.0.0.14","52.204.76.25","TCP","68","53.106773000","44940  >  443 [ACK] Seq=518 Ack=5980 Win=62848 Len=0 TSval=3497324859 TSecr=1693265454"
"6671","53.108754","10.0.0.14","52.204.76.25","TLSv1.2","194","53.108754000","Client Key Exchange, Change Cipher Spec, Encrypted Handshake Message"
"6672","53.109193","10.0.0.14","52.204.76.25","TCP","68","53.109193000","44942  >  443 [FIN, ACK] Seq=518 Ack=1 Win=64256 Len=0 TSval=3497324861 TSecr=1693265301"
"6673","53.109775","10.0.0.14","52.204.76.25","TLSv1.2","532","53.109775000","Application Data, Application Data"
"6674","53.110655","10.0.0.14","52.204.76.25","TLSv1.2","1119","53.110655000","Application Data, Application Data, Application Data"
"6677","53.118748","10.0.0.14","52.204.76.25","TCP","56","53.118748000","44942  >  443 [RST] Seq=518 Win=0 Len=0"
"6679","53.118802","10.0.0.14","52.204.76.25","TCP","56","53.118802000","44942  >  443 [RST] Seq=518 Win=0 Len=0"
"6684","53.143469","10.0.0.14","54.205.213.190","TCP","80","53.143469000","[TCP Previous segment not captured] 51892  >  443 [ACK] Seq=2 Ack=47 Win=501 Len=0 TSval=3369217605 TSecr=2326311688 SLE=78 SRE=79"
"6686","53.143862","10.0.0.14","54.205.213.190","TCP","68","53.143862000","51892  >  443 [ACK] Seq=2 Ack=79 Win=501 Len=0 TSval=3369217606 TSecr=2326311688"
"6696","53.257399","10.0.0.14","54.205.213.190","TCP","80","53.257399000","[TCP Previous segment not captured] 51890  >  443 [ACK] Seq=2 Ack=1 Win=501 Len=0 TSval=3369217719 TSecr=2326298228 SLE=78 SRE=79"
"6698","53.258151","10.0.0.14","54.205.213.190","TCP","80","53.258151000","51890  >  443 [ACK] Seq=2 Ack=47 Win=501 Len=0 TSval=3369217720 TSecr=2326311803 SLE=78 SRE=79"
"6700","53.258204","10.0.0.14","54.205.213.190","TCP","68","53.258204000","51890  >  443 [ACK] Seq=2 Ack=79 Win=501 Len=0 TSval=3369217720 TSecr=2326311803"
"6701","53.258432","10.0.0.14","54.205.213.190","TCP","68","53.258432000","51890  >  443 [FIN, ACK] Seq=2 Ack=79 Win=501 Len=0 TSval=3369217720 TSecr=2326311803"
"6706","53.266609","10.0.0.14","52.204.76.25","TCP","68","53.266609000","44940  >  443 [ACK] Seq=2159 Ack=6258 Win=64128 Len=0 TSval=3497325018 TSecr=1693265621"
"6707","53.266861","10.0.0.14","52.204.76.25","TLSv1.2","106","53.266861000","Application Data"
"6710","53.268858","10.0.0.14","52.204.76.25","TCP","68","53.268858000","44940  >  443 [ACK] Seq=2197 Ack=6993 Win=64128 Len=0 TSval=3497325021 TSecr=1693265624"
"6748","53.673366","10.0.0.14","35.174.127.31","TLSv1.2","315","53.673366000","[TCP Previous segment not captured] , Application Data"
"6761","53.820354","10.0.0.14","35.174.127.31","TCP","68","53.820354000","35604  >  443 [ACK] Seq=249 Ack=271 Win=499 Len=0 TSval=3404555154 TSecr=350724599"
"6766","53.874031","10.0.0.14","13.226.2.61","TCP","68","53.874031000","[TCP Keep-Alive] 40916  >  443 [ACK] Seq=1644 Ack=841 Win=64128 Len=0 TSval=257558262 TSecr=129825378"
"6784","54.109555","10.0.0.14","206.247.61.33","TLSv1.2","106","54.109555000","Application Data"
"6787","54.130096","10.0.0.14","104.121.10.34","TCP","68","54.130096000","[TCP Keep-Alive] 40162  >  443 [ACK] Seq=1312 Ack=13189 Win=501 Len=0 TSval=3060924288 TSecr=1792860770"
"6804","54.281131","10.0.0.14","206.247.61.33","TCP","68","54.281131000","48200  >  443 [ACK] Seq=8921 Ack=5849 Win=501 Len=0 TSval=1279120935 TSecr=3341625609"
"6805","54.281244","10.0.0.14","206.247.61.33","TLSv1.2","135","54.281244000","Application Data"
"6866","54.894038","10.0.0.14","140.82.114.26","TCP","68","54.894038000","[TCP Keep-Alive] 52020  >  443 [ACK] Seq=29 Ack=26 Win=501 Len=0 TSval=2097171980 TSecr=4146564868"
"6898","55.141303","10.0.0.14","206.247.61.33","TLSv1.2","106","55.141303000","Application Data"
"6909","55.271292","10.0.0.14","206.247.61.33","TCP","68","55.271292000","48214  >  443 [ACK] Seq=1509 Ack=1268 Win=501 Len=0 TSval=1279121925 TSecr=3341626616"
"6910","55.271525","10.0.0.14","206.247.61.33","TLSv1.2","135","55.271525000","Application Data"
"6917","55.334112","10.0.0.14","206.247.61.33","TCP","68","55.334112000","48214  >  443 [ACK] Seq=1576 Ack=1306 Win=501 Len=0 TSval=1279121988 TSecr=3341626636"
"7117","57.795968","10.0.0.14","206.247.61.33","TLSv1.2","111","57.795968000","Application Data"
"7126","57.867339","10.0.0.14","206.247.61.33","TLSv1.2","106","57.867339000","Application Data"
"7128","57.869964","10.0.0.14","206.247.61.33","TLSv1.2","139","57.869964000","Application Data"
"7135","57.970027","2a06:c701:472d:c000:6fff:6e94:31da:5893","2a00:1450:4028:809::200e","TCP","88","57.970027000","[TCP Dup ACK 1641#1] 50790  >  443 [ACK] Seq=1 Ack=1 Win=501 Len=0 TSval=531376999 TSecr=2567315497"
"7140","57.990096","2a06:c701:472d:c000:6fff:6e94:31da:5893","2a00:1450:4025:402::bc","TCP","88","57.990096000","[TCP Dup ACK 1642#1] 33154  >  443 [ACK] Seq=1 Ack=1 Win=501 Len=0 TSval=3191019245 TSecr=2728012793"
"7148","58.023457","10.0.0.14","206.247.61.33","TCP","68","58.023457000","48200  >  443 [ACK] Seq=9140 Ack=6025 Win=501 Len=0 TSval=1279124677 TSecr=3341629367"
"7150","58.032219","10.0.0.14","206.247.61.33","TLSv1.2","135","58.032219000","Application Data"
"7154","58.043763","10.0.0.14","206.247.61.33","TLSv1.2","111","58.043763000","Application Data"
"7185","58.301238","10.0.0.14","206.247.61.33","TLSv1.2","111","58.301238000","Application Data"
"7266","58.897471","10.0.0.14","206.247.61.33","TLSv1.2","106","58.897471000","Application Data"
"7278","58.995173","2a06:c701:472d:c000:6fff:6e94:31da:5893","2407:30c0:182::aa72:3406","TCP","88","58.995173000","[TCP Dup ACK 1644#3] [TCP ACKed unseen segment] 57144  >  443 [ACK] Seq=1 Ack=2 Win=501 Len=0 TSval=1675801964 TSecr=4056673719"
"7287","59.035400","10.0.0.14","206.247.61.33","TCP","68","59.035400000","48214  >  443 [ACK] Seq=1614 Ack=1355 Win=501 Len=0 TSval=1279125689 TSecr=3341630374"
"7288","59.035636","10.0.0.14","206.247.61.33","TLSv1.2","135","59.035636000","Application Data"
"7293","59.047454","10.0.0.14","206.247.61.33","TLSv1.2","111","59.047454000","Application Data"
"7297","59.094127","10.0.0.14","206.247.61.33","TCP","68","59.094127000","48214  >  443 [ACK] Seq=1681 Ack=1393 Win=501 Len=0 TSval=1279125748 TSecr=3341630392"
"7337","59.569827","10.0.0.14","206.247.61.33","TLSv1.2","475","59.569827000","Application Data"
"7359","59.774085","10.0.0.14","206.247.61.33","TCP","68","59.774085000","48200  >  443 [ACK] Seq=9743 Ack=6261 Win=501 Len=0 TSval=1279126428 TSecr=3341631080"
"7362","59.795896","10.0.0.14","206.247.61.33","TCP","68","59.795896000","48200  >  443 [ACK] Seq=9743 Ack=6333 Win=501 Len=0 TSval=1279126450 TSecr=3341631142"
"7364","59.795942","10.0.0.14","206.247.61.33","TCP","68","59.795942000","48200  >  443 [ACK] Seq=9743 Ack=6401 Win=501 Len=0 TSval=1279126450 TSecr=3341631142"
"7367","59.806546","10.0.0.14","206.247.61.33","TLSv1.2","111","59.806546000","Application Data"
"7431","60.303381","10.0.0.14","206.247.61.33","TLSv1.2","111","60.303381000","Application Data"
"7510","61.086873","10.0.0.14","206.247.61.33","TLSv1.2","111","61.086873000","Application Data"
"7561","61.618801","10.0.0.14","206.247.61.33","TLSv1.2","106","61.618801000","Application Data"
"7577","61.795262","10.0.0.14","206.247.61.33","TCP","68","61.795262000","48200  >  443 [ACK] Seq=9910 Ack=6632 Win=501 Len=0 TSval=1279128449 TSecr=3341633119"
"7578","61.795379","10.0.0.14","206.247.61.33","TLSv1.2","135","61.795379000","Application Data"
"7601","62.069787","10.0.0.14","206.247.61.33","TLSv1.2","797","62.069787000","Application Data"
"7602","62.070702","10.0.0.14","206.247.61.33","TLSv1.2","257","62.070702000","Application Data"
"7612","62.187060","2a06:c701:472d:c000:6fff:6e94:31da:5893","2a03:2880:f242:c8:face:b00c:0:167","TCP","88","62.187060000","41846  >  443 [ACK] Seq=943 Ack=4969 Win=501 Len=0 TSval=3686335724 TSecr=439533448"
"7623","62.286043","10.0.0.14","206.247.61.33","TCP","68","62.286043000","48200  >  443 [ACK] Seq=10895 Ack=6675 Win=501 Len=0 TSval=1279128940 TSecr=3341633581"
"7662","62.608849","10.0.0.14","206.247.61.33","TLSv1.2","106","62.608849000","Application Data"
"7677","62.758615","10.0.0.14","206.247.61.33","TCP","68","62.758615000","48214  >  443 [ACK] Seq=1719 Ack=1431 Win=501 Len=0 TSval=1279129412 TSecr=3341634104"
"7680","62.769211","10.0.0.14","206.247.61.33","TCP","68","62.769211000","48214  >  443 [ACK] Seq=1719 Ack=1480 Win=501 Len=0 TSval=1279129423 TSecr=3341634114"
"7681","62.769415","10.0.0.14","206.247.61.33","TLSv1.2","135","62.769415000","Application Data"
"7717","63.045256","10.0.0.14","206.247.61.33","TCP","68","63.045256000","48200  >  443 [ACK] Seq=10895 Ack=6747 Win=501 Len=0 TSval=1279129699 TSecr=3341634391"
"7718","63.078137","10.0.0.14","206.247.61.33","TLSv1.2","111","63.078137000","Application Data"
"7779","63.701590","2a06:c701:472d:c000:6fff:6e94:31da:5893","2a03:2880:f242:c8:face:b00c:0:167","TCP","88","63.701590000","41846  >  443 [ACK] Seq=943 Ack=5046 Win=501 Len=0 TSval=3686337238 TSecr=439534962"
"7780","63.717468","2a06:c701:472d:c000:6fff:6e94:31da:5893","2a03:2880:f242:c8:face:b00c:0:167","TLSv1.2","158","63.717468000","Application Data"
"7827","63.910104","2a06:c701:472d:c000:6fff:6e94:31da:5893","2a03:2880:f242:c8:face:b00c:0:167","TCP","88","63.910104000","41846  >  443 [ACK] Seq=1013 Ack=5118 Win=501 Len=0 TSval=3686337447 TSecr=439535123"
"7860","64.113830","2a06:c701:472d:c000:6fff:6e94:31da:5893","2407:30c0:182::aa72:3406","TCP","88","64.113830000","[TCP Dup ACK 315#4] [TCP ACKed unseen segment] 57128  >  443 [ACK] Seq=1 Ack=2 Win=501 Len=0 TSval=1675807083 TSecr=4056555975"
"7884","64.289837","10.0.0.14","206.247.61.33","TCP","68","64.289837000","48200  >  443 [ACK] Seq=10938 Ack=6887 Win=501 Len=0 TSval=1279130944 TSecr=3341635636"
"7890","64.318609","10.0.0.14","206.247.61.33","TLSv1.2","111","64.318609000","Application Data"
"7955","64.811688","2a06:c701:472d:c000:6fff:6e94:31da:5893","2407:30c0:182::aa72:3404","TCP","88","64.811688000","[TCP Keep-Alive ACK] 45500  >  443 [ACK] Seq=2394 Ack=8317 Win=501 Len=0 TSval=217282344 TSecr=2075047896"
"7979","65.079205","10.0.0.14","206.247.61.33","TLSv1.2","111","65.079205000","Application Data"
"8008","65.320471","10.0.0.14","206.247.61.33","TLSv1.2","106","65.320471000","Application Data"
"8009","65.320557","10.0.0.14","206.247.61.33","TLSv1.2","111","65.320557000","Application Data"
"8048","65.518091","10.0.0.14","206.247.61.33","TCP","68","65.518091000","48200  >  443 [ACK] Seq=11105 Ack=7069 Win=501 Len=0 TSval=1279132172 TSecr=3341636820"
"8051","65.532915","10.0.0.14","206.247.61.33","TCP","68","65.532915000","48200  >  443 [ACK] Seq=11105 Ack=7118 Win=501 Len=0 TSval=1279132187 TSecr=3341636879"
"8052","65.533208","10.0.0.14","206.247.61.33","TLSv1.2","135","65.533208000","Application Data"
"8117","66.076458","10.0.0.14","206.247.61.33","TLSv1.2","111","66.076458000","Application Data"
"8156","66.318636","10.0.0.14","206.247.61.33","TLSv1.2","111","66.318636000","Application Data"
"8172","66.373128","10.0.0.14","206.247.61.33","TLSv1.2","106","66.373128000","Application Data"
"8206","66.528987","10.0.0.14","206.247.61.33","TCP","68","66.528987000","48214  >  443 [ACK] Seq=1824 Ack=1567 Win=501 Len=0 TSval=1279133183 TSecr=3341637868"
"8207","66.529084","10.0.0.14","206.247.61.33","TLSv1.2","135","66.529084000","Application Data"
"8299","67.322333","10.0.0.14","206.247.61.33","TLSv1.2","111","67.322333000","Application Data"
"8352","67.674052","2a06:c701:472d:c000:6fff:6e94:31da:5893","2a03:2880:f242:c8:face:b00c:0:167","TCP","88","67.674052000","41846  >  443 [ACK] Seq=1013 Ack=5195 Win=501 Len=0 TSval=3686341211 TSecr=439538935"
"8356","67.768370","10.0.0.14","54.205.213.190","TCP","68","67.768370000","51892  >  443 [RST, ACK] Seq=2 Ack=79 Win=501 Len=0 TSval=3369232230 TSecr=2326311688"
"8375","67.812773","10.0.0.14","23.20.115.37","TCP","76","67.812773000","39104  >  443 [SYN] Seq=0 Win=64240 Len=0 MSS=1460 SACK_PERM=1 TSval=2894173573 TSecr=0 WS=128"
"8389","67.968979","10.0.0.14","23.20.115.37","TCP","68","67.968979000","39104  >  443 [ACK] Seq=1 Ack=1 Win=64256 Len=0 TSval=2894173729 TSecr=1901961878"
"8390","67.969740","10.0.0.14","23.20.115.37","TLSv1.2","585","67.969740000","Client Hello"
"8392","67.974098","10.0.0.14","206.247.61.33","TCP","68","67.974098000","48200  >  443 [ACK] Seq=11301 Ack=7393 Win=501 Len=0 TSval=1279134628 TSecr=3341639170"
"8393","67.977651","10.0.0.14","206.247.61.33","TLSv1.2","111","67.977651000","Application Data"
"8406","68.118395","2a06:c701:472d:c000:6fff:6e94:31da:5893","2a03:2880:f242:c8:face:b00c:0:167","TCP","88","68.118395000","41846  >  443 [ACK] Seq=1013 Ack=5911 Win=496 Len=0 TSval=3686341655 TSecr=439539379"
"8409","68.123862","10.0.0.14","23.20.115.37","TCP","68","68.123862000","39104  >  443 [ACK] Seq=518 Ack=157 Win=64128 Len=0 TSval=2894173884 TSecr=1901962036"
"8410","68.124361","10.0.0.14","23.20.115.37","TLSv1.2","119","68.124361000","Change Cipher Spec, Encrypted Handshake Message"
"8411","68.124801","10.0.0.14","23.20.115.37","TLSv1.2","173","68.124801000","Application Data"
"8412","68.125129","10.0.0.14","23.20.115.37","TLSv1.2","425","68.125129000","Application Data"
"8413","68.125212","10.0.0.14","23.20.115.37","TLSv1.2","2659","68.125212000","Application Data"
"8430","68.274073","10.0.0.14","23.20.115.37","TCP","68","68.274073000","39104  >  443 [ACK] Seq=3622 Ack=264 Win=64128 Len=0 TSval=2894174034 TSecr=1901962187"
"8431","68.274295","10.0.0.14","23.20.115.37","TLSv1.2","106","68.274295000","Application Data"
"8443","68.409160","10.0.0.14","104.121.10.34","TLSv1.2","713","68.409160000","Application Data"
"8457","68.475561","2a06:c701:472d:c000:6fff:6e94:31da:5893","2a03:2880:f242:c8:face:b00c:0:167","TCP","88","68.475561000","41846  >  443 [ACK] Seq=1013 Ack=6678 Win=493 Len=0 TSval=3686342012 TSecr=439539715"
"8460","68.522129","2a06:c701:472d:c000:6fff:6e94:31da:5893","2a03:2880:f242:c8:face:b00c:0:167","TLSv1.2","179","68.522129000","Application Data"
"8466","68.610054","2a06:c701:472d:c000:6fff:6e94:31da:5893","2a03:2880:f242:c8:face:b00c:0:167","TLSv1.2","191","68.610054000","Application Data"
"8487","68.730237","2a06:c701:472d:c000:6fff:6e94:31da:5893","2a03:2880:f242:c8:face:b00c:0:167","TLSv1.2","184","68.730237000","Application Data"
"8500","68.760643","10.0.0.14","104.121.10.34","TCP","68","68.760643000","40162  >  443 [ACK] Seq=1958 Ack=14923 Win=488 Len=0 TSval=3060938919 TSecr=1792920547"
"8501","68.762744","10.0.0.14","104.121.10.34","TLSv1.2","735","68.762744000","Application Data"
"8504","68.809857","2a06:c701:472d:c000:6fff:6e94:31da:5893","2a03:2880:f242:c8:face:b00c:0:167","TLSv1.2","220","68.809857000","Application Data"
"8509","68.881106","2a06:c701:472d:c000:6fff:6e94:31da:5893","2a03:2880:f242:c8:face:b00c:0:167","TCP","88","68.881106000","41846  >  443 [ACK] Seq=1435 Ack=6768 Win=501 Len=0 TSval=3686342418 TSecr=439540026"
"8526","68.896899","2a06:c701:472d:c000:6fff:6e94:31da:5893","2a03:2880:f242:c8:face:b00c:0:167","TCP","100","68.896899000","[TCP Dup ACK 8509#1] 41846  >  443 [ACK] Seq=1435 Ack=6768 Win=501 Len=0 TSval=3686342434 TSecr=439540158 SLE=6678 SRE=6768"
"8560","69.028944","2a06:c701:472d:c000:6fff:6e94:31da:5893","2a03:2880:f242:c8:face:b00c:0:167","TCP","88","69.028944000","41846  >  443 [ACK] Seq=1435 Ack=6863 Win=501 Len=0 TSval=3686342566 TSecr=439540289"
"8564","69.043111","10.0.0.14","206.247.61.33","TCP","68","69.043111000","48200  >  443 [ACK] Seq=11344 Ack=7465 Win=501 Len=0 TSval=1279135697 TSecr=3341640390"
"8566","69.079293","10.0.0.14","206.247.61.33","TLSv1.2","106","69.079293000","Application Data"
"8567","69.079427","10.0.0.14","206.247.61.33","TLSv1.2","111","69.079427000","Application Data"
"8586","69.248232","10.0.0.14","104.121.10.34","TCP","68","69.248232000","40162  >  443 [ACK] Seq=2625 Ack=16839 Win=501 Len=0 TSval=3060939406 TSecr=1792921035"
"8588","69.251513","10.0.0.14","104.121.10.34","TCP","68","69.251513000","40162  >  443 [ACK] Seq=2625 Ack=19637 Win=501 Len=0 TSval=3060939409 TSecr=1792921036"
"8592","69.253778","10.0.0.14","104.121.10.34","TCP","68","69.253778000","40162  >  443 [ACK] Seq=2625 Ack=22435 Win=501 Len=0 TSval=3060939412 TSecr=1792921040"
"8594","69.257510","10.0.0.14","104.121.10.34","TCP","68","69.257510000","40162  >  443 [ACK] Seq=2625 Ack=25233 Win=501 Len=0 TSval=3060939415 TSecr=1792921043"
"8598","69.278036","10.0.0.14","206.247.61.33","TCP","68","69.278036000","48200  >  443 [ACK] Seq=11425 Ack=7503 Win=501 Len=0 TSval=1279135932 TSecr=3341640579"
"8600","69.283004","10.0.0.14","206.247.61.33","TCP","68","69.283004000","48200  >  443 [ACK] Seq=11425 Ack=7552 Win=501 Len=0 TSval=1279135937 TSecr=3341640630"
"8601","69.283123","10.0.0.14","206.247.61.33","TLSv1.2","135","69.283123000","Application Data"
"8604","69.306079","10.0.0.14","104.121.10.34","TCP","68","69.306079000","40162  >  443 [ACK] Seq=2625 Ack=26376 Win=501 Len=0 TSval=3060939464 TSecr=1792921047"
"8623","69.505381","10.0.0.14","140.82.114.26","TLSv1.2","97","69.505381000","Application Data"
"8637","69.677376","10.0.0.14","35.174.127.31","TCP","68","69.677376000","35604  >  443 [ACK] Seq=249 Ack=309 Win=501 Len=0 TSval=3404571011 TSecr=350740457"
"8701","70.149287","10.0.0.14","206.247.61.33","TLSv1.2","106","70.149287000","Application Data"
"8710","70.251490","2a06:c701:472d:c000:6fff:6e94:31da:5893","2a03:2880:f242:c8:face:b00c:0:167","TLSv1.2","196","70.251490000","Application Data"
"8713","70.274309","10.0.0.14","206.247.61.33","TLSv1.2","135","70.274309000","Application Data"
"8724","70.350122","10.0.0.14","206.247.61.33","TCP","68","70.350122000","48214  >  443 [ACK] Seq=1996 Ack=1654 Win=501 Len=0 TSval=1279137004 TSecr=3341641644"
"8727","70.397867","2a06:c701:472d:c000:6fff:6e94:31da:5893","2a03:2880:f242:c8:face:b00c:0:167","TCP","88","70.397867000","41846  >  443 [ACK] Seq=1543 Ack=6958 Win=501 Len=0 TSval=3686343935 TSecr=439541658"
"8757","70.719411","10.0.0.14","206.247.61.33","TLSv1.2","139","70.719411000","Application Data"
"8773","70.877189","10.0.0.14","206.247.61.33","TCP","68","70.877189000","48200  >  443 [ACK] Seq=11563 Ack=7666 Win=501 Len=0 TSval=1279137531 TSecr=3341642224"
"8776","70.879645","10.0.0.14","206.247.61.33","TLSv1.2","247","70.879645000","Application Data"
"8797","71.086074","10.0.0.14","206.247.61.33","TCP","68","71.086074000","48200  >  443 [ACK] Seq=11742 Ack=7709 Win=501 Len=0 TSval=1279137740 TSecr=3341642389"
"8844","71.544129","10.0.0.14","206.247.61.33","TCP","68","71.544129000","48200  >  443 [ACK] Seq=11742 Ack=7781 Win=501 Len=0 TSval=1279138198 TSecr=3341642890"
"8849","71.586684","10.0.0.14","206.247.61.33","TLSv1.2","111","71.586684000","Application Data"
"8873","71.794542","10.0.0.14","206.247.61.33","TCP","68","71.794542000","48200  >  443 [ACK] Seq=11785 Ack=7853 Win=501 Len=0 TSval=1279138448 TSecr=3341643141"
"8874","71.794855","10.0.0.14","206.247.61.33","TLSv1.2","111","71.794855000","Application Data"
"8913","72.086077","10.0.0.14","206.247.61.33","TCP","68","72.086077000","48200  >  443 [ACK] Seq=11828 Ack=7925 Win=501 Len=0 TSval=1279138740 TSecr=3341643391"
"8915","72.098206","10.0.0.14","206.247.61.33","TLSv1.2","111","72.098206000","Application Data"
"8942","72.295158","10.0.0.14","206.247.61.33","TCP","68","72.295158000","48200  >  443 [ACK] Seq=11871 Ack=7997 Win=501 Len=0 TSval=1279138949 TSecr=3341643641"
"8943","72.295453","10.0.0.14","206.247.61.33","TLSv1.2","111","72.295453000","Application Data"
"8961","72.420257","2a06:c701:472d:c000:6fff:6e94:31da:5893","2a03:2880:f242:c8:face:b00c:0:167","TCP","88","72.420257000","41846  >  443 [ACK] Seq=1543 Ack=7035 Win=501 Len=0 TSval=3686345957 TSecr=439543681"
"8982","72.586076","10.0.0.14","206.247.61.33","TCP","68","72.586076000","48200  >  443 [ACK] Seq=11914 Ack=8069 Win=501 Len=0 TSval=1279139240 TSecr=3341643892"
"8984","72.598687","10.0.0.14","206.247.61.33","TLSv1.2","111","72.598687000","Application Data"
"9015","72.838258","10.0.0.14","206.247.61.33","TLSv1.2","106","72.838258000","Application Data"
"9035","72.992492","10.0.0.14","206.247.61.33","TCP","68","72.992492000","48200  >  443 [ACK] Seq=11995 Ack=8107 Win=501 Len=0 TSval=1279139646 TSecr=3341644338"
"9042","73.033655","10.0.0.14","206.247.61.33","TCP","68","73.033655000","48200  >  443 [ACK] Seq=11995 Ack=8156 Win=501 Len=0 TSval=1279139688 TSecr=3341644381"
"9043","73.033935","10.0.0.14","206.247.61.33","TLSv1.2","135","73.033935000","Application Data"
"9153","73.834044","10.0.0.14","206.247.61.33","TCP","68","73.834044000","48200  >  443 [ACK] Seq=12062 Ack=8228 Win=501 Len=0 TSval=1279140488 TSecr=3341645139"
"9154","73.840814","10.0.0.14","206.247.61.33","TLSv1.2","111","73.840814000","Application Data"
"9162","73.898136","10.0.0.14","206.247.61.33","TLSv1.2","106","73.898136000","Application Data"
"9175","74.022404","10.0.0.14","206.247.61.33","TCP","68","74.022404000","48214  >  443 [ACK] Seq=2034 Ack=1703 Win=501 Len=0 TSval=1279140676 TSecr=3341645367"
"9176","74.022581","10.0.0.14","206.247.61.33","TLSv1.2","135","74.022581000","Application Data"
"9182","74.094074","10.0.0.14","206.247.61.33","TCP","68","74.094074000","48214  >  443 [ACK] Seq=2101 Ack=1741 Win=501 Len=0 TSval=1279140748 TSecr=3341645393"
"9207","74.350083","10.0.0.14","142.251.142.195","TCP","68","74.350083000","[TCP Dup ACK 3361#1] 59140  >  443 [ACK] Seq=1 Ack=1 Win=501 Len=0 TSval=3786743956 TSecr=833708770"
"9209","74.354415","2a06:c701:472d:c000:6fff:6e94:31da:5893","2407:30c0:182::aa72:3406","TCP","88","74.354415000","[TCP Dup ACK 1644#4] [TCP ACKed unseen segment] 57144  >  443 [ACK] Seq=1 Ack=2 Win=501 Len=0 TSval=1675817323 TSecr=4056673719"
"9227","74.569301","10.0.0.14","206.247.61.33","TLSv1.2","476","74.569301000","Application Data"
"9240","74.726865","10.0.0.14","206.247.61.33","TCP","68","74.726865000","48200  >  443 [ACK] Seq=12513 Ack=8271 Win=501 Len=0 TSval=1279141381 TSecr=3341646074"
"9263","75.039937","10.0.0.14","206.247.61.33","TCP","68","75.039937000","48200  >  443 [ACK] Seq=12513 Ack=8343 Win=501 Len=0 TSval=1279141694 TSecr=3341646386"
"9264","75.079976","10.0.0.14","206.247.61.33","TLSv1.2","111","75.079976000","Application Data"
"9324","75.819981","10.0.0.14","206.247.61.33","TLSv1.2","801","75.819981000","Application Data"
"9332","75.877482","10.0.0.14","206.247.61.33","TLSv1.2","265","75.877482000","Application Data"
"9340","75.976464","10.0.0.14","206.247.61.33","TCP","68","75.976464000","48200  >  443 [ACK] Seq=13486 Ack=8386 Win=501 Len=0 TSval=1279142630 TSecr=3341647323"
"9349","76.039201","10.0.0.14","206.247.61.33","TCP","68","76.039201000","48200  >  443 [ACK] Seq=13486 Ack=8429 Win=501 Len=0 TSval=1279142693 TSecr=3341647385"
"9395","76.622788","10.0.0.14","206.247.61.33","TLSv1.2","106","76.622788000","Application Data"
"9413","76.775978","10.0.0.14","206.247.61.33","TCP","68","76.775978000","48200  >  443 [ACK] Seq=13524 Ack=8467 Win=501 Len=0 TSval=1279143430 TSecr=3341648122"
"9415","76.777976","10.0.0.14","206.247.61.33","TCP","68","76.777976000","48200  >  443 [ACK] Seq=13524 Ack=8516 Win=501 Len=0 TSval=1279143432 TSecr=3341648125"
"9416","76.778222","10.0.0.14","206.247.61.33","TLSv1.2","135","76.778222000","Application Data"
"9442","77.070208","10.0.0.14","206.247.61.33","TLSv1.2","111","77.070208000","Application Data"
"9490","77.538563","10.0.0.14","206.247.61.33","TCP","68","77.538563000","48200  >  443 [ACK] Seq=13634 Ack=8728 Win=501 Len=0 TSval=1279144192 TSecr=3341648884"
"9493","77.552621","10.0.0.14","206.247.61.33","TLSv1.2","111","77.552621000","Application Data"
"9515","77.657135","10.0.0.14","206.247.61.33","TLSv1.2","106","77.657135000","Application Data"
"9537","77.769665","10.0.0.14","206.247.61.33","TCP","68","77.769665000","48214  >  443 [ACK] Seq=2139 Ack=1790 Win=501 Len=0 TSval=1279144424 TSecr=3341649114"
"9538","77.769910","10.0.0.14","206.247.61.33","TLSv1.2","135","77.769910000","Application Data"
"9553","77.858036","10.0.0.14","206.247.61.33","TCP","68","77.858036000","48214  >  443 [ACK] Seq=2206 Ack=1828 Win=501 Len=0 TSval=1279144512 TSecr=3341649156"
"9561","77.904234","10.0.0.14","206.247.61.33","TLSv1.2","111","77.904234000","Application Data"
