"No.","Time","Source","Destination","Protocol","Length","Time since reference or first frame","Info"
"4","0.171677","10.0.0.14","159.124.42.26","TLSv1.2","106","0.171677000","Application Data"
"11","0.288423","10.0.0.14","159.124.42.26","TCP","68","0.288423000","36690  >  443 [ACK] Seq=39 Ack=39 Win=501 Len=0 TSval=2183453965 TSecr=1967046973"
"26","0.389663","10.0.0.14","159.124.42.26","TCP","68","0.389663000","36690  >  443 [ACK] Seq=39 Ack=88 Win=501 Len=0 TSval=2183454066 TSecr=1967047012"
"27","0.389781","10.0.0.14","159.124.42.26","TLSv1.2","135","0.389781000","Application Data"
"46","0.593630","10.0.0.14","159.124.42.26","TLSv1.2","106","0.593630000","Application Data"
"49","0.658878","10.0.0.14","159.124.42.26","TCP","68","0.658878000","36698  >  443 [ACK] Seq=39 Ack=39 Win=501 Len=0 TSval=2183454335 TSecr=1967047385"
"62","0.796808","10.0.0.14","159.124.42.26","TCP","68","0.796808000","36698  >  443 [ACK] Seq=39 Ack=88 Win=501 Len=0 TSval=2183454473 TSecr=1967047438"
"63","0.797001","10.0.0.14","159.124.42.26","TLSv1.2","135","0.797001000","Application Data"
"84","1.035860","10.0.0.14","159.124.42.26","TLSv1.2","111","1.035860000","Application Data"
"225","3.080468","10.0.0.14","159.124.42.26","TCP","68","3.080468000","36690  >  443 [ACK] Seq=149 Ack=232 Win=501 Len=0 TSval=2183456757 TSecr=1967049754"
"226","3.087278","10.0.0.14","159.124.42.26","TLSv1.2","111","3.087278000","Application Data"
"236","3.279791","10.0.0.14","159.124.42.26","TCP","68","3.279791000","36690  >  443 [ACK] Seq=192 Ack=304 Win=501 Len=0 TSval=2183456956 TSecr=1967050008"
"237","3.280004","10.0.0.14","159.124.42.26","TLSv1.2","111","3.280004000","Application Data"
"244","3.440446","2a06:c701:472d:c000:f796:c198:3a7:a863","2a03:2880:f242:c8:face:b00c:0:167","TCP","88","3.440446000","50310  >  443 [ACK] Seq=1 Ack=252 Win=500 Len=0 TSval=1246460421 TSecr=607079672"
"249","3.584281","2a06:c701:472d:c000:f796:c198:3a7:a863","2a03:2880:f242:c8:face:b00c:0:167","TLSv1.2","184","3.584281000","Application Data"
"260","3.836468","2a06:c701:472d:c000:f796:c198:3a7:a863","2a03:2880:f242:c8:face:b00c:0:167","TLSv1.2","181","3.836468000","Application Data"
"261","3.837032","2a06:c701:472d:c000:f796:c198:3a7:a863","2a03:2880:f242:c8:face:b00c:0:167","TLSv1.2","181","3.837032000","Application Data"
"263","3.879955","10.0.0.14","159.124.42.26","TLSv1.2","111","3.879955000","Application Data"
"273","3.901715","10.0.0.14","159.124.42.26","TLSv1.2","106","3.901715000","Application Data"
"293","3.988075","2a06:c701:472d:c000:f796:c198:3a7:a863","2a03:2880:f242:c8:face:b00c:0:167","TCP","88","3.988075000","50310  >  443 [ACK] Seq=283 Ack=326 Win=501 Len=0 TSval=1246460969 TSecr=607080220"
"294","3.988124","2a06:c701:472d:c000:f796:c198:3a7:a863","2a03:2880:f242:c8:face:b00c:0:167","TCP","88","3.988124000","50310  >  443 [ACK] Seq=283 Ack=400 Win=501 Len=0 TSval=1246460969 TSecr=607080220"
"316","4.016381","10.0.0.14","159.124.42.26","TCP","68","4.016381000","36690  >  443 [ACK] Seq=316 Ack=401 Win=501 Len=0 TSval=2183457693 TSecr=1967050697"
"318","4.031341","10.0.0.14","159.124.42.26","TCP","68","4.031341000","36690  >  443 [ACK] Seq=316 Ack=450 Win=501 Len=0 TSval=2183457708 TSecr=1967050759"
"319","4.031552","10.0.0.14","159.124.42.26","TLSv1.2","135","4.031552000","Application Data"
"323","4.047124","2a06:c701:472d:c000:f796:c198:3a7:a863","2407:30c0:182::aa72:3406","TCP","88","4.047124000","[TCP ACKed unseen segment] 57446  >  443 [ACK] Seq=1 Ack=2 Win=501 Len=0 TSval=680111426 TSecr=3899337116"
"396","4.260344","2a06:c701:472d:c000:f796:c198:3a7:a863","2407:30c0:182::aa72:3406","TCP","88","4.260344000","[TCP ACKed unseen segment] 57458  >  443 [ACK] Seq=1 Ack=2 Win=501 Len=0 TSval=680111639 TSecr=2970038552"
"397","4.299861","2a06:c701:472d:c000:f796:c198:3a7:a863","2600:9000:2024:f800:e:4185:5680:93a1","TLSv1.2","156","4.299861000","Application Data"
"398","4.300195","2a06:c701:472d:c000:f796:c198:3a7:a863","2600:9000:2024:f800:e:4185:5680:93a1","TLSv1.2","127","4.300195000","Application Data"
"399","4.301070","2a06:c701:472d:c000:f796:c198:3a7:a863","2600:9000:2024:f800:e:4185:5680:93a1","TLSv1.2","150","4.301070000","Application Data"
"404","4.356350","2a06:c701:472d:c000:f796:c198:3a7:a863","2600:9000:2024:f800:e:4185:5680:93a1","TCP","88","4.356350000","41114  >  443 [ACK] Seq=170 Ack=40 Win=501 Len=0 TSval=2397529590 TSecr=1132203585"
"407","4.382590","2a06:c701:472d:c000:f796:c198:3a7:a863","2600:9000:2024:f800:e:4185:5680:93a1","TCP","88","4.382590000","41114  >  443 [ACK] Seq=170 Ack=1066 Win=493 Len=0 TSval=2397529616 TSecr=1132203654"
"408","4.383463","2a06:c701:472d:c000:f796:c198:3a7:a863","2600:9000:2024:f800:e:4185:5680:93a1","TLSv1.2","123","4.383463000","Application Data"
"410","4.383868","10.0.0.14","159.124.42.26","TLSv1.2","106","4.383868000","Application Data"
"412","4.392169","2a06:c701:472d:c000:f796:c198:3a7:a863","2600:9000:2024:f800:e:4185:5680:93a1","TLSv1.2","123","4.392169000","Application Data"
"424","4.451524","2a06:c701:472d:c000:f796:c198:3a7:a863","2a03:2880:f242:c8:face:b00c:0:167","TCP","88","4.451524000","50310  >  443 [ACK] Seq=283 Ack=1850 Win=490 Len=0 TSval=1246461432 TSecr=607080683"
"426","4.452801","2a06:c701:472d:c000:f796:c198:3a7:a863","2a03:2880:f242:c8:face:b00c:0:167","TCP","88","4.452801000","50310  >  443 [ACK] Seq=283 Ack=2919 Win=493 Len=0 TSval=1246461433 TSecr=607080684"
"428","4.457420","10.0.0.14","159.124.42.26","TCP","68","4.457420000","36698  >  443 [ACK] Seq=144 Ack=175 Win=501 Len=0 TSval=2183458134 TSecr=1967051175"
"429","4.457551","10.0.0.14","159.124.42.26","TLSv1.2","135","4.457551000","Application Data"
"481","4.799782","2a06:c701:472d:c000:f796:c198:3a7:a863","2a03:2880:f242:c8:face:b00c:0:167","TLSv1.2","187","4.799782000","Application Data"
"488","4.825817","10.0.0.14","159.124.42.26","TLSv1.2","139","4.825817000","Application Data"
"500","4.895114","10.0.0.14","159.124.42.26","TCP","68","4.895114000","36690  >  443 [ACK] Seq=454 Ack=564 Win=501 Len=0 TSval=2183458572 TSecr=1967051622"
"502","4.906412","10.0.0.14","159.124.42.26","TLSv1.2","111","4.906412000","Application Data"
"735","5.306379","10.0.0.14","159.124.42.26","TLSv1.2","111","5.306379000","Application Data"
"825","7.186919","10.0.0.14","54.243.239.188","TCP","76","7.186919000","42442  >  443 [SYN] Seq=0 Win=64240 Len=0 MSS=1460 SACK_PERM=1 TSval=2514182319 TSecr=0 WS=128"
"835","7.342499","10.0.0.14","54.243.239.188","TCP","68","7.342499000","42442  >  443 [ACK] Seq=1 Ack=1 Win=64256 Len=0 TSval=2514182475 TSecr=613101909"
"836","7.343083","10.0.0.14","54.243.239.188","TLSv1.2","585","7.343083000","Client Hello"
"843","7.503478","10.0.0.14","54.243.239.188","TCP","68","7.503478000","42442  >  443 [ACK] Seq=518 Ack=157 Win=64128 Len=0 TSval=2514182636 TSecr=613102072"
"845","7.510160","10.0.0.14","54.243.239.188","TLSv1.2","119","7.510160000","Change Cipher Spec, Encrypted Handshake Message"
"846","7.510485","10.0.0.14","54.243.239.188","TLSv1.2","173","7.510485000","Application Data"
"847","7.510762","10.0.0.14","54.243.239.188","TLSv1.2","425","7.510762000","Application Data"
"848","7.510821","10.0.0.14","54.243.239.188","TLSv1.2","2076","7.510821000","Application Data"
"853","7.623170","10.0.0.14","104.121.10.34","TLSv1.2","713","7.623170000","Application Data"
"854","7.655900","10.0.0.14","159.124.42.26","TLSv1.2","106","7.655900000","Application Data"
"858","7.676431","10.0.0.14","54.243.239.188","TCP","68","7.676431000","42442  >  443 [ACK] Seq=3039 Ack=264 Win=64128 Len=0 TSval=2514182809 TSecr=613102233"
"859","7.676569","10.0.0.14","54.243.239.188","TLSv1.2","106","7.676569000","Application Data"
"867","7.728471","10.0.0.14","54.243.239.188","TCP","68","7.728471000","42442  >  443 [ACK] Seq=3077 Ack=636 Win=64128 Len=0 TSval=2514182861 TSecr=613102239"
"868","7.764388","10.0.0.14","159.124.42.26","TCP","68","7.764388000","36690  >  443 [ACK] Seq=578 Ack=674 Win=501 Len=0 TSval=2183461441 TSecr=1967054446"
"870","7.778078","10.0.0.14","159.124.42.26","TCP","68","7.778078000","36690  >  443 [ACK] Seq=578 Ack=723 Win=501 Len=0 TSval=2183461455 TSecr=1967054506"
"871","7.778301","10.0.0.14","159.124.42.26","TLSv1.2","135","7.778301000","Application Data"
"876","7.872679","10.0.0.14","104.121.10.34","TCP","68","7.872679000","46628  >  443 [ACK] Seq=646 Ack=1735 Win=488 Len=0 TSval=3058238524 TSecr=869937600"
"878","7.877416","10.0.0.14","104.121.10.34","TLSv1.2","735","7.877416000","Application Data"
"889","8.153658","10.0.0.14","159.124.42.26","TLSv1.2","106","8.153658000","Application Data"
"895","8.200130","10.0.0.14","104.121.10.34","TCP","68","8.200130000","46628  >  443 [ACK] Seq=1313 Ack=3652 Win=501 Len=0 TSval=3058238852 TSecr=869937927"
"897","8.203601","10.0.0.14","104.121.10.34","TCP","68","8.203601000","46628  >  443 [ACK] Seq=1313 Ack=6450 Win=501 Len=0 TSval=3058238855 TSecr=869937928"
"900","8.205034","10.0.0.14","104.121.10.34","TCP","68","8.205034000","46628  >  443 [ACK] Seq=1313 Ack=9248 Win=501 Len=0 TSval=3058238857 TSecr=869937932"
"902","8.208504","10.0.0.14","104.121.10.34","TCP","68","8.208504000","46628  >  443 [ACK] Seq=1313 Ack=12046 Win=501 Len=0 TSval=3058238860 TSecr=869937936"
"905","8.216562","10.0.0.14","159.124.42.26","TLSv1.2","135","8.216562000","Application Data"
"908","8.252443","10.0.0.14","104.121.10.34","TCP","68","8.252443000","46628  >  443 [ACK] Seq=1313 Ack=13188 Win=501 Len=0 TSval=3058238904 TSecr=869937939"
"909","8.264408","10.0.0.14","159.124.42.26","TCP","68","8.264408000","36698  >  443 [ACK] Seq=316 Ack=262 Win=501 Len=0 TSval=2183461941 TSecr=1967054945"
"916","8.315154","10.0.0.14","35.174.127.31","TCP","68","8.315154000","52758  >  443 [ACK] Seq=1 Ack=39 Win=501 Len=0 TSval=3401870143 TSecr=1947534321"
"920","8.322357","10.0.0.14","140.82.112.26","TLSv1.2","97","8.322357000","Application Data"
"924","8.447622","10.0.0.14","52.203.140.246","TCP","80","8.447622000","47470  >  443 [ACK] Seq=1 Ack=4294967220 Win=501 Len=0 TSval=4290798078 TSecr=2972007125 SLE=1 SRE=2"
"926","8.450818","10.0.0.14","52.203.140.246","TCP","80","8.450818000","47470  >  443 [ACK] Seq=1 Ack=4294967266 Win=501 Len=0 TSval=4290798081 TSecr=2972021294 SLE=1 SRE=2"
"928","8.450855","10.0.0.14","52.203.140.246","TCP","68","8.450855000","47470  >  443 [ACK] Seq=1 Ack=2 Win=501 Len=0 TSval=4290798081 TSecr=2972021294"
"929","8.451078","10.0.0.14","52.203.140.246","TCP","68","8.451078000","47470  >  443 [FIN, ACK] Seq=1 Ack=2 Win=501 Len=0 TSval=4290798082 TSecr=2972021294"
"974","9.167178","2a06:c701:472d:c000:f796:c198:3a7:a863","2407:30c0:182::aa72:3406","TCP","88","9.167178000","[TCP Dup ACK 323#1] [TCP ACKed unseen segment] 57446  >  443 [ACK] Seq=1 Ack=2 Win=501 Len=0 TSval=680116546 TSecr=3899337116"
"983","9.381168","2a06:c701:472d:c000:f796:c198:3a7:a863","2407:30c0:182::aa72:3406","TCP","88","9.381168000","[TCP Dup ACK 396#1] [TCP ACKed unseen segment] 57458  >  443 [ACK] Seq=1 Ack=2 Win=501 Len=0 TSval=680116760 TSecr=2970038552"
"1023","10.313350","10.0.0.14","159.124.42.26","TLSv1.2","111","10.313350000","Application Data"
"1035","10.326049","10.0.0.14","159.124.42.26","TLSv1.2","822","10.326049000","Application Data"
"1051","10.460485","10.0.0.14","159.124.42.26","TCP","68","10.460485000","36690  >  443 [ACK] Seq=1442 Ack=838 Win=501 Len=0 TSval=2183464137 TSecr=1967057126"
"1104","11.283877","10.0.0.14","159.124.42.26","TCP","68","11.283877000","36690  >  443 [ACK] Seq=1442 Ack=910 Win=501 Len=0 TSval=2183464960 TSecr=1967058010"
"1105","11.284090","10.0.0.14","159.124.42.26","TLSv1.2","111","11.284090000","Application Data"
"1112","11.377107","10.0.0.14","159.124.42.26","TLSv1.2","271","11.377107000","Application Data"
"1117","11.415427","10.0.0.14","159.124.42.26","TLSv1.2","106","11.415427000","Application Data"
"1125","11.478304","10.0.0.14","159.124.42.26","TCP","68","11.478304000","36690  >  443 [ACK] Seq=1726 Ack=991 Win=501 Len=0 TSval=2183465155 TSecr=1967058172"
"1131","11.536633","10.0.0.14","159.124.42.26","TLSv1.2","135","11.536633000","Application Data"
"1144","11.883734","10.0.0.14","159.124.42.26","TLSv1.2","106","11.883734000","Application Data"
"1150","11.946734","10.0.0.14","159.124.42.26","TCP","68","11.946734000","36698  >  443 [ACK] Seq=354 Ack=300 Win=501 Len=0 TSval=2183465623 TSecr=1967058675"
"1153","11.961698","10.0.0.14","159.124.42.26","TCP","68","11.961698000","36698  >  443 [ACK] Seq=354 Ack=349 Win=501 Len=0 TSval=2183465638 TSecr=1967058690"
"1154","11.961882","10.0.0.14","159.124.42.26","TLSv1.2","135","11.961882000","Application Data"
"1162","12.122532","2a06:c701:472d:c000:f796:c198:3a7:a863","2a03:2880:f242:c8:face:b00c:0:167","TCP","88","12.122532000","50310  >  443 [ACK] Seq=382 Ack=3017 Win=501 Len=0 TSval=1246469103 TSecr=607088354"
"1164","12.193937","2a06:c701:472d:c000:f796:c198:3a7:a863","2a03:2880:f242:c8:face:b00c:0:167","TLSv1.2","162","12.193937000","Application Data"
"1206","13.028446","10.0.0.14","159.124.42.26","TLSv1.2","111","13.028446000","Application Data"
"1275","13.973322","10.0.0.14","159.124.42.26","TLSv1.2","111","13.973322000","Application Data"
"1285","14.076512","10.0.0.14","159.124.42.26","TLSv1.2","111","14.076512000","Application Data"
"1295","14.287762","2a06:c701:472d:c000:f796:c198:3a7:a863","2407:30c0:182::aa72:3406","TCP","88","14.287762000","[TCP Dup ACK 323#2] [TCP ACKed unseen segment] 57446  >  443 [ACK] Seq=1 Ack=2 Win=501 Len=0 TSval=680121666 TSecr=3899337116"
"1305","14.504407","2a06:c701:472d:c000:f796:c198:3a7:a863","2407:30c0:182::aa72:3406","TCP","88","14.504407000","[TCP Dup ACK 396#2] [TCP ACKed unseen segment] 57458  >  443 [ACK] Seq=1 Ack=2 Win=501 Len=0 TSval=680121883 TSecr=2970038552"
"1324","15.193724","10.0.0.14","159.124.42.26","TLSv1.2","106","15.193724000","Application Data"
"1330","15.282333","10.0.0.14","159.124.42.26","TLSv1.2","135","15.282333000","Application Data"
"1331","15.282736","10.0.0.14","159.124.42.26","TLSv1.2","111","15.282736000","Application Data"
"1344","15.647661","10.0.0.14","159.124.42.26","TLSv1.2","106","15.647661000","Application Data"
"1352","15.708981","10.0.0.14","159.124.42.26","TLSv1.2","135","15.708981000","Application Data"
"1355","15.752425","10.0.0.14","159.124.42.26","TCP","68","15.752425000","36698  >  443 [ACK] Seq=526 Ack=436 Win=501 Len=0 TSval=2183469429 TSecr=1967062439"
"1383","16.394236","10.0.0.14","159.124.42.26","TLSv1.2","241","16.394236000","Application Data"
"1389","16.512373","10.0.0.14","159.124.42.26","TCP","68","16.512373000","36690  >  443 [ACK] Seq=2243 Ack=1445 Win=501 Len=0 TSval=2183470189 TSecr=1967063188"
"1412","17.283392","10.0.0.14","159.124.42.26","TCP","68","17.283392000","36690  >  443 [ACK] Seq=2243 Ack=1517 Win=501 Len=0 TSval=2183470960 TSecr=1967064011"
"1415","17.353919","10.0.0.14","159.124.42.26","TLSv1.2","111","17.353919000","Application Data"
"1425","17.625811","10.0.0.14","159.124.42.26","TLSv1.2","139","17.625811000","Application Data"
"1428","17.689568","10.0.0.14","159.124.42.26","TCP","68","17.689568000","36690  >  443 [ACK] Seq=2357 Ack=1560 Win=501 Len=0 TSval=2183471366 TSecr=1967064417"
"1430","17.689605","10.0.0.14","159.124.42.26","TCP","68","17.689605000","36690  >  443 [ACK] Seq=2357 Ack=1631 Win=501 Len=0 TSval=2183471366 TSecr=1967064417"
"1431","17.689805","10.0.0.14","159.124.42.26","TLSv1.2","111","17.689805000","Application Data"
"1460","18.583223","2a06:c701:472d:c000:f796:c198:3a7:a863","2a03:2880:f242:c8:face:b00c:0:167","TCP","88","18.583223000","50310  >  443 [ACK] Seq=456 Ack=3112 Win=501 Len=0 TSval=1246475564 TSecr=607094774"
"1464","18.696494","2a06:c701:472d:c000:f796:c198:3a7:a863","2a03:2880:f242:c8:face:b00c:0:167","TLSv1.2","161","18.696494000","Application Data"
"1472","18.897203","10.0.0.14","159.124.42.26","TLSv1.2","106","18.897203000","Application Data"
"1485","19.000449","10.0.0.14","159.124.42.26","TCP","68","19.000449000","36690  >  443 [ACK] Seq=2438 Ack=1669 Win=501 Len=0 TSval=2183472677 TSecr=1967065687"
"1488","19.030162","10.0.0.14","159.124.42.26","TCP","68","19.030162000","36690  >  443 [ACK] Seq=2438 Ack=1718 Win=501 Len=0 TSval=2183472707 TSecr=1967065758"
"1489","19.030369","10.0.0.14","159.124.42.26","TLSv1.2","135","19.030369000","Application Data"
"1515","19.336444","10.0.0.14","159.124.42.26","TCP","68","19.336444000","36690  >  443 [ACK] Seq=2505 Ack=1790 Win=501 Len=0 TSval=2183473013 TSecr=1967066012"
"1517","19.357094","10.0.0.14","159.124.42.26","TLSv1.2","106","19.357094000","Application Data"
"1518","19.357153","10.0.0.14","159.124.42.26","TLSv1.2","111","19.357153000","Application Data"
"1524","19.407196","2a06:c701:472d:c000:f796:c198:3a7:a863","2407:30c0:182::aa72:3406","TCP","88","19.407196000","[TCP Dup ACK 323#3] [TCP ACKed unseen segment] 57446  >  443 [ACK] Seq=1 Ack=2 Win=501 Len=0 TSval=680126786 TSecr=3899337116"
"1530","19.421088","10.0.0.14","159.124.42.26","TCP","68","19.421088000","36698  >  443 [ACK] Seq=564 Ack=474 Win=501 Len=0 TSval=2183473098 TSecr=1967066148"
"1535","19.456531","10.0.0.14","159.124.42.26","TCP","68","19.456531000","36698  >  443 [ACK] Seq=564 Ack=523 Win=501 Len=0 TSval=2183473133 TSecr=1967066185"
"1536","19.456715","10.0.0.14","159.124.42.26","TLSv1.2","135","19.456715000","Application Data"
"1551","19.621913","2a06:c701:472d:c000:f796:c198:3a7:a863","2407:30c0:182::aa72:3406","TCP","88","19.621913000","[TCP Dup ACK 396#3] [TCP ACKed unseen segment] 57458  >  443 [ACK] Seq=1 Ack=2 Win=501 Len=0 TSval=680127000 TSecr=2970038552"
"1691","21.529139","10.0.0.14","159.124.42.26","TCP","68","21.529139000","36690  >  443 [ACK] Seq=2548 Ack=1862 Win=501 Len=0 TSval=2183475206 TSecr=1967068257"
"1697","21.585090","10.0.0.14","159.124.42.26","TLSv1.2","111","21.585090000","Application Data"
"1729","22.534981","10.0.0.14","159.124.42.26","TCP","68","22.534981000","36690  >  443 [ACK] Seq=2591 Ack=1934 Win=501 Len=0 TSval=2183476212 TSecr=1967069262"
"1731","22.535018","10.0.0.14","159.124.42.26","TCP","68","22.535018000","36690  >  443 [ACK] Seq=2591 Ack=2002 Win=501 Len=0 TSval=2183476212 TSecr=1967069262"
"1733","22.535048","10.0.0.14","159.124.42.26","TCP","68","22.535048000","36690  >  443 [ACK] Seq=2591 Ack=2111 Win=501 Len=0 TSval=2183476212 TSecr=1967069263"
"1735","22.545679","10.0.0.14","159.124.42.26","TLSv1.2","111","22.545679000","Application Data"
"1746","22.657093","10.0.0.14","159.124.42.26","TLSv1.2","106","22.657093000","Application Data"
"1754","22.760420","10.0.0.14","159.124.42.26","TCP","68","22.760420000","36690  >  443 [ACK] Seq=2672 Ack=2149 Win=501 Len=0 TSval=2183476437 TSecr=1967069447"
"1757","22.778635","10.0.0.14","159.124.42.26","TCP","68","22.778635000","36690  >  443 [ACK] Seq=2672 Ack=2198 Win=501 Len=0 TSval=2183476455 TSecr=1967069506"
"1758","22.778849","10.0.0.14","159.124.42.26","TLSv1.2","135","22.778849000","Application Data"
"1783","23.107009","10.0.0.14","159.124.42.26","TLSv1.2","106","23.107009000","Application Data"
"1797","23.215012","10.0.0.14","159.124.42.26","TCP","68","23.215012000","36698  >  443 [ACK] Seq=669 Ack=610 Win=501 Len=0 TSval=2183476892 TSecr=1967069898"
"1798","23.215206","10.0.0.14","159.124.42.26","TLSv1.2","135","23.215206000","Application Data"
"1806","23.298756","10.0.0.14","159.124.42.26","TLSv1.2","111","23.298756000","Application Data"
"1852","23.956978","10.0.0.14","159.124.42.26","TLSv1.2","111","23.956978000","Application Data"
"1859","24.126188","10.0.0.14","159.124.42.26","TLSv1.2","817","24.126188000","Application Data"
"1867","24.240369","10.0.0.14","159.124.42.26","TCP","68","24.240369000","36690  >  443 [ACK] Seq=3574 Ack=2372 Win=501 Len=0 TSval=2183477917 TSecr=1967070928"
"1878","24.527608","2a06:c701:472d:c000:f796:c198:3a7:a863","2407:30c0:182::aa72:3406","TCP","88","24.527608000","[TCP Dup ACK 323#4] [TCP ACKed unseen segment] 57446  >  443 [ACK] Seq=1 Ack=2 Win=501 Len=0 TSval=680131906 TSecr=3899337116"
"1884","24.740587","2a06:c701:472d:c000:f796:c198:3a7:a863","2407:30c0:182::aa72:3406","TCP","88","24.740587000","[TCP Dup ACK 396#4] [TCP ACKed unseen segment] 57458  >  443 [ACK] Seq=1 Ack=2 Win=501 Len=0 TSval=680132119 TSecr=2970038552"
"1904","25.276801","10.0.0.14","159.124.42.26","TCP","68","25.276801000","36690  >  443 [ACK] Seq=3574 Ack=2444 Win=501 Len=0 TSval=2183478953 TSecr=1967072004"
"1908","25.314983","10.0.0.14","159.124.42.26","TLSv1.2","111","25.314983000","Application Data"
"1935","25.938942","2a06:c701:472d:c000:f796:c198:3a7:a863","2a03:2880:f242:c8:face:b00c:0:167","TCP","88","25.938942000","50310  >  443 [ACK] Seq=529 Ack=3542 Win=498 Len=0 TSval=1246482919 TSecr=607102170"
"1942","26.128543","2a06:c701:472d:c000:f796:c198:3a7:a863","2a03:2880:f242:c8:face:b00c:0:167","TLSv1.2","182","26.128543000","Application Data"
"1952","26.414091","10.0.0.14","159.124.42.26","TLSv1.2","106","26.414091000","Application Data"
"1959","26.524373","10.0.0.14","159.124.42.26","TCP","68","26.524373000","36690  >  443 [ACK] Seq=3655 Ack=2482 Win=501 Len=0 TSval=2183480201 TSecr=1967073206"
"1961","26.535951","10.0.0.14","159.124.42.26","TCP","68","26.535951000","36690  >  443 [ACK] Seq=3655 Ack=2531 Win=501 Len=0 TSval=2183480212 TSecr=1967073264"
"1962","26.536187","10.0.0.14","159.124.42.26","TLSv1.2","135","26.536187000","Application Data"
"1974","26.863363","10.0.0.14","159.124.42.26","TLSv1.2","106","26.863363000","Application Data"
"1985","26.962131","10.0.0.14","159.124.42.26","TCP","68","26.962131000","36698  >  443 [ACK] Seq=774 Ack=697 Win=501 Len=0 TSval=2183480639 TSecr=1967073654"
"1986","26.962223","10.0.0.14","159.124.42.26","TLSv1.2","135","26.962223000","Application Data"
"2032","28.029330","10.0.0.14","159.124.42.26","TCP","68","28.029330000","36690  >  443 [ACK] Seq=3722 Ack=2671 Win=501 Len=0 TSval=2183481706 TSecr=1967074757"
"2035","28.074396","10.0.0.14","159.124.42.26","TLSv1.2","111","28.074396000","Application Data"
"2098","29.076392","10.0.0.14","159.124.42.26","TCP","68","29.076392000","36690  >  443 [ACK] Seq=3765 Ack=2743 Win=501 Len=0 TSval=2183482753 TSecr=1967075762"
"2099","29.077036","10.0.0.14","159.124.42.26","TLSv1.2","111","29.077036000","Application Data"
"2110","29.277844","10.0.0.14","159.124.42.26","TCP","68","29.277844000","36690  >  443 [ACK] Seq=3808 Ack=2815 Win=501 Len=0 TSval=2183482954 TSecr=1967076006"
"2113","29.329351","10.0.0.14","159.124.42.26","TLSv1.2","111","29.329351000","Application Data"
"2124","29.647674","2a06:c701:472d:c000:f796:c198:3a7:a863","2407:30c0:182::aa72:3406","TCP","88","29.647674000","[TCP Dup ACK 323#5] [TCP ACKed unseen segment] 57446  >  443 [ACK] Seq=1 Ack=2 Win=501 Len=0 TSval=680137026 TSecr=3899337116"
"2132","29.860894","2a06:c701:472d:c000:f796:c198:3a7:a863","2407:30c0:182::aa72:3406","TCP","88","29.860894000","[TCP Dup ACK 396#5] [TCP ACKed unseen segment] 57458  >  443 [ACK] Seq=1 Ack=2 Win=501 Len=0 TSval=680137239 TSecr=2970038552"
"2140","30.007439","2a06:c701:472d:c000:f796:c198:3a7:a863","2a03:2880:f242:c8:face:b00c:0:167","TCP","88","30.007439000","50310  >  443 [ACK] Seq=623 Ack=3766 Win=500 Len=0 TSval=1246486988 TSecr=607106239"
"2141","30.009502","2a06:c701:472d:c000:f796:c198:3a7:a863","2a03:2880:f242:c8:face:b00c:0:167","TLSv1.2","162","30.009502000","Application Data"
"2149","30.175050","10.0.0.14","159.124.42.26","TLSv1.2","106","30.175050000","Application Data"
"2171","30.286650","10.0.0.14","159.124.42.26","TCP","68","30.286650000","36690  >  443 [ACK] Seq=3889 Ack=2864 Win=501 Len=0 TSval=2183483963 TSecr=1967077011"
"2172","30.286785","10.0.0.14","159.124.42.26","TLSv1.2","135","30.286785000","Application Data"
"2181","30.375796","10.0.0.14","159.124.42.26","TLSv1.2","139","30.375796000","Application Data"
"2208","30.559950","10.0.0.14","159.124.42.26","TCP","68","30.559950000","36690  >  443 [ACK] Seq=4027 Ack=3053 Win=501 Len=0 TSval=2183484236 TSecr=1967077255"
"2210","30.576653","10.0.0.14","159.124.42.26","TLSv1.2","111","30.576653000","Application Data"
"2216","30.635152","10.0.0.14","159.124.42.26","TLSv1.2","106","30.635152000","Application Data"
"2223","30.727833","2a06:c701:472d:c000:f796:c198:3a7:a863","2a03:2880:f242:c8:face:b00c:0:167","TLSv1.2","158","30.727833000","Application Data"
"2234","30.769980","10.0.0.14","159.124.42.26","TCP","68","30.769980000","36698  >  443 [ACK] Seq=879 Ack=784 Win=501 Len=0 TSval=2183484447 TSecr=1967077428"
"2235","30.770053","10.0.0.14","159.124.42.26","TLSv1.2","135","30.770053000","Application Data"
"2253","30.956403","2a06:c701:472d:c000:f796:c198:3a7:a863","2a03:2880:f242:c8:face:b00c:0:167","TCP","88","30.956403000","50310  >  443 [ACK] Seq=767 Ack=3838 Win=501 Len=0 TSval=1246487937 TSecr=607107146"
"2262","31.072426","10.0.0.14","54.147.72.119","TCP","68","31.072426000","43106  >  443 [ACK] Seq=1 Ack=1 Win=501 Len=0 TSval=2109199611 TSecr=1855809171"
"2273","31.126660","10.0.0.14","159.124.42.26","TLSv1.2","111","31.126660000","Application Data"
"2294","31.334569","10.0.0.14","159.124.42.26","TLSv1.2","111","31.334569000","Application Data"
"2345","32.030205","10.0.0.14","159.124.42.26","TLSv1.2","111","32.030205000","Application Data"
"2379","32.527869","10.0.0.14","159.124.42.26","TLSv1.2","111","32.527869000","Application Data"
"2417","33.075561","10.0.0.14","159.124.42.26","TLSv1.2","111","33.075561000","Application Data"
"2430","33.279347","10.0.0.14","159.124.42.26","TLSv1.2","111","33.279347000","Application Data"
"2438","33.431749","2a06:c701:472d:c000:f796:c198:3a7:a863","2a03:2880:f242:c8:face:b00c:0:167","TCP","88","33.431749000","50310  >  443 [ACK] Seq=767 Ack=4089 Win=500 Len=0 TSval=1246490412 TSecr=607109664"
"2449","33.586558","2a06:c701:472d:c000:f796:c198:3a7:a863","2a03:2880:f242:c8:face:b00c:0:167","TLSv1.2","184","33.586558000","Application Data"
"2466","33.776936","10.0.0.14","159.124.42.26","TLSv1.2","111","33.776936000","Application Data"
"2476","33.936155","10.0.0.14","159.124.42.26","TLSv1.2","106","33.936155000","Application Data"
"2488","34.030017","10.0.0.14","159.124.42.26","TCP","68","34.030017000","36690  >  443 [ACK] Seq=4409 Ack=3644 Win=501 Len=0 TSval=2183487707 TSecr=1967080727"
"2489","34.030208","10.0.0.14","159.124.42.26","TLSv1.2","135","34.030208000","Application Data"
"2495","34.081317","10.0.0.14","159.124.42.26","TLSv1.2","111","34.081317000","Application Data"
"2512","34.284667","10.0.0.14","159.124.42.26","TLSv1.2","111","34.284667000","Application Data"
"2521","34.377992","10.0.0.14","159.124.42.26","TLSv1.2","106","34.377992000","Application Data"
"2535","34.456402","10.0.0.14","159.124.42.26","TCP","68","34.456402000","36698  >  443 [ACK] Seq=984 Ack=871 Win=501 Len=0 TSval=2183488133 TSecr=1967081171"
"2536","34.456485","10.0.0.14","159.124.42.26","TLSv1.2","135","34.456485000","Application Data"
"2559","34.764733","2a06:c701:472d:c000:f796:c198:3a7:a863","2407:30c0:182::aa72:3406","TCP","88","34.764733000","[TCP Dup ACK 323#6] [TCP ACKed unseen segment] 57446  >  443 [ACK] Seq=1 Ack=2 Win=501 Len=0 TSval=680142143 TSecr=3899337116"
"2563","34.782049","10.0.0.14","159.124.42.26","TCP","68","34.782049000","36690  >  443 [ACK] Seq=4562 Ack=4024 Win=501 Len=0 TSval=2183488459 TSecr=1967081509"
"2572","34.842898","10.0.0.14","159.124.42.26","TLSv1.2","111","34.842898000","Application Data"
"2587","34.981274","2a06:c701:472d:c000:f796:c198:3a7:a863","2407:30c0:182::aa72:3406","TCP","88","34.981274000","[TCP Dup ACK 396#6] [TCP ACKed unseen segment] 57458  >  443 [ACK] Seq=1 Ack=2 Win=501 Len=0 TSval=680142360 TSecr=2970038552"
"2628","35.533913","10.0.0.14","159.124.42.26","TLSv1.2","111","35.533913000","Application Data"
"2652","36.215165","2a06:c701:472d:c000:f796:c198:3a7:a863","2a03:2880:f242:c8:face:b00c:0:167","TCP","2848","36.215165000","50310  >  443 [PSH, ACK] Seq=863 Ack=4089 Win=501 Len=2760 TSval=1246493196 TSecr=607109870 [TCP segment of a reassembled PDU]"
"2653","36.215209","2a06:c701:472d:c000:f796:c198:3a7:a863","2a03:2880:f242:c8:face:b00c:0:167","TCP","2848","36.215209000","50310  >  443 [PSH, ACK] Seq=3623 Ack=4089 Win=501 Len=2760 TSval=1246493196 TSecr=607109870 [TCP segment of a reassembled PDU]"
"2654","36.220505","2a06:c701:472d:c000:f796:c198:3a7:a863","2a03:2880:f242:c8:face:b00c:0:167","TLSv1.2","1142","36.220505000","Application Data"
"2669","36.272451","2a06:c701:472d:c000:f796:c198:3a7:a863","2a03:2880:f242:1c2:face:b00c:0:167","TCP","96","36.272451000","55258  >  443 [SYN] Seq=0 Win=64800 Len=0 MSS=1440 SACK_PERM=1 TSval=3933762307 TSecr=0 WS=128"
"2680","36.324648","2a06:c701:472d:c000:f796:c198:3a7:a863","2a03:2880:f242:1c2:face:b00c:0:167","TCP","88","36.324648000","55258  >  443 [ACK] Seq=1 Ack=1 Win=64896 Len=0 TSval=3933762359 TSecr=2300529253"
"2681","36.325204","2a06:c701:472d:c000:f796:c198:3a7:a863","2a03:2880:f242:1c2:face:b00c:0:167","TLSv1.3","605","36.325204000","Client Hello"
"2684","36.379374","2a06:c701:472d:c000:f796:c198:3a7:a863","2a03:2880:f242:c8:face:b00c:0:167","TCP","88","36.379374000","50310  >  443 [ACK] Seq=7437 Ack=4153 Win=501 Len=0 TSval=1246493360 TSecr=607112611"
"2687","36.381089","2a06:c701:472d:c000:f796:c198:3a7:a863","2a03:2880:f242:1c2:face:b00c:0:167","TCP","88","36.381089000","55258  >  443 [ACK] Seq=518 Ack=213 Win=64768 Len=0 TSval=3933762416 TSecr=2300529310"
"2688","36.387274","2a06:c701:472d:c000:f796:c198:3a7:a863","2a03:2880:f242:1c2:face:b00c:0:167","TLSv1.3","152","36.387274000","Change Cipher Spec, Application Data"
"2689","36.387662","2a06:c701:472d:c000:f796:c198:3a7:a863","2a03:2880:f242:1c2:face:b00c:0:167","TLSv1.3","186","36.387662000","Application Data"
"2690","36.388641","2a06:c701:472d:c000:f796:c198:3a7:a863","2a03:2880:f242:1c2:face:b00c:0:167","TLSv1.3","584","36.388641000","Application Data"
"2691","36.388724","2a06:c701:472d:c000:f796:c198:3a7:a863","2a03:2880:f242:1c2:face:b00c:0:167","TLSv1.3","1062","36.388724000","Application Data"
"2692","36.389097","2a06:c701:472d:c000:f796:c198:3a7:a863","2a03:2880:f242:1c2:face:b00c:0:167","TLSv1.3","1185","36.389097000","Application Data, Application Data"
"2700","36.440424","2a06:c701:472d:c000:f796:c198:3a7:a863","2a03:2880:f242:1c2:face:b00c:0:167","TCP","88","36.440424000","55258  >  443 [ACK] Seq=3247 Ack=489 Win=64512 Len=0 TSval=3933762475 TSecr=2300529369"
"2701","36.440616","2a06:c701:472d:c000:f796:c198:3a7:a863","2a03:2880:f242:1c2:face:b00c:0:167","TLSv1.3","119","36.440616000","Application Data"
"2705","36.445270","2a06:c701:472d:c000:f796:c198:3a7:a863","2a03:2880:f242:1c2:face:b00c:0:167","TCP","88","36.445270000","55258  >  443 [ACK] Seq=3278 Ack=559 Win=64512 Len=0 TSval=3933762480 TSecr=2300529370"
"2711","36.536414","2a06:c701:472d:c000:f796:c198:3a7:a863","2a03:2880:f242:1c2:face:b00c:0:167","TCP","88","36.536414000","55258  >  443 [ACK] Seq=3278 Ack=1047 Win=64128 Len=0 TSval=3933762571 TSecr=2300529408"
"2717","36.784236","2a06:c701:472d:c000:f796:c198:3a7:a863","2a03:2880:f242:1c2:face:b00c:0:167","TCP","88","36.784236000","55258  >  443 [ACK] Seq=3278 Ack=1262 Win=64000 Len=0 TSval=3933762819 TSecr=2300529646"
"2734","37.295588","10.0.0.14","159.124.42.26","TLSv1.2","111","37.295588000","Application Data"
"2748","37.676178","10.0.0.14","159.124.42.26","TLSv1.2","106","37.676178000","Application Data"
"2755","37.778694","10.0.0.14","159.124.42.26","TCP","68","37.778694000","36690  >  443 [ACK] Seq=4729 Ack=4255 Win=501 Len=0 TSval=2183491455 TSecr=1967084467"
"2756","37.778905","10.0.0.14","159.124.42.26","TLSv1.2","135","37.778905000","Application Data"
"2759","37.875816","10.0.0.14","159.124.42.26","TLSv1.2","820","37.875816000","Application Data"
"2772","37.984417","10.0.0.14","159.124.42.26","TCP","68","37.984417000","36690  >  443 [ACK] Seq=5548 Ack=4298 Win=501 Len=0 TSval=2183491661 TSecr=1967084667"
"2780","38.094672","10.0.0.14","159.124.42.26","TLSv1.2","106","38.094672000","Application Data"
"2789","38.208417","10.0.0.14","159.124.42.26","TCP","68","38.208417000","36698  >  443 [ACK] Seq=1089 Ack=909 Win=501 Len=0 TSval=2183491885 TSecr=1967084886"
"2791","38.215400","10.0.0.14","159.124.42.26","TCP","68","38.215400000","36698  >  443 [ACK] Seq=1089 Ack=958 Win=501 Len=0 TSval=2183491892 TSecr=1967084942"
"2792","38.215577","10.0.0.14","159.124.42.26","TLSv1.2","135","38.215577000","Application Data"
"2831","39.168465","10.0.0.14","13.226.2.114","TCP","68","39.168465000","52550  >  443 [ACK] Seq=1 Ack=1 Win=501 Len=0 TSval=2630253971 TSecr=1692798017"
"2832","39.175697","10.0.0.14","35.174.127.31","TLSv1.2","315","39.175697000","Application Data"
"2840","39.328145","10.0.0.14","35.174.127.31","TCP","68","39.328145000","52758  >  443 [ACK] Seq=248 Ack=309 Win=499 Len=0 TSval=3401901156 TSecr=1947565335"
"2860","39.887757","2a06:c701:472d:c000:f796:c198:3a7:a863","2407:30c0:182::aa72:3406","TCP","88","39.887757000","[TCP Dup ACK 323#7] [TCP ACKed unseen segment] 57446  >  443 [ACK] Seq=1 Ack=2 Win=501 Len=0 TSval=680147266 TSecr=3899337116"
"2869","40.100792","2a06:c701:472d:c000:f796:c198:3a7:a863","2407:30c0:182::aa72:3406","TCP","88","40.100792000","[TCP Dup ACK 396#7] [TCP ACKed unseen segment] 57458  >  443 [ACK] Seq=1 Ack=2 Win=501 Len=0 TSval=680147479 TSecr=2970038552"
"2918","41.446658","10.0.0.14","159.124.42.26","TLSv1.2","106","41.446658000","Application Data"
"2924","41.532778","10.0.0.14","159.124.42.26","TCP","68","41.532778000","36690  >  443 [ACK] Seq=5586 Ack=4336 Win=501 Len=0 TSval=2183495209 TSecr=1967088260"
"2926","41.539966","10.0.0.14","159.124.42.26","TCP","68","41.539966000","36690  >  443 [ACK] Seq=5586 Ack=4385 Win=501 Len=0 TSval=2183495216 TSecr=1967088262"
"2927","41.540156","10.0.0.14","159.124.42.26","TLSv1.2","135","41.540156000","Application Data"
"2930","41.594128","10.0.0.14","159.124.42.26","TLSv1.2","270","41.594128000","Application Data"
"2939","41.744375","10.0.0.14","159.124.42.26","TCP","68","41.744375000","36690  >  443 [ACK] Seq=5855 Ack=4428 Win=501 Len=0 TSval=2183495421 TSecr=1967088415"
"2944","41.860198","10.0.0.14","159.124.42.26","TLSv1.2","106","41.860198000","Application Data"
"2952","41.960853","10.0.0.14","159.124.42.26","TCP","68","41.960853000","36698  >  443 [ACK] Seq=1194 Ack=1045 Win=501 Len=0 TSval=2183495637 TSecr=1967088651"
"2953","41.961052","10.0.0.14","159.124.42.26","TLSv1.2","135","41.961052000","Application Data"
"2993","42.530387","10.0.0.14","159.124.42.26","TCP","68","42.530387000","36690  >  443 [ACK] Seq=5855 Ack=4500 Win=501 Len=0 TSval=2183496207 TSecr=1967089258"
"2995","42.530437","10.0.0.14","159.124.42.26","TCP","68","42.530437000","36690  >  443 [ACK] Seq=5855 Ack=4568 Win=501 Len=0 TSval=2183496207 TSecr=1967089258"
"2997","42.558719","10.0.0.14","159.124.42.26","TLSv1.2","111","42.558719000","Application Data"
"3026","42.894819","2a06:c701:472d:c000:f796:c198:3a7:a863","2a03:2880:f242:c8:face:b00c:0:167","TLSv1.2","159","42.894819000","Application Data"
"3027","42.894908","2a06:c701:472d:c000:f796:c198:3a7:a863","2a03:2880:f242:c8:face:b00c:0:167","TLSv1.2","205","42.894908000","Application Data"
"3049","42.988215","10.0.0.14","52.20.115.236","TCP","76","42.988215000","42184  >  443 [SYN] Seq=0 Win=64240 Len=0 MSS=1460 SACK_PERM=1 TSval=2153346229 TSecr=0 WS=128"
"3058","43.070590","2a06:c701:472d:c000:f796:c198:3a7:a863","2a03:2880:f242:c8:face:b00c:0:167","TCP","88","43.070590000","50310  >  443 [ACK] Seq=7625 Ack=4215 Win=501 Len=0 TSval=1246500051 TSecr=607119302"
"3064","43.136262","10.0.0.14","52.20.115.236","TCP","68","43.136262000","42184  >  443 [ACK] Seq=1 Ack=1 Win=64256 Len=0 TSval=2153346377 TSecr=871217697"
"3065","43.136487","10.0.0.14","52.20.115.236","TLSv1.2","585","43.136487000","Client Hello"
"3066","43.149776","2a06:c701:472d:c000:f796:c198:3a7:a863","2a03:2880:f242:c8:face:b00c:0:167","TLSv1.2","197","43.149776000","Application Data"
"3071","43.176178","10.0.0.14","159.124.42.26","TLSv1.2","139","43.176178000","Application Data"
"3079","43.242262","10.0.0.14","159.124.42.26","TCP","68","43.242262000","36690  >  443 [ACK] Seq=5969 Ack=4682 Win=501 Len=0 TSval=2183496919 TSecr=1967089969"
"3080","43.252823","10.0.0.14","159.124.42.26","TLSv1.2","111","43.252823000","Application Data"
"3084","43.279358","2a06:c701:472d:c000:f796:c198:3a7:a863","2a03:2880:f242:c8:face:b00c:0:167","TLSv1.2","278","43.279358000","Application Data"
"3089","43.302748","10.0.0.14","52.20.115.236","TCP","68","43.302748000","42184  >  443 [ACK] Seq=518 Ack=5420 Win=58880 Len=0 TSval=2153346543 TSecr=871217854"
"3090","43.303339","10.0.0.14","52.20.115.236","TLSv1.2","194","43.303339000","Client Key Exchange, Change Cipher Spec, Encrypted Handshake Message"
"3091","43.303694","10.0.0.14","52.20.115.236","TLSv1.2","173","43.303694000","Application Data"
"3092","43.303862","10.0.0.14","52.20.115.236","TLSv1.2","970","43.303862000","Application Data"
"3093","43.304459","10.0.0.14","52.20.115.236","TLSv1.2","400","43.304459000","Application Data"
"3104","43.427041","2a06:c701:472d:c000:f796:c198:3a7:a863","2a03:2880:f242:c8:face:b00c:0:167","TCP","88","43.427041000","50310  >  443 [ACK] Seq=7924 Ack=4310 Win=501 Len=0 TSval=1246500408 TSecr=607119658"
"3105","43.428699","2a06:c701:472d:c000:f796:c198:3a7:a863","2600:9000:2024:f800:e:4185:5680:93a1","TLSv1.2","156","43.428699000","Application Data"
"3106","43.429400","2a06:c701:472d:c000:f796:c198:3a7:a863","2600:9000:2024:f800:e:4185:5680:93a1","TLSv1.2","189","43.429400000","Application Data, Application Data"
"3115","43.455418","10.0.0.14","52.20.115.236","TCP","68","43.455418000","42184  >  443 [ACK] Seq=1983 Ack=5698 Win=64128 Len=0 TSval=2153346696 TSecr=871218014"
"3117","43.455576","10.0.0.14","52.20.115.236","TLSv1.2","106","43.455576000","Application Data"
"3131","43.484374","2a06:c701:472d:c000:f796:c198:3a7:a863","2600:9000:2024:f800:e:4185:5680:93a1","TCP","88","43.484374000","41114  >  443 [ACK] Seq=409 Ack=2135 Win=501 Len=0 TSval=2397568718 TSecr=1132242715"
"3136","43.493607","10.0.0.14","50.19.40.154","TCP","76","43.493607000","44916  >  443 [SYN] Seq=0 Win=64240 Len=0 MSS=1460 SACK_PERM=1 TSval=2967363779 TSecr=0 WS=128"
"3138","43.500388","10.0.0.14","52.20.115.236","TCP","68","43.500388000","42184  >  443 [ACK] Seq=2021 Ack=6318 Win=64128 Len=0 TSval=2153346741 TSecr=871218017"
"3140","43.512477","2a06:c701:472d:c000:f796:c198:3a7:a863","2600:9000:2024:f800:e:4185:5680:93a1","TCP","88","43.512477000","41114  >  443 [ACK] Seq=409 Ack=3164 Win=493 Len=0 TSval=2397568746 TSecr=1132242782"
"3141","43.513518","2a06:c701:472d:c000:f796:c198:3a7:a863","2600:9000:2024:f800:e:4185:5680:93a1","TLSv1.2","123","43.513518000","Application Data"
"3144","43.520749","2a06:c701:472d:c000:f796:c198:3a7:a863","2600:9000:2024:f800:e:4185:5680:93a1","TLSv1.2","123","43.520749000","Application Data"
"3149","43.553953","10.0.0.14","159.124.42.26","TLSv1.2","111","43.553953000","Application Data"
"3159","43.642649","10.0.0.14","50.19.40.154","TCP","68","43.642649000","44916  >  443 [ACK] Seq=1 Ack=1 Win=64256 Len=0 TSval=2967363928 TSecr=112944953"
"3160","43.643394","10.0.0.14","50.19.40.154","TLSv1.2","585","43.643394000","Client Hello"
"3174","43.814554","10.0.0.14","54.147.72.119","TLSv1.2","125","43.814554000","[TCP Previous segment not captured] , Application Data"
"3176","43.814829","10.0.0.14","50.19.40.154","TCP","68","43.814829000","44916  >  443 [ACK] Seq=518 Ack=4198 Win=60160 Len=0 TSval=2967364100 TSecr=112945112"
"3178","43.814874","10.0.0.14","50.19.40.154","TCP","68","43.814874000","44916  >  443 [ACK] Seq=518 Ack=5448 Win=59008 Len=0 TSval=2967364100 TSecr=112945113"
"3179","43.816673","10.0.0.14","50.19.40.154","TLSv1.2","194","43.816673000","Client Key Exchange, Change Cipher Spec, Encrypted Handshake Message"
"3180","43.817375","10.0.0.14","50.19.40.154","TLSv1.2","1128","43.817375000","Application Data"
"3186","43.964501","10.0.0.14","54.147.72.119","TCP","68","43.964501000","43106  >  443 [ACK] Seq=59 Ack=54 Win=501 Len=0 TSval=2109212503 TSecr=1855867065"
"3188","43.967904","10.0.0.14","54.147.72.119","TCP","68","43.967904000","43106  >  443 [ACK] Seq=59 Ack=85 Win=501 Len=0 TSval=2109212506 TSecr=1855867065"
"3190","43.968072","10.0.0.14","54.147.72.119","TCP","68","43.968072000","43106  >  443 [FIN, ACK] Seq=59 Ack=86 Win=501 Len=0 TSval=2109212507 TSecr=1855867066"
"3194","43.975473","10.0.0.14","50.19.40.154","TCP","68","43.975473000","44916  >  443 [ACK] Seq=1704 Ack=6767 Win=64128 Len=0 TSval=2967364261 TSecr=112945278"
"3197","43.979534","10.0.0.14","50.19.40.154","TLSv1.2","1062","43.979534000","Application Data"
"3204","44.156886","10.0.0.14","159.124.42.26","TLSv1.2","111","44.156886000","Application Data"
"3208","44.220458","10.0.0.14","50.19.40.154","TCP","68","44.220458000","44916  >  443 [ACK] Seq=2698 Ack=7065 Win=64128 Len=0 TSval=2967364506 TSecr=112945485"
"3209","44.232303","10.0.0.14","50.19.40.154","TLSv1.2","232","44.232303000","Application Data"
"3217","44.384476","10.0.0.14","50.19.40.154","TCP","68","44.384476000","44916  >  443 [ACK] Seq=2862 Ack=8431 Win=63104 Len=0 TSval=2967364670 TSecr=112945694"
"3219","44.384534","10.0.0.14","50.19.40.154","TCP","68","44.384534000","44916  >  443 [ACK] Seq=2862 Ack=8523 Win=63104 Len=0 TSval=2967364670 TSecr=112945694"
"3221","44.384560","10.0.0.14","50.19.40.154","TCP","68","44.384560000","44916  >  443 [ACK] Seq=2862 Ack=8782 Win=62848 Len=0 TSval=2967364670 TSecr=112945694"
"3223","44.384598","10.0.0.14","50.19.40.154","TCP","68","44.384598000","44916  >  443 [ACK] Seq=2862 Ack=8833 Win=64128 Len=0 TSval=2967364670 TSecr=112945694"
"3243","45.008046","2a06:c701:472d:c000:f796:c198:3a7:a863","2407:30c0:182::aa72:3406","TCP","88","45.008046000","[TCP Dup ACK 323#8] [TCP ACKed unseen segment] 57446  >  443 [ACK] Seq=1 Ack=2 Win=501 Len=0 TSval=680152387 TSecr=3899337116"
"3267","45.161868","10.0.0.14","159.124.42.26","TLSv1.2","106","45.161868000","Application Data"
"3270","45.220706","2a06:c701:472d:c000:f796:c198:3a7:a863","2407:30c0:182::aa72:3406","TCP","88","45.220706000","[TCP Dup ACK 396#8] [TCP ACKed unseen segment] 57458  >  443 [ACK] Seq=1 Ack=2 Win=501 Len=0 TSval=680152599 TSecr=2970038552"
"3275","45.272379","10.0.0.14","159.124.42.26","TCP","68","45.272379000","36690  >  443 [ACK] Seq=6136 Ack=4851 Win=501 Len=0 TSval=2183498949 TSecr=1967091952"
"3278","45.283715","10.0.0.14","159.124.42.26","TCP","68","45.283715000","36690  >  443 [ACK] Seq=6136 Ack=4900 Win=501 Len=0 TSval=2183498960 TSecr=1967092011"
"3280","45.283777","10.0.0.14","159.124.42.26","TCP","68","45.283777000","36690  >  443 [ACK] Seq=6136 Ack=4972 Win=501 Len=0 TSval=2183498960 TSecr=1967092011"
"3281","45.283995","10.0.0.14","159.124.42.26","TLSv1.2","135","45.283995000","Application Data"
"3282","45.334282","10.0.0.14","159.124.42.26","TLSv1.2","111","45.334282000","Application Data"
"3293","45.383498","10.0.0.14","50.19.40.154","TCP","68","45.383498000","44916  >  443 [ACK] Seq=2862 Ack=8883 Win=64128 Len=0 TSval=2967365669 TSecr=112946693"
"3295","45.383533","10.0.0.14","50.19.40.154","TCP","68","45.383533000","44916  >  443 [ACK] Seq=2862 Ack=8928 Win=64128 Len=0 TSval=2967365669 TSecr=112946694"
"3297","45.384165","10.0.0.14","50.19.40.154","TCP","68","45.384165000","44916  >  443 [ACK] Seq=2862 Ack=9122 Win=64000 Len=0 TSval=2967365670 TSecr=112946694"
"3308","45.623376","10.0.0.14","159.124.42.26","TLSv1.2","106","45.623376000","Application Data"
"3317","45.709719","10.0.0.14","159.124.42.26","TCP","68","45.709719000","36698  >  443 [ACK] Seq=1299 Ack=1132 Win=501 Len=0 TSval=2183499386 TSecr=1967092414"
"3318","45.709804","10.0.0.14","159.124.42.26","TLSv1.2","135","45.709804000","Application Data"
"3419","48.931133","10.0.0.14","159.124.42.26","TLSv1.2","106","48.931133000","Application Data"
"3426","49.031780","10.0.0.14","159.124.42.26","TCP","68","49.031780000","36690  >  443 [ACK] Seq=6284 Ack=5059 Win=501 Len=0 TSval=2183502708 TSecr=1967095730"
"3427","49.031887","10.0.0.14","159.124.42.26","TLSv1.2","135","49.031887000","Application Data"
"3435","49.194257","10.0.0.14","50.19.40.154","TLSv1.2","155","49.194257000","Application Data"
"3441","49.343063","10.0.0.14","50.19.40.154","TCP","68","49.343063000","44916  >  443 [ACK] Seq=2949 Ack=9167 Win=64128 Len=0 TSval=2967369629 TSecr=112950655"
"3445","49.372973","10.0.0.14","159.124.42.26","TLSv1.2","106","49.372973000","Application Data"
"3453","49.475036","10.0.0.14","159.124.42.26","TCP","68","49.475036000","36698  >  443 [ACK] Seq=1404 Ack=1219 Win=501 Len=0 TSval=2183503152 TSecr=1967096164"
"3454","49.475260","10.0.0.14","159.124.42.26","TLSv1.2","135","49.475260000","Application Data"
"3483","50.128147","2a06:c701:472d:c000:f796:c198:3a7:a863","2407:30c0:182::aa72:3406","TCP","88","50.128147000","[TCP Dup ACK 323#9] [TCP ACKed unseen segment] 57446  >  443 [ACK] Seq=1 Ack=2 Win=501 Len=0 TSval=680157507 TSecr=3899337116"
"3491","50.341248","2a06:c701:472d:c000:f796:c198:3a7:a863","2407:30c0:182::aa72:3406","TCP","88","50.341248000","[TCP Dup ACK 396#9] [TCP ACKed unseen segment] 57458  >  443 [ACK] Seq=1 Ack=2 Win=501 Len=0 TSval=680157720 TSecr=2970038552"
"3532","51.336377","10.0.0.14","159.124.42.26","TCP","68","51.336377000","36690  >  443 [ACK] Seq=6351 Ack=5131 Win=501 Len=0 TSval=2183505013 TSecr=1967098013"
"3533","51.337416","10.0.0.14","159.124.42.26","TLSv1.2","111","51.337416000","Application Data"
"3556","51.625861","10.0.0.14","159.124.42.26","TLSv1.2","822","51.625861000","Application Data"
"3564","51.692334","10.0.0.14","159.124.42.26","TCP","68","51.692334000","36690  >  443 [ACK] Seq=7148 Ack=5174 Win=501 Len=0 TSval=2183505369 TSecr=1967098420"
"3623","52.535143","10.0.0.14","159.124.42.26","TCP","68","52.535143000","36690  >  443 [ACK] Seq=7148 Ack=5246 Win=501 Len=0 TSval=2183506212 TSecr=1967099262"
"3624","52.535347","10.0.0.14","159.124.42.26","TLSv1.2","111","52.535347000","Application Data"
"3632","52.645799","10.0.0.14","159.124.42.26","TLSv1.2","106","52.645799000","Application Data"
"3638","52.756375","10.0.0.14","159.124.42.26","TCP","68","52.756375000","36690  >  443 [ACK] Seq=7229 Ack=5284 Win=501 Len=0 TSval=2183506433 TSecr=1967099436"
"3641","52.778711","10.0.0.14","159.124.42.26","TCP","68","52.778711000","36690  >  443 [ACK] Seq=7229 Ack=5333 Win=501 Len=0 TSval=2183506455 TSecr=1967099506"
"3642","52.779060","10.0.0.14","159.124.42.26","TLSv1.2","135","52.779060000","Application Data"
"3654","53.148000","10.0.0.14","159.124.42.26","TLSv1.2","106","53.148000000","Application Data"
"3664","53.219321","10.0.0.14","159.124.42.26","TCP","68","53.219321000","36698  >  443 [ACK] Seq=1509 Ack=1306 Win=501 Len=0 TSval=2183506896 TSecr=1967099939"
"3665","53.219440","10.0.0.14","159.124.42.26","TLSv1.2","135","53.219440000","Application Data"
"3666","53.252373","10.0.0.14","104.121.10.34","TCP","68","53.252373000","[TCP Keep-Alive] 46628  >  443 [ACK] Seq=1312 Ack=13188 Win=501 Len=0 TSval=3058283904 TSecr=869937939"
"3672","53.324369","10.0.0.14","159.124.42.26","TCP","68","53.324369000","36690  >  443 [ACK] Seq=7296 Ack=5405 Win=501 Len=0 TSval=2183507001 TSecr=1967100004"
"3674","53.346548","10.0.0.14","159.124.42.26","TLSv1.2","111","53.346548000","Application Data"
"3684","53.504433","10.0.0.14","140.82.112.26","TCP","68","53.504433000","[TCP Keep-Alive] 48248  >  443 [ACK] Seq=29 Ack=26 Win=501 Len=0 TSval=3390111538 TSecr=71385072"
"3685","53.508437","10.0.0.14","54.243.239.188","TCP","68","53.508437000","[TCP Keep-Alive] 42442  >  443 [ACK] Seq=3076 Ack=636 Win=64128 Len=0 TSval=2514228641 TSecr=613102442"
"3715","54.231096","10.0.0.14","159.124.42.26","TCP","68","54.231096000","36690  >  443 [ACK] Seq=7339 Ack=5464 Win=501 Len=0 TSval=2183507908 TSecr=1967100958"
"3717","54.262571","10.0.0.14","159.124.42.26","TLSv1.2","111","54.262571000","Application Data"
"3750","55.125265","2a06:c701:472d:c000:f796:c198:3a7:a863","2a03:2880:f242:c8:face:b00c:0:167","TCP","88","55.125265000","50310  >  443 [ACK] Seq=7924 Ack=4397 Win=501 Len=0 TSval=1246512106 TSecr=607131357"
"3751","55.130744","2a06:c701:472d:c000:f796:c198:3a7:a863","2a03:2880:f242:c8:face:b00c:0:167","TLSv1.2","159","55.130744000","Application Data"
"3756","55.278735","2a06:c701:472d:c000:f796:c198:3a7:a863","2407:30c0:182::aa72:3406","TCP","88","55.278735000","[TCP Dup ACK 323#10] [TCP ACKed unseen segment] 57446  >  443 [ACK] Seq=1 Ack=2 Win=501 Len=0 TSval=680162657 TSecr=3899337116"
"3759","55.296679","10.0.0.14","159.124.42.26","TLSv1.2","111","55.296679000","Application Data"
"3777","55.461691","2a06:c701:472d:c000:f796:c198:3a7:a863","2407:30c0:182::aa72:3406","TCP","88","55.461691000","[TCP Dup ACK 396#10] [TCP ACKed unseen segment] 57458  >  443 [ACK] Seq=1 Ack=2 Win=501 Len=0 TSval=680162840 TSecr=2970038552"
"3794","56.025448","10.0.0.14","159.124.42.26","TLSv1.2","139","56.025448000","Application Data"
"3800","56.090327","10.0.0.14","159.124.42.26","TCP","68","56.090327000","36690  >  443 [ACK] Seq=7496 Ack=5650 Win=501 Len=0 TSval=2183509767 TSecr=1967102817"
"3802","56.147939","10.0.0.14","159.124.42.26","TLSv1.2","111","56.147939000","Application Data"
"3810","56.394147","10.0.0.14","159.124.42.26","TLSv1.2","106","56.394147000","Application Data"
"3816","56.500457","10.0.0.14","159.124.42.26","TCP","68","56.500457000","36690  >  443 [ACK] Seq=7577 Ack=5688 Win=501 Len=0 TSval=2183510177 TSecr=1967103186"
"3818","56.537120","10.0.0.14","159.124.42.26","TCP","68","56.537120000","36690  >  443 [ACK] Seq=7577 Ack=5737 Win=501 Len=0 TSval=2183510214 TSecr=1967103263"
"3819","56.537306","10.0.0.14","159.124.42.26","TLSv1.2","135","56.537306000","Application Data"
"3832","56.844399","10.0.0.14","159.124.42.26","TLSv1.2","106","56.844399000","Application Data"
"3841","56.960427","10.0.0.14","159.124.42.26","TCP","68","56.960427000","36698  >  443 [ACK] Seq=1614 Ack=1344 Win=501 Len=0 TSval=2183510637 TSecr=1967103636"
"3843","56.964597","10.0.0.14","159.124.42.26","TCP","68","56.964597000","36698  >  443 [ACK] Seq=1614 Ack=1393 Win=501 Len=0 TSval=2183510641 TSecr=1967103690"
"3845","56.964789","10.0.0.14","159.124.42.26","TLSv1.2","135","56.964789000","Application Data"
"3947","60.163692","10.0.0.14","159.124.42.26","TLSv1.2","106","60.163692000","Application Data"
"3953","60.272367","10.0.0.14","159.124.42.26","TCP","68","60.272367000","36690  >  443 [ACK] Seq=7682 Ack=5775 Win=501 Len=0 TSval=2183513949 TSecr=1967106955"
"3955","60.283838","10.0.0.14","159.124.42.26","TCP","68","60.283838000","36690  >  443 [ACK] Seq=7682 Ack=5824 Win=501 Len=0 TSval=2183513960 TSecr=1967107011"
"3956","60.284002","10.0.0.14","159.124.42.26","TLSv1.2","135","60.284002000","Application Data"
"3970","60.365349","2a06:c701:472d:c000:f796:c198:3a7:a863","2407:30c0:182::aa72:3406","TCP","88","60.365349000","[TCP Dup ACK 323#11] [TCP ACKed unseen segment] 57446  >  443 [ACK] Seq=1 Ack=2 Win=501 Len=0 TSval=680167744 TSecr=3899337116"
"3991","60.582082","2a06:c701:472d:c000:f796:c198:3a7:a863","2407:30c0:182::aa72:3406","TCP","88","60.582082000","[TCP Dup ACK 396#11] [TCP ACKed unseen segment] 57458  >  443 [ACK] Seq=1 Ack=2 Win=501 Len=0 TSval=680167961 TSecr=2970038552"
"3994","60.648072","10.0.0.14","159.124.42.26","TLSv1.2","106","60.648072000","Application Data"
"4000","60.710135","10.0.0.14","159.124.42.26","TLSv1.2","135","60.710135000","Application Data"
"4003","60.756420","10.0.0.14","159.124.42.26","TCP","68","60.756420000","36698  >  443 [ACK] Seq=1786 Ack=1480 Win=501 Len=0 TSval=2183514433 TSecr=1967107441"
"4032","61.268596","2a06:c701:472d:c000:f796:c198:3a7:a863","2a03:2880:f242:c8:face:b00c:0:167","TLSv1.2","159","61.268596000","Application Data"
"4053","61.556918","10.0.0.14","159.124.42.26","TLSv1.2","111","61.556918000","Application Data"
"4062","61.626600","2a06:c701:472d:c000:f796:c198:3a7:a863","2a03:2880:f242:c8:face:b00c:0:167","TLSv1.2","160","61.626600000","Application Data"
"4093","62.080433","10.0.0.14","159.124.42.26","TCP","68","62.080433000","36690  >  443 [ACK] Seq=7792 Ack=5968 Win=501 Len=0 TSval=2183515757 TSecr=1967108758"
"4094","62.086390","10.0.0.14","159.124.42.26","TLSv1.2","111","62.086390000","Application Data"
"4143","63.280048","10.0.0.14","159.124.42.26","TCP","68","63.280048000","36690  >  443 [ACK] Seq=7835 Ack=6040 Win=501 Len=0 TSval=2183516957 TSecr=1967110006"
"4146","63.313952","10.0.0.14","159.124.42.26","TLSv1.2","111","63.313952000","Application Data"
"4188","63.917349","10.0.0.14","159.124.42.26","TLSv1.2","106","63.917349000","Application Data"
"4198","64.028462","10.0.0.14","159.124.42.26","TCP","68","64.028462000","36690  >  443 [ACK] Seq=7916 Ack=6078 Win=501 Len=0 TSval=2183517705 TSecr=1967110708"
"4200","64.030110","10.0.0.14","159.124.42.26","TCP","68","64.030110000","36690  >  443 [ACK] Seq=7916 Ack=6127 Win=501 Len=0 TSval=2183517707 TSecr=1967110758"
"4201","64.030289","10.0.0.14","159.124.42.26","TLSv1.2","135","64.030289000","Application Data"
"4228","64.366509","10.0.0.14","159.124.42.26","TLSv1.2","106","64.366509000","Application Data"
"4237","64.431772","10.0.0.14","159.124.42.26","TCP","68","64.431772000","36698  >  443 [ACK] Seq=1824 Ack=1518 Win=501 Len=0 TSval=2183518108 TSecr=1967111157"
"4244","64.457796","10.0.0.14","159.124.42.26","TCP","68","64.457796000","36698  >  443 [ACK] Seq=1824 Ack=1567 Win=501 Len=0 TSval=2183518134 TSecr=1967111185"
"4245","64.457958","10.0.0.14","159.124.42.26","TLSv1.2","135","64.457958000","Application Data"
"4246","64.472406","10.0.0.14","159.124.42.26","TCP","68","64.472406000","36690  >  443 [ACK] Seq=7983 Ack=6186 Win=501 Len=0 TSval=2183518149 TSecr=1967111155"
"4247","64.475501","10.0.0.14","159.124.42.26","TLSv1.2","111","64.475501000","Application Data"
"4297","65.026275","10.0.0.14","159.124.42.26","TCP","68","65.026275000","36690  >  443 [ACK] Seq=8026 Ack=6258 Win=501 Len=0 TSval=2183518703 TSecr=1967111754"
"4302","65.067163","10.0.0.14","159.124.42.26","TLSv1.2","111","65.067163000","Application Data"
"4320","65.280565","10.0.0.14","159.124.42.26","TCP","68","65.280565000","36690  >  443 [ACK] Seq=8069 Ack=6330 Win=501 Len=0 TSval=2183518957 TSecr=1967112007"
"4322","65.314396","10.0.0.14","159.124.42.26","TLSv1.2","111","65.314396000","Application Data"
"4324","65.325552","10.0.0.14","159.124.42.26","TLSv1.2","821","65.325552000","Application Data"
"4325","65.328626","10.0.0.14","159.124.42.26","TLSv1.2","265","65.328626000","Application Data"
"4337","65.448454","10.0.0.14","159.124.42.26","TCP","68","65.448454000","36690  >  443 [ACK] Seq=9062 Ack=6373 Win=501 Len=0 TSval=2183519125 TSecr=1967112129"
"4342","65.485065","2a06:c701:472d:c000:f796:c198:3a7:a863","2407:30c0:182::aa72:3406","TCP","88","65.485065000","[TCP Dup ACK 323#12] [TCP ACKed unseen segment] 57446  >  443 [ACK] Seq=1 Ack=2 Win=501 Len=0 TSval=680172864 TSecr=3899337116"
"4347","65.534880","10.0.0.14","159.124.42.26","TCP","68","65.534880000","36690  >  443 [ACK] Seq=9062 Ack=6445 Win=501 Len=0 TSval=2183519211 TSecr=1967112261"
"4350","65.566051","10.0.0.14","159.124.42.26","TLSv1.2","111","65.566051000","Application Data"
"4362","65.701762","2a06:c701:472d:c000:f796:c198:3a7:a863","2407:30c0:182::aa72:3406","TCP","88","65.701762000","[TCP Dup ACK 396#12] [TCP ACKed unseen segment] 57458  >  443 [ACK] Seq=1 Ack=2 Win=501 Len=0 TSval=680173080 TSecr=2970038552"
"4385","66.116452","10.0.0.14","159.124.42.26","TCP","68","66.116452000","36690  >  443 [ACK] Seq=9105 Ack=6517 Win=501 Len=0 TSval=2183519793 TSecr=1967112759"
"4388","66.163528","10.0.0.14","159.124.42.26","TLSv1.2","111","66.163528000","Application Data"
"4390","66.188419","2a06:c701:472d:c000:f796:c198:3a7:a863","2a03:2880:f242:c8:face:b00c:0:167","TCP","88","66.188419000","50310  >  443 [ACK] Seq=8138 Ack=4736 Win=501 Len=0 TSval=1246523169 TSecr=607142379"
"4409","66.523043","2a06:c701:472d:c000:f796:c198:3a7:a863","2a03:2880:f242:c8:face:b00c:0:167","TLSv1.2","184","66.523043000","Application Data"
"4411","66.531368","10.0.0.14","159.124.42.26","TCP","68","66.531368000","36690  >  443 [ACK] Seq=9148 Ack=6589 Win=501 Len=0 TSval=2183520208 TSecr=1967113257"
"4412","66.531492","10.0.0.14","159.124.42.26","TLSv1.2","111","66.531492000","Application Data"
"4550","67.028085","10.0.0.14","159.124.42.26","TLSv1.2","111","67.028085000","Application Data"
"4574","67.328379","10.0.0.14","159.124.42.26","TCP","68","67.328379000","36690  >  443 [ACK] Seq=9234 Ack=6733 Win=501 Len=0 TSval=2183521005 TSecr=1967114008"
"4575","67.336808","10.0.0.14","159.124.42.26","TLSv1.2","111","67.336808000","Application Data"
"4598","67.616962","10.0.0.14","104.121.10.34","TLSv1.2","713","67.616962000","Application Data"
"4604","67.672181","10.0.0.14","54.243.239.188","TCP","80","67.672181000","[TCP Dup ACK 867#1] 42442  >  443 [ACK] Seq=3077 Ack=636 Win=64128 Len=0 TSval=2514242805 TSecr=613148230 SLE=713 SRE=714"
"4606","67.672856","10.0.0.14","54.243.239.188","TCP","80","67.672856000","42442  >  443 [ACK] Seq=3077 Ack=682 Win=64128 Len=0 TSval=2514242805 TSecr=613162239 SLE=713 SRE=714"
"4608","67.672891","10.0.0.14","54.243.239.188","TCP","68","67.672891000","42442  >  443 [ACK] Seq=3077 Ack=714 Win=64128 Len=0 TSval=2514242805 TSecr=613162239"
"4609","67.673107","10.0.0.14","54.243.239.188","TCP","68","67.673107000","42442  >  443 [FIN, ACK] Seq=3077 Ack=714 Win=64128 Len=0 TSval=2514242806 TSecr=613162239"
"4610","67.676734","10.0.0.14","159.124.42.26","TLSv1.2","106","67.676734000","Application Data"
"4617","67.742800","10.0.0.14","159.124.42.26","TCP","68","67.742800000","36690  >  443 [ACK] Seq=9315 Ack=6771 Win=501 Len=0 TSval=2183521419 TSecr=1967114467"
"4622","67.778287","10.0.0.14","159.124.42.26","TCP","68","67.778287000","36690  >  443 [ACK] Seq=9315 Ack=6820 Win=501 Len=0 TSval=2183521455 TSecr=1967114505"
"4623","67.778474","10.0.0.14","159.124.42.26","TLSv1.2","135","67.778474000","Application Data"
"4633","67.867648","10.0.0.14","104.121.10.34","TCP","68","67.867648000","46628  >  443 [ACK] Seq=1958 Ack=14922 Win=488 Len=0 TSval=3058298519 TSecr=869997594"
"4634","67.872881","10.0.0.14","104.121.10.34","TLSv1.2","735","67.872881000","Application Data"
"4676","68.139120","10.0.0.14","104.121.10.34","TCP","68","68.139120000","46628  >  443 [ACK] Seq=2625 Ack=16838 Win=501 Len=0 TSval=3058298791 TSecr=869997866"
"4678","68.142437","10.0.0.14","104.121.10.34","TCP","68","68.142437000","46628  >  443 [ACK] Seq=2625 Ack=19636 Win=501 Len=0 TSval=3058298794 TSecr=869997868"
"4680","68.145840","10.0.0.14","104.121.10.34","TCP","68","68.145840000","46628  >  443 [ACK] Seq=2625 Ack=22434 Win=501 Len=0 TSval=3058298797 TSecr=869997871"
"4682","68.147936","10.0.0.14","104.121.10.34","TCP","68","68.147936000","46628  >  443 [ACK] Seq=2625 Ack=25232 Win=501 Len=0 TSval=3058298799 TSecr=869997875"
"4686","68.164509","10.0.0.14","159.124.42.26","TLSv1.2","106","68.164509000","Application Data"
"4691","68.192378","10.0.0.14","104.121.10.34","TCP","68","68.192378000","46628  >  443 [ACK] Seq=2625 Ack=26375 Win=501 Len=0 TSval=3058298844 TSecr=869997878"
"4693","68.215028","10.0.0.14","159.124.42.26","TLSv1.2","135","68.215028000","Application Data"
"4700","68.280431","10.0.0.14","159.124.42.26","TCP","68","68.280431000","36698  >  443 [ACK] Seq=1996 Ack=1654 Win=501 Len=0 TSval=2183521957 TSecr=1967114959"
"4705","68.321534","10.0.0.14","140.82.112.26","TLSv1.2","97","68.321534000","Application Data"
"4734","68.776427","10.0.0.14","159.124.42.26","TLSv1.2","139","68.776427000","Application Data"
"4739","68.845160","10.0.0.14","159.124.42.26","TCP","68","68.845160000","36690  >  443 [ACK] Seq=9453 Ack=6934 Win=501 Len=0 TSval=2183522522 TSecr=1967115572"
"4740","68.845288","10.0.0.14","159.124.42.26","TLSv1.2","111","68.845288000","Application Data"
"4763","69.281474","10.0.0.14","159.124.42.26","TLSv1.2","111","69.281474000","Application Data"
"4773","69.496024","2a06:c701:472d:c000:f796:c198:3a7:a863","2a03:2880:f242:c8:face:b00c:0:167","TLSv1.2","158","69.496024000","Application Data"
"4779","69.657380","2a06:c701:472d:c000:f796:c198:3a7:a863","2a03:2880:f242:c8:face:b00c:0:167","TCP","88","69.657380000","50310  >  443 [ACK] Seq=8304 Ack=4808 Win=501 Len=0 TSval=1246526638 TSecr=607145886"
"4824","70.620410","2a06:c701:472d:c000:f796:c198:3a7:a863","2407:30c0:182::aa72:3406","TCP","88","70.620410000","[TCP Dup ACK 323#13] [TCP ACKed unseen segment] 57446  >  443 [ACK] Seq=1 Ack=2 Win=501 Len=0 TSval=680177999 TSecr=3899337116"
"4831","70.820600","2a06:c701:472d:c000:f796:c198:3a7:a863","2407:30c0:182::aa72:3406","TCP","88","70.820600000","[TCP Dup ACK 396#13] [TCP ACKed unseen segment] 57458  >  443 [ACK] Seq=1 Ack=2 Win=501 Len=0 TSval=680178199 TSecr=2970038552"
"4847","71.414174","10.0.0.14","159.124.42.26","TLSv1.2","106","71.414174000","Application Data"
"4855","71.532439","10.0.0.14","159.124.42.26","TCP","68","71.532439000","36690  >  443 [ACK] Seq=9577 Ack=7044 Win=501 Len=0 TSval=2183525209 TSecr=1967118205"
"4857","71.535776","10.0.0.14","159.124.42.26","TCP","68","71.535776000","36690  >  443 [ACK] Seq=9577 Ack=7093 Win=501 Len=0 TSval=2183525212 TSecr=1967118263"
"4858","71.535988","10.0.0.14","159.124.42.26","TLSv1.2","135","71.535988000","Application Data"
"4867","71.714230","10.0.0.14","159.124.42.26","TLSv1.2","270","71.714230000","Application Data"
"4875","71.820437","10.0.0.14","159.124.42.26","TCP","68","71.820437000","36690  >  443 [ACK] Seq=9846 Ack=7136 Win=501 Len=0 TSval=2183525497 TSecr=1967118507"
"4878","71.861437","10.0.0.14","159.124.42.26","TLSv1.2","106","71.861437000","Application Data"
"4883","71.935415","10.0.0.14","159.124.42.26","TCP","68","71.935415000","36698  >  443 [ACK] Seq=2034 Ack=1692 Win=501 Len=0 TSval=2183525612 TSecr=1967118653"
"4887","72.007784","10.0.0.14","159.124.42.26","TCP","68","72.007784000","36698  >  443 [ACK] Seq=2034 Ack=1741 Win=501 Len=0 TSval=2183525684 TSecr=1967118690"
"4888","72.007982","10.0.0.14","159.124.42.26","TLSv1.2","135","72.007982000","Application Data"
"4935","73.031828","10.0.0.14","159.124.42.26","TCP","68","73.031828000","36690  >  443 [ACK] Seq=9846 Ack=7208 Win=501 Len=0 TSval=2183526708 TSecr=1967119757"
"4936","73.038071","10.0.0.14","159.124.42.26","TLSv1.2","111","73.038071000","Application Data"
"5023","74.324448","10.0.0.14","159.124.42.26","TCP","68","74.324448000","36690  >  443 [ACK] Seq=9889 Ack=7280 Win=501 Len=0 TSval=2183528001 TSecr=1967121008"
"5024","74.331767","10.0.0.14","159.124.42.26","TLSv1.2","111","74.331767000","Application Data"
"5034","74.465501","10.0.0.14","159.124.42.26","TCP","68","74.465501000","36690  >  443 [ACK] Seq=9932 Ack=7339 Win=501 Len=0 TSval=2183528142 TSecr=1967121192"
"5037","74.504644","10.0.0.14","159.124.42.26","TLSv1.2","111","74.504644000","Application Data"
"5041","74.535233","10.0.0.14","159.124.42.26","TCP","68","74.535233000","36690  >  443 [ACK] Seq=9975 Ack=7411 Win=501 Len=0 TSval=2183528212 TSecr=1967121262"
"5043","74.535295","10.0.0.14","159.124.42.26","TCP","68","74.535295000","36690  >  443 [ACK] Seq=9975 Ack=7588 Win=500 Len=0 TSval=2183528212 TSecr=1967121262"
"5048","74.551688","2a06:c701:472d:c000:f796:c198:3a7:a863","2a03:2880:f242:c8:face:b00c:0:167","TCP","88","74.551688000","50310  >  443 [ACK] Seq=8304 Ack=6258 Win=490 Len=0 TSval=1246531532 TSecr=607150783"
"5050","74.552365","2a06:c701:472d:c000:f796:c198:3a7:a863","2a03:2880:f242:c8:face:b00c:0:167","TCP","88","74.552365000","50310  >  443 [ACK] Seq=8304 Ack=6765 Win=493 Len=0 TSval=1246531533 TSecr=607150784"
"5055","74.606653","10.0.0.14","159.124.42.26","TLSv1.2","111","74.606653000","Application Data"
"5081","74.945374","2a06:c701:472d:c000:f796:c198:3a7:a863","2a03:2880:f242:c8:face:b00c:0:167","TLSv1.2","187","74.945374000","Application Data"
"5097","75.145501","10.0.0.14","159.124.42.26","TLSv1.2","106","75.145501000","Application Data"
"5103","75.208408","10.0.0.14","159.124.42.26","TCP","68","75.208408000","36690  >  443 [ACK] Seq=10056 Ack=7626 Win=501 Len=0 TSval=2183528885 TSecr=1967121935"
"5109","75.277402","10.0.0.14","159.124.42.26","TCP","68","75.277402000","36690  >  443 [ACK] Seq=10056 Ack=7675 Win=501 Len=0 TSval=2183528954 TSecr=1967122004"
"5111","75.277417","10.0.0.14","159.124.42.26","TCP","68","75.277417000","36690  >  443 [ACK] Seq=10056 Ack=7747 Win=501 Len=0 TSval=2183528954 TSecr=1967122004"
"5113","75.277458","10.0.0.14","159.124.42.26","TLSv1.2","135","75.277458000","Application Data"
"5115","75.296955","10.0.0.14","159.124.42.26","TLSv1.2","111","75.296955000","Application Data"
