"No.","Time","Source","Destination","Protocol","Length","Time since reference or first frame","Info"
"57","0.818157","10.0.0.14","159.124.42.26","TLSv1.2","106","0.818157000","Application Data"
"66","0.886669","10.0.0.14","159.124.42.26","TCP","68","0.886669000","36690  >  443 [ACK] Seq=39 Ack=39 Win=501 Len=0 TSval=2184683889 TSecr=1968276953"
"71","0.945784","10.0.0.14","159.124.42.26","TCP","68","0.945784000","36690  >  443 [ACK] Seq=39 Ack=88 Win=501 Len=0 TSval=2184683948 TSecr=1968277010"
"72","0.945972","10.0.0.14","159.124.42.26","TLSv1.2","135","0.945972000","Application Data"
"93","1.217265","10.0.0.14","159.124.42.26","TLSv1.2","111","1.217265000","Application Data"
"98","1.275997","10.0.0.14","159.124.42.26","TLSv1.2","106","1.275997000","Application Data"
"109","1.352244","10.0.0.14","159.124.42.26","TCP","68","1.352244000","36698  >  443 [ACK] Seq=39 Ack=39 Win=501 Len=0 TSval=2184684354 TSecr=1968277418"
"113","1.371471","10.0.0.14","159.124.42.26","TCP","68","1.371471000","36698  >  443 [ACK] Seq=39 Ack=88 Win=501 Len=0 TSval=2184684373 TSecr=1968277437"
"114","1.371630","10.0.0.14","159.124.42.26","TLSv1.2","135","1.371630000","Application Data"
"166","1.979332","10.0.0.14","159.124.42.26","TLSv1.2","111","1.979332000","Application Data"
"245","3.504752","2a06:c701:472d:c000:f796:c198:3a7:a863","2407:30c0:182::aa72:3406","TCP","88","3.504752000","[TCP ACKed unseen segment] 57446  >  443 [ACK] Seq=1 Ack=2 Win=501 Len=0 TSval=681340209 TSecr=3899337116"
"247","3.561451","2a06:c701:472d:c000:f796:c198:3a7:a863","2a03:2880:f242:c8:face:b00c:0:167","TCP","88","3.561451000","60612  >  443 [ACK] Seq=1 Ack=1121 Win=493 Len=0 TSval=1247689867 TSecr=2323831712"
"256","3.722850","2a06:c701:472d:c000:f796:c198:3a7:a863","2407:30c0:182::aa72:3406","TCP","88","3.722850000","[TCP ACKed unseen segment] 57458  >  443 [ACK] Seq=1 Ack=2 Win=501 Len=0 TSval=681340427 TSecr=2970038552"
"257","3.725068","2a06:c701:472d:c000:f796:c198:3a7:a863","2a03:2880:f242:c8:face:b00c:0:167","TLSv1.2","184","3.725068000","Application Data"
"283","3.974609","10.0.0.14","159.124.42.26","TLSv1.2","111","3.974609000","Application Data"
"286","4.021895","2a06:c701:472d:c000:f796:c198:3a7:a863","2a03:2880:f242:c8:face:b00c:0:167","TLSv1.2","181","4.021895000","Application Data"
"287","4.022256","2a06:c701:472d:c000:f796:c198:3a7:a863","2a03:2880:f242:c8:face:b00c:0:167","TLSv1.2","181","4.022256000","Application Data"
"383","4.234153","2a06:c701:472d:c000:f796:c198:3a7:a863","2a03:2880:f242:c8:face:b00c:0:167","TCP","88","4.234153000","60612  >  443 [ACK] Seq=283 Ack=1195 Win=501 Len=0 TSval=1247690540 TSecr=2323832390"
"385","4.241192","2a06:c701:472d:c000:f796:c198:3a7:a863","2a03:2880:f242:c8:face:b00c:0:167","TCP","88","4.241192000","60612  >  443 [ACK] Seq=283 Ack=1269 Win=501 Len=0 TSval=1247690547 TSecr=2323832393"
"390","4.299882","10.0.0.14","159.124.42.26","TLSv1.2","139","4.299882000","Application Data"
"391","4.362643","2a06:c701:472d:c000:f796:c198:3a7:a863","2600:9000:2024:8600:e:4185:5680:93a1","TLSv1.2","156","4.362643000","Application Data"
"392","4.363006","2a06:c701:472d:c000:f796:c198:3a7:a863","2600:9000:2024:8600:e:4185:5680:93a1","TLSv1.2","127","4.363006000","Application Data"
"393","4.364085","2a06:c701:472d:c000:f796:c198:3a7:a863","2600:9000:2024:8600:e:4185:5680:93a1","TLSv1.2","150","4.364085000","Application Data"
"400","4.422880","2a06:c701:472d:c000:f796:c198:3a7:a863","2600:9000:2024:8600:e:4185:5680:93a1","TCP","88","4.422880000","33124  >  443 [ACK] Seq=170 Ack=40 Win=501 Len=0 TSval=2849186867 TSecr=3798703321"
"402","4.450962","2a06:c701:472d:c000:f796:c198:3a7:a863","2600:9000:2024:8600:e:4185:5680:93a1","TCP","88","4.450962000","33124  >  443 [ACK] Seq=170 Ack=1071 Win=493 Len=0 TSval=2849186895 TSecr=3798703390"
"403","4.451789","2a06:c701:472d:c000:f796:c198:3a7:a863","2600:9000:2024:8600:e:4185:5680:93a1","TLSv1.2","123","4.451789000","Application Data"
"405","4.466558","2a06:c701:472d:c000:f796:c198:3a7:a863","2600:9000:2024:8600:e:4185:5680:93a1","TLSv1.2","123","4.466558000","Application Data"
"414","4.575812","10.0.0.14","159.124.42.26","TLSv1.2","106","4.575812000","Application Data"
"417","4.586957","10.0.0.14","159.124.42.26","TCP","106","4.586957000","[TCP Retransmission] 36690  >  443 [PSH, ACK] Seq=306 Ack=300 Win=501 Len=38 TSval=2184687589 TSecr=1968280137"
"422","4.645423","10.0.0.14","159.124.42.26","TCP","80","4.645423000","[TCP Dup ACK 283#1] 36690  >  443 [ACK] Seq=344 Ack=300 Win=501 Len=0 TSval=2184687647 TSecr=1968280137 SLE=379 SRE=417"
"426","4.665052","10.0.0.14","159.124.42.26","TCP","88","4.665052000","[TCP Dup ACK 283#2] 36690  >  443 [ACK] Seq=344 Ack=300 Win=501 Len=0 TSval=2184687667 TSecr=1968280137 SLE=379 SRE=417 SLE=379 SRE=417"
"430","4.691532","10.0.0.14","159.124.42.26","TCP","80","4.691532000","[TCP Dup ACK 283#3] 36690  >  443 [ACK] Seq=344 Ack=300 Win=501 Len=0 TSval=2184687694 TSecr=1968280137 SLE=379 SRE=466"
"435","4.741253","10.0.0.14","159.124.42.26","TCP","68","4.741253000","36690  >  443 [ACK] Seq=344 Ack=466 Win=501 Len=0 TSval=2184687743 TSecr=1968280797"
"436","4.741520","10.0.0.14","159.124.42.26","TLSv1.2","135","4.741520000","Application Data"
"440","4.783162","10.0.0.14","159.124.42.26","TLSv1.2","111","4.783162000","Application Data"
"442","4.800260","10.0.0.14","159.124.42.26","TLSv1.2","820","4.800260000","Application Data"
"449","4.922907","10.0.0.14","159.124.42.26","TCP","68","4.922907000","36690  >  443 [ACK] Seq=1206 Ack=509 Win=501 Len=0 TSval=2184687925 TSecr=1968280941"
"454","5.038767","10.0.0.14","159.124.42.26","TLSv1.2","106","5.038767000","Application Data"
"464","5.122239","10.0.0.14","159.124.42.26","TCP","68","5.122239000","36698  >  443 [ACK] Seq=144 Ack=175 Win=501 Len=0 TSval=2184688124 TSecr=1968281171"
"465","5.122356","10.0.0.14","159.124.42.26","TLSv1.2","135","5.122356000","Application Data"
"494","5.758123","10.0.0.14","159.124.42.26","TCP","68","5.758123000","36690  >  443 [ACK] Seq=1206 Ack=568 Win=501 Len=0 TSval=2184688760 TSecr=1968281824"
"496","5.778253","10.0.0.14","159.124.42.26","TLSv1.2","111","5.778253000","Application Data"
"520","6.062711","10.0.0.14","152.199.19.160","TCP","68","6.062711000","42372  >  443 [ACK] Seq=1 Ack=83 Win=501 Len=0 TSval=286513673 TSecr=4171435153"
"521","6.062969","10.0.0.14","152.199.19.160","TCP","68","6.062969000","42372  >  443 [FIN, ACK] Seq=1 Ack=83 Win=501 Len=0 TSval=286513673 TSecr=4171435153"
"577","6.734940","10.0.0.14","159.124.42.26","TCP","68","6.734940000","36690  >  443 [ACK] Seq=1249 Ack=640 Win=501 Len=0 TSval=2184689737 TSecr=1968282758"
"578","6.737760","10.0.0.14","159.124.42.26","TLSv1.2","111","6.737760000","Application Data"
"607","7.092478","2a06:c701:472d:c000:f796:c198:3a7:a863","2a03:2880:f242:c8:face:b00c:0:167","TLSv1.2","159","7.092478000","Application Data"
"622","7.169639","10.0.0.14","52.20.115.236","TCP","76","7.169639000","39120  >  443 [SYN] Seq=0 Win=64240 Len=0 MSS=1460 SACK_PERM=1 TSval=2154539736 TSecr=0 WS=128"
"626","7.185591","2a06:c701:472d:c000:f796:c198:3a7:a863","2a03:2880:f242:c8:face:b00c:0:167","TLSv1.2","285","7.185591000","Application Data"
"628","7.189424","10.0.0.14","159.124.42.26","TCP","68","7.189424000","36690  >  443 [ACK] Seq=1292 Ack=712 Win=501 Len=0 TSval=2184690191 TSecr=1968283256"
"629","7.239621","10.0.0.14","159.124.42.26","TLSv1.2","111","7.239621000","Application Data"
"632","7.275955","2a06:c701:472d:c000:f796:c198:3a7:a863","2a03:2880:f242:c8:face:b00c:0:167","TLSv1.2","225","7.275955000","Application Data"
"633","7.275997","2a06:c701:472d:c000:f796:c198:3a7:a863","2a03:2880:f242:c8:face:b00c:0:167","TLSv1.2","256","7.275997000","Application Data"
"637","7.327823","10.0.0.14","52.20.115.236","TCP","68","7.327823000","39120  >  443 [ACK] Seq=1 Ack=1 Win=64256 Len=0 TSval=2154539894 TSecr=872411222"
"638","7.328014","10.0.0.14","52.20.115.236","TLSv1.2","585","7.328014000","Client Hello"
"640","7.334271","2a06:c701:472d:c000:f796:c198:3a7:a863","2a03:2880:f242:c8:face:b00c:0:167","TCP","88","7.334271000","60612  >  443 [ACK] Seq=856 Ack=1388 Win=501 Len=0 TSval=1247693640 TSecr=2323835489"
"650","7.461689","2a06:c701:472d:c000:f796:c198:3a7:a863","2a03:2880:f242:c8:face:b00c:0:167","TCP","88","7.461689000","60612  >  443 [ACK] Seq=856 Ack=1483 Win=501 Len=0 TSval=1247693768 TSecr=2323835614"
"652","7.462487","2a06:c701:472d:c000:f796:c198:3a7:a863","2a03:2880:f242:c8:face:b00c:0:167","TCP","88","7.462487000","60612  >  443 [ACK] Seq=856 Ack=1578 Win=501 Len=0 TSval=1247693768 TSecr=2323835616"
"659","7.502613","10.0.0.14","52.20.115.236","TCP","68","7.502613000","39120  >  443 [ACK] Seq=518 Ack=4198 Win=60160 Len=0 TSval=2154540069 TSecr=872411383"
"661","7.502683","10.0.0.14","52.20.115.236","TCP","68","7.502683000","39120  >  443 [ACK] Seq=518 Ack=5420 Win=59008 Len=0 TSval=2154540069 TSecr=872411384"
"663","7.505113","10.0.0.14","52.20.115.236","TLSv1.2","194","7.505113000","Client Key Exchange, Change Cipher Spec, Encrypted Handshake Message"
"664","7.505948","10.0.0.14","52.20.115.236","TLSv1.2","173","7.505948000","Application Data"
"665","7.506478","10.0.0.14","52.20.115.236","TLSv1.2","1008","7.506478000","Application Data"
"666","7.507546","10.0.0.14","52.20.115.236","TLSv1.2","400","7.507546000","Application Data"
"678","7.662422","10.0.0.14","52.20.115.236","TCP","68","7.662422000","39120  >  443 [ACK] Seq=2021 Ack=5698 Win=64128 Len=0 TSval=2154540228 TSecr=872411555"
"679","7.662875","10.0.0.14","52.20.115.236","TLSv1.2","106","7.662875000","Application Data"
"693","7.706921","10.0.0.14","52.20.115.236","TCP","68","7.706921000","39120  >  443 [ACK] Seq=2059 Ack=6318 Win=64128 Len=0 TSval=2154540273 TSecr=872411559"
"695","7.722559","10.0.0.14","3.211.112.161","TCP","76","7.722559000","43448  >  443 [SYN] Seq=0 Win=64240 Len=0 MSS=1460 SACK_PERM=1 TSval=288390014 TSecr=0 WS=128"
"705","7.874387","10.0.0.14","3.211.112.161","TCP","68","7.874387000","43448  >  443 [ACK] Seq=1 Ack=1 Win=64256 Len=0 TSval=288390166 TSecr=3807396443"
"706","7.875057","10.0.0.14","3.211.112.161","TLSv1.2","585","7.875057000","Client Hello"
"710","7.943024","10.0.0.14","159.124.42.26","TCP","68","7.943024000","36690  >  443 [ACK] Seq=1335 Ack=784 Win=501 Len=0 TSval=2184690945 TSecr=1968284007"
"711","7.943201","10.0.0.14","159.124.42.26","TLSv1.2","111","7.943201000","Application Data"
"717","8.062361","10.0.0.14","3.211.112.161","TCP","68","8.062361000","43448  >  443 [ACK] Seq=518 Ack=4198 Win=60160 Len=0 TSval=288390354 TSecr=3807396611"
"719","8.062406","10.0.0.14","3.211.112.161","TCP","68","8.062406000","43448  >  443 [ACK] Seq=518 Ack=5448 Win=59008 Len=0 TSval=288390354 TSecr=3807396612"
"721","8.063961","10.0.0.14","3.211.112.161","TLSv1.2","194","8.063961000","Client Key Exchange, Change Cipher Spec, Encrypted Handshake Message"
"722","8.064495","10.0.0.14","3.211.112.161","TLSv1.2","1128","8.064495000","Application Data"
"732","8.229246","10.0.0.14","3.211.112.161","TCP","68","8.229246000","43448  >  443 [ACK] Seq=1704 Ack=6767 Win=64128 Len=0 TSval=288390521 TSecr=3807396784"
"733","8.235947","10.0.0.14","3.211.112.161","TLSv1.2","1062","8.235947000","Application Data"
"736","8.346301","10.0.0.14","159.124.42.26","TLSv1.2","106","8.346301000","Application Data"
"745","8.443524","10.0.0.14","159.124.42.26","TCP","68","8.443524000","36690  >  443 [ACK] Seq=1416 Ack=871 Win=501 Len=0 TSval=2184691446 TSecr=1968284476"
"746","8.443774","10.0.0.14","159.124.42.26","TLSv1.2","135","8.443774000","Application Data"
"747","8.474980","10.0.0.14","3.211.112.161","TCP","68","8.474980000","43448  >  443 [ACK] Seq=2698 Ack=7066 Win=64128 Len=0 TSval=288390767 TSecr=3807396997"
"749","8.491107","10.0.0.14","3.211.112.161","TLSv1.2","232","8.491107000","Application Data"
"757","8.706117","2a06:c701:472d:c000:f796:c198:3a7:a863","2407:30c0:182::aa72:3406","TCP","88","8.706117000","[TCP Dup ACK 245#1] [TCP ACKed unseen segment] 57446  >  443 [ACK] Seq=1 Ack=2 Win=501 Len=0 TSval=681345410 TSecr=3899337116"
"760","8.708103","10.0.0.14","3.211.112.161","TCP","68","8.708103000","43448  >  443 [ACK] Seq=2862 Ack=8432 Win=63104 Len=0 TSval=288391000 TSecr=3807397212"
"762","8.708135","10.0.0.14","3.211.112.161","TCP","68","8.708135000","43448  >  443 [ACK] Seq=2862 Ack=8524 Win=63104 Len=0 TSval=288391000 TSecr=3807397212"
"764","8.708155","10.0.0.14","3.211.112.161","TCP","68","8.708155000","43448  >  443 [ACK] Seq=2862 Ack=8805 Win=62848 Len=0 TSval=288391000 TSecr=3807397212"
"768","8.783536","10.0.0.14","159.124.42.26","TLSv1.2","106","8.783536000","Application Data"
"778","8.891620","2a06:c701:472d:c000:f796:c198:3a7:a863","2407:30c0:182::aa72:3406","TCP","88","8.891620000","[TCP Dup ACK 256#1] [TCP ACKed unseen segment] 57458  >  443 [ACK] Seq=1 Ack=2 Win=501 Len=0 TSval=681345596 TSecr=2970038552"
"780","8.891726","10.0.0.14","159.124.42.26","TCP","68","8.891726000","36698  >  443 [ACK] Seq=249 Ack=262 Win=501 Len=0 TSval=2184691894 TSecr=1968284914"
"781","8.891804","10.0.0.14","159.124.42.26","TLSv1.2","135","8.891804000","Application Data"
"788","9.046952","10.0.0.14","34.237.73.95","TCP","68","9.046952000","49870  >  443 [ACK] Seq=1 Ack=1 Win=501 Len=0 TSval=3771087671 TSecr=758192668"
"835","9.701756","10.0.0.14","3.211.112.161","TCP","68","9.701756000","43448  >  443 [ACK] Seq=2862 Ack=8855 Win=64128 Len=0 TSval=288391994 TSecr=3807398211"
"837","9.701797","10.0.0.14","3.211.112.161","TCP","68","9.701797000","43448  >  443 [ACK] Seq=2862 Ack=8900 Win=64128 Len=0 TSval=288391994 TSecr=3807398211"
"839","9.701822","10.0.0.14","3.211.112.161","TCP","68","9.701822000","43448  >  443 [ACK] Seq=2862 Ack=9094 Win=64000 Len=0 TSval=288391994 TSecr=3807398211"
"844","9.970989","10.0.0.14","13.226.2.114","TCP","68","9.970989000","40468  >  443 [ACK] Seq=1 Ack=1 Win=501 Len=0 TSval=2631454099 TSecr=48993315"
"848","9.997990","10.0.0.14","159.124.42.26","TLSv1.2","111","9.997990000","Application Data"
"914","12.097725","10.0.0.14","159.124.42.26","TLSv1.2","106","12.097725000","Application Data"
"922","12.201248","10.0.0.14","159.124.42.26","TCP","68","12.201248000","36690  >  443 [ACK] Seq=1564 Ack=1030 Win=501 Len=0 TSval=2184695203 TSecr=1968288231"
"923","12.201357","10.0.0.14","159.124.42.26","TLSv1.2","135","12.201357000","Application Data"
"934","12.544831","10.0.0.14","159.124.42.26","TLSv1.2","106","12.544831000","Application Data"
"940","12.622732","10.0.0.14","159.124.42.26","TLSv1.2","135","12.622732000","Application Data"
"945","12.706950","10.0.0.14","159.124.42.26","TCP","68","12.706950000","36698  >  443 [ACK] Seq=421 Ack=349 Win=501 Len=0 TSval=2184695709 TSecr=1968288715"
"975","13.460921","10.0.0.14","3.211.112.161","TLSv1.2","156","13.460921000","Application Data"
"983","13.612719","10.0.0.14","3.211.112.161","TCP","68","13.612719000","43448  >  443 [ACK] Seq=2950 Ack=9139 Win=64128 Len=0 TSval=288395905 TSecr=3807402181"
"988","13.761986","2a06:c701:472d:c000:f796:c198:3a7:a863","2407:30c0:182::aa72:3406","TCP","88","13.761986000","[TCP Dup ACK 245#2] [TCP ACKed unseen segment] 57446  >  443 [ACK] Seq=1 Ack=2 Win=501 Len=0 TSval=681350466 TSecr=3899337116"
"995","13.962081","2a06:c701:472d:c000:f796:c198:3a7:a863","2407:30c0:182::aa72:3406","TCP","88","13.962081000","[TCP Dup ACK 256#2] [TCP ACKed unseen segment] 57458  >  443 [ACK] Seq=1 Ack=2 Win=501 Len=0 TSval=681350666 TSecr=2970038552"
"1053","15.852858","10.0.0.14","159.124.42.26","TLSv1.2","106","15.852858000","Application Data"
"1058","15.921353","10.0.0.14","159.124.42.26","TCP","68","15.921353000","36690  >  443 [ACK] Seq=1669 Ack=1127 Win=501 Len=0 TSval=2184698923 TSecr=1968291932"
"1059","15.921574","10.0.0.14","159.124.42.26","TLSv1.2","111","15.921574000","Application Data"
"1061","15.944568","10.0.0.14","159.124.42.26","TLSv1.2","135","15.944568000","Application Data"
"1078","16.328704","10.0.0.14","159.124.42.26","TLSv1.2","106","16.328704000","Application Data"
"1080","16.370499","10.0.0.14","159.124.42.26","TCP","68","16.370499000","36698  >  443 [ACK] Seq=459 Ack=398 Win=501 Len=0 TSval=2184699373 TSecr=1968292436"
"1081","16.370704","10.0.0.14","159.124.42.26","TLSv1.2","135","16.370704000","Application Data"
"1087","16.438972","10.0.0.14","159.124.42.26","TCP","68","16.438972000","36698  >  443 [ACK] Seq=526 Ack=436 Win=501 Len=0 TSval=2184699441 TSecr=1968292459"
"1115","17.100483","10.0.0.14","159.124.42.26","TLSv1.2","139","17.100483000","Application Data"
"1120","17.218264","10.0.0.14","159.124.42.26","TLSv1.2","111","17.218264000","Application Data"
"1160","18.550414","10.0.0.14","159.124.42.26","TLSv1.2","823","18.550414000","Application Data"
"1165","18.690960","10.0.0.14","159.124.42.26","TCP","68","18.690960000","36690  >  443 [ACK] Seq=2648 Ack=1298 Win=501 Len=0 TSval=2184701693 TSecr=1968294691"
"1172","18.865355","2a06:c701:472d:c000:f796:c198:3a7:a863","2407:30c0:182::aa72:3406","TCP","88","18.865355000","[TCP Dup ACK 245#3] [TCP ACKed unseen segment] 57446  >  443 [ACK] Seq=1 Ack=2 Win=501 Len=0 TSval=681355569 TSecr=3899337116"
"1181","19.081470","2a06:c701:472d:c000:f796:c198:3a7:a863","2407:30c0:182::aa72:3406","TCP","88","19.081470000","[TCP Dup ACK 256#3] [TCP ACKed unseen segment] 57458  >  443 [ACK] Seq=1 Ack=2 Win=501 Len=0 TSval=681355785 TSecr=2970038552"
"1189","19.296676","10.0.0.14","159.124.42.26","TLSv1.2","271","19.296676000","Application Data"
"1194","19.380987","10.0.0.14","159.124.42.26","TCP","68","19.380987000","36690  >  443 [ACK] Seq=2851 Ack=1341 Win=501 Len=0 TSval=2184702383 TSecr=1968295442"
"1200","19.583197","10.0.0.14","159.124.42.26","TLSv1.2","106","19.583197000","Application Data"
"1204","19.646641","10.0.0.14","159.124.42.26","TCP","68","19.646641000","36690  >  443 [ACK] Seq=2889 Ack=1379 Win=501 Len=0 TSval=2184702649 TSecr=1968295713"
"1208","19.690523","10.0.0.14","159.124.42.26","TCP","68","19.690523000","36690  >  443 [ACK] Seq=2889 Ack=1428 Win=501 Len=0 TSval=2184702693 TSecr=1968295757"
"1209","19.690734","10.0.0.14","159.124.42.26","TLSv1.2","135","19.690734000","Application Data"
"1222","20.049077","10.0.0.14","159.124.42.26","TLSv1.2","106","20.049077000","Application Data"
"1230","20.128210","10.0.0.14","159.124.42.26","TCP","68","20.128210000","36698  >  443 [ACK] Seq=564 Ack=474 Win=501 Len=0 TSval=2184703130 TSecr=1968296193"
"1232","20.128241","10.0.0.14","159.124.42.26","TCP","68","20.128241000","36698  >  443 [ACK] Seq=564 Ack=523 Win=501 Len=0 TSval=2184703130 TSecr=1968296193"
"1233","20.128413","10.0.0.14","159.124.42.26","TLSv1.2","135","20.128413000","Application Data"
"1261","20.473622","10.0.0.14","159.124.42.26","TLSv1.2","111","20.473622000","Application Data"
"1319","21.218135","10.0.0.14","159.124.42.26","TLSv1.2","111","21.218135000","Application Data"
"1342","21.945151","10.0.0.14","159.124.42.26","TLSv1.2","111","21.945151000","Application Data"
"1367","22.770947","10.0.0.14","140.82.114.26","TCP","68","22.770947000","37730  >  443 [ACK] Seq=1 Ack=1 Win=501 Len=0 TSval=2095729676 TSecr=80031913"
"1386","23.368205","10.0.0.14","159.124.42.26","TLSv1.2","106","23.368205000","Application Data"
"1391","23.441148","10.0.0.14","159.124.42.26","TCP","68","23.441148000","36690  >  443 [ACK] Seq=3123 Ack=1731 Win=501 Len=0 TSval=2184706443 TSecr=1968299498"
"1392","23.441290","10.0.0.14","159.124.42.26","TLSv1.2","135","23.441290000","Application Data"
"1413","23.779182","10.0.0.14","159.124.42.26","TLSv1.2","106","23.779182000","Application Data"
"1422","23.850576","10.0.0.14","34.237.73.95","TLSv1.2","315","23.850576000","[TCP Previous segment not captured] , Application Data"
"1431","23.882266","10.0.0.14","159.124.42.26","TCP","68","23.882266000","36698  >  443 [ACK] Seq=669 Ack=610 Win=501 Len=0 TSval=2184706884 TSecr=1968299910"
"1432","23.882484","10.0.0.14","159.124.42.26","TLSv1.2","135","23.882484000","Application Data"
"1440","23.978913","10.0.0.14","159.124.42.26","TLSv1.2","111","23.978913000","Application Data"
"1443","23.984761","2a06:c701:472d:c000:f796:c198:3a7:a863","2407:30c0:182::aa72:3406","TCP","88","23.984761000","[TCP Dup ACK 245#4] [TCP ACKed unseen segment] 57446  >  443 [ACK] Seq=1 Ack=2 Win=501 Len=0 TSval=681360689 TSecr=3899337116"
"1448","24.008437","10.0.0.14","34.237.73.95","TCP","68","24.008437000","49870  >  443 [ACK] Seq=249 Ack=271 Win=499 Len=0 TSval=3771102632 TSecr=758252637"
"1452","24.054894","10.0.0.14","104.121.10.34","TCP","68","24.054894000","46628  >  443 [ACK] Seq=1 Ack=1 Win=501 Len=0 TSval=3059484032 TSecr=871138077"
"1463","24.200500","2a06:c701:472d:c000:f796:c198:3a7:a863","2407:30c0:182::aa72:3406","TCP","88","24.200500000","[TCP Dup ACK 256#4] [TCP ACKed unseen segment] 57458  >  443 [ACK] Seq=1 Ack=2 Win=501 Len=0 TSval=681360905 TSecr=2970038552"
"1474","24.310901","2a06:c701:472d:c000:f796:c198:3a7:a863","2a00:1450:4025:402::bc","TCP","88","24.310901000","40856  >  443 [ACK] Seq=1 Ack=1 Win=501 Len=0 TSval=824653697 TSecr=3883614678"
"1534","26.050160","10.0.0.14","159.124.42.26","TLSv1.2","111","26.050160000","Application Data"
"1568","26.692927","10.0.0.14","159.124.42.26","TCP","68","26.692927000","36690  >  443 [ACK] Seq=3276 Ack=2111 Win=501 Len=0 TSval=2184709695 TSecr=1968302754"
"1572","26.739605","10.0.0.14","159.124.42.26","TLSv1.2","111","26.739605000","Application Data"
"1598","27.084886","10.0.0.14","159.124.42.26","TLSv1.2","106","27.084886000","Application Data"
"1606","27.194946","10.0.0.14","159.124.42.26","TCP","68","27.194946000","36690  >  443 [ACK] Seq=3357 Ack=2149 Win=501 Len=0 TSval=2184710197 TSecr=1968303214"
"1608","27.199392","10.0.0.14","159.124.42.26","TCP","68","27.199392000","36690  >  443 [ACK] Seq=3357 Ack=2198 Win=501 Len=0 TSval=2184710201 TSecr=1968303262"
"1610","27.199430","10.0.0.14","159.124.42.26","TCP","68","27.199430000","36690  >  443 [ACK] Seq=3357 Ack=2270 Win=501 Len=0 TSval=2184710201 TSecr=1968303262"
"1611","27.199596","10.0.0.14","159.124.42.26","TLSv1.2","135","27.199596000","Application Data"
"1615","27.246667","10.0.0.14","159.124.42.26","TLSv1.2","111","27.246667000","Application Data"
"1638","27.553107","10.0.0.14","159.124.42.26","TLSv1.2","106","27.553107000","Application Data"
"1645","27.624111","10.0.0.14","159.124.42.26","TLSv1.2","135","27.624111000","Application Data"
"1650","27.674897","10.0.0.14","159.124.42.26","TCP","68","27.674897000","36698  >  443 [ACK] Seq=841 Ack=697 Win=501 Len=0 TSval=2184710677 TSecr=1968303692"
"1662","27.952355","10.0.0.14","159.124.42.26","TLSv1.2","111","27.952355000","Application Data"
"1704","29.105429","2a06:c701:472d:c000:f796:c198:3a7:a863","2407:30c0:182::aa72:3406","TCP","88","29.105429000","[TCP Dup ACK 245#5] [TCP ACKed unseen segment] 57446  >  443 [ACK] Seq=1 Ack=2 Win=501 Len=0 TSval=681365809 TSecr=3899337116"
"1713","29.320815","2a06:c701:472d:c000:f796:c198:3a7:a863","2407:30c0:182::aa72:3406","TCP","88","29.320815000","[TCP Dup ACK 256#5] [TCP ACKed unseen segment] 57458  >  443 [ACK] Seq=1 Ack=2 Win=501 Len=0 TSval=681366025 TSecr=2970038552"
"1729","29.850957","10.0.0.14","159.124.42.26","TLSv1.2","139","29.850957000","Application Data"
"1736","29.928342","10.0.0.14","159.124.42.26","TCP","68","29.928342000","36690  >  443 [ACK] Seq=3581 Ack=2456 Win=501 Len=0 TSval=2184712930 TSecr=1968305993"
"1738","29.947698","10.0.0.14","159.124.42.26","TLSv1.2","111","29.947698000","Application Data"
"1766","30.856008","10.0.0.14","159.124.42.26","TLSv1.2","106","30.856008000","Application Data"
"1773","30.946346","10.0.0.14","159.124.42.26","TCP","68","30.946346000","36690  >  443 [ACK] Seq=3662 Ack=2615 Win=501 Len=0 TSval=2184713948 TSecr=1968306990"
"1774","30.946449","10.0.0.14","159.124.42.26","TLSv1.2","135","30.946449000","Application Data"
"1794","31.202410","10.0.0.14","159.124.42.26","TCP","68","31.202410000","36690  >  443 [ACK] Seq=3729 Ack=2755 Win=501 Len=0 TSval=2184714204 TSecr=1968307263"
"1799","31.257314","10.0.0.14","159.124.42.26","TLSv1.2","111","31.257314000","Application Data"
"1803","31.298754","10.0.0.14","159.124.42.26","TLSv1.2","106","31.298754000","Application Data"
"1813","31.363122","10.0.0.14","159.124.42.26","TCP","68","31.363122000","36698  >  443 [ACK] Seq=879 Ack=735 Win=501 Len=0 TSval=2184714365 TSecr=1968307429"
"1817","31.369746","10.0.0.14","159.124.42.26","TCP","68","31.369746000","36698  >  443 [ACK] Seq=879 Ack=784 Win=501 Len=0 TSval=2184714372 TSecr=1968307435"
"1818","31.369923","10.0.0.14","159.124.42.26","TLSv1.2","135","31.369923000","Application Data"
"1899","32.250572","10.0.0.14","159.124.42.26","TLSv1.2","824","32.250572000","Application Data"
"1907","32.268956","10.0.0.14","159.124.42.26","TLSv1.2","268","32.268956000","Application Data"
"1924","32.386936","10.0.0.14","159.124.42.26","TCP","68","32.386936000","36690  >  443 [ACK] Seq=4728 Ack=2798 Win=501 Len=0 TSval=2184715389 TSecr=1968308400"
"1946","32.690430","10.0.0.14","159.124.42.26","TCP","68","32.690430000","36690  >  443 [ACK] Seq=4728 Ack=2870 Win=501 Len=0 TSval=2184715692 TSecr=1968308756"
"1949","32.700709","10.0.0.14","159.124.42.26","TLSv1.2","111","32.700709000","Application Data"
"1987","33.208458","10.0.0.14","159.124.42.26","TLSv1.2","111","33.208458000","Application Data"
"2020","33.658688","2a06:c701:472d:c000:f796:c198:3a7:a863","2a03:2880:f242:c8:face:b00c:0:167","TLSv1.2","158","33.658688000","Application Data"
"2025","33.705202","10.0.0.14","159.124.42.26","TLSv1.2","111","33.705202000","Application Data"
"2034","33.803648","2a06:c701:472d:c000:f796:c198:3a7:a863","2a03:2880:f242:c8:face:b00c:0:167","TCP","88","33.803648000","60612  >  443 [ACK] Seq=926 Ack=1650 Win=501 Len=0 TSval=1247720110 TSecr=2323861960"
"2047","33.957253","10.0.0.14","159.124.42.26","TLSv1.2","111","33.957253000","Application Data"
"2069","34.217477","10.0.0.14","159.124.42.26","TLSv1.2","111","34.217477000","Application Data"
"2072","34.225281","2a06:c701:472d:c000:f796:c198:3a7:a863","2407:30c0:182::aa72:3406","TCP","88","34.225281000","[TCP Dup ACK 245#6] [TCP ACKed unseen segment] 57446  >  443 [ACK] Seq=1 Ack=2 Win=501 Len=0 TSval=681370929 TSecr=3899337116"
"2089","34.441688","2a06:c701:472d:c000:f796:c198:3a7:a863","2407:30c0:182::aa72:3406","TCP","88","34.441688000","[TCP Dup ACK 256#6] [TCP ACKed unseen segment] 57458  >  443 [ACK] Seq=1 Ack=2 Win=501 Len=0 TSval=681371146 TSecr=2970038552"
"2102","34.615513","10.0.0.14","159.124.42.26","TLSv1.2","106","34.615513000","Application Data"
"2110","34.692463","10.0.0.14","159.124.42.26","TLSv1.2","135","34.692463000","Application Data"
"2114","34.717807","10.0.0.14","159.124.42.26","TLSv1.2","111","34.717807000","Application Data"
"2132","34.958390","10.0.0.14","159.124.42.26","TLSv1.2","111","34.958390000","Application Data"
"2140","35.017608","10.0.0.14","159.124.42.26","TLSv1.2","106","35.017608000","Application Data"
"2156","35.129746","10.0.0.14","159.124.42.26","TCP","68","35.129746000","36698  >  443 [ACK] Seq=984 Ack=871 Win=501 Len=0 TSval=2184718132 TSecr=1968311156"
"2157","35.129915","10.0.0.14","159.124.42.26","TLSv1.2","135","35.129915000","Application Data"
"2165","35.217005","10.0.0.14","159.124.42.26","TLSv1.2","111","35.217005000","Application Data"
"2204","35.891337","2a06:c701:472d:c000:f796:c198:3a7:a863","2a03:2880:f242:c8:face:b00c:0:167","TCP","88","35.891337000","60612  >  443 [ACK] Seq=926 Ack=2994 Win=493 Len=0 TSval=1247722197 TSecr=2323864047"
"2207","35.941188","10.0.0.14","159.124.42.26","TLSv1.2","111","35.941188000","Application Data"
"2214","36.080119","10.0.0.14","159.124.42.26","TLSv1.2","111","36.080119000","Application Data"
"2222","36.228521","2a06:c701:472d:c000:f796:c198:3a7:a863","2a03:2880:f242:c8:face:b00c:0:167","TLSv1.2","184","36.228521000","Application Data"
"2225","36.305405","2a06:c701:472d:c000:f796:c198:3a7:a863","2a03:2880:f242:c8:face:b00c:0:167","TLSv1.2","196","36.305405000","Application Data"
"2232","36.452209","2a06:c701:472d:c000:f796:c198:3a7:a863","2a03:2880:f242:c8:face:b00c:0:167","TCP","88","36.452209000","60612  >  443 [ACK] Seq=1130 Ack=3089 Win=501 Len=0 TSval=1247722758 TSecr=2323864608"
"2262","37.380233","10.0.0.14","140.82.114.26","TLSv1.2","98","37.380233000","[TCP Previous segment not captured] , Application Data"
"2264","37.401339","10.0.0.14","34.237.73.95","TCP","68","37.401339000","49870  >  443 [ACK] Seq=249 Ack=309 Win=501 Len=0 TSval=3771116025 TSecr=758266030"
"2292","37.911429","10.0.0.14","18.211.70.132","TCP","76","37.911429000","60404  >  443 [SYN] Seq=0 Win=64240 Len=0 MSS=1460 SACK_PERM=1 TSval=3083414332 TSecr=0 WS=128"
"2298","37.990953","10.0.0.14","159.124.42.26","TCP","68","37.990953000","36690  >  443 [ACK] Seq=5263 Ack=3664 Win=501 Len=0 TSval=2184720993 TSecr=1968314007"
"2300","38.004084","10.0.0.14","159.124.42.26","TLSv1.2","111","38.004084000","Application Data"
"2303","38.068386","10.0.0.14","18.211.70.132","TCP","68","38.068386000","60404  >  443 [ACK] Seq=1 Ack=1 Win=64256 Len=0 TSval=3083414489 TSecr=1220597164"
"2304","38.069048","10.0.0.14","18.211.70.132","TLSv1.2","585","38.069048000","Client Hello"
"2313","38.243631","10.0.0.14","18.211.70.132","TCP","68","38.243631000","60404  >  443 [ACK] Seq=518 Ack=4198 Win=60160 Len=0 TSval=3083414665 TSecr=1220597326"
"2315","38.243675","10.0.0.14","18.211.70.132","TCP","68","38.243675000","60404  >  443 [ACK] Seq=518 Ack=5428 Win=59008 Len=0 TSval=3083414665 TSecr=1220597327"
"2316","38.245228","10.0.0.14","18.211.70.132","TLSv1.2","194","38.245228000","Client Key Exchange, Change Cipher Spec, Encrypted Handshake Message"
"2317","38.245752","10.0.0.14","18.211.70.132","TLSv1.2","530","38.245752000","Application Data, Application Data"
"2318","38.246098","10.0.0.14","18.211.70.132","TLSv1.2","1613","38.246098000","Application Data"
"2323","38.331333","10.0.0.14","159.124.42.26","TLSv1.2","106","38.331333000","Application Data"
"2326","38.402072","10.0.0.14","159.124.42.26","TCP","68","38.402072000","36690  >  443 [ACK] Seq=5344 Ack=3702 Win=501 Len=0 TSval=2184721404 TSecr=1968314461"
"2333","38.406163","10.0.0.14","18.211.70.132","TCP","68","38.406163000","60404  >  443 [ACK] Seq=2651 Ack=5706 Win=64128 Len=0 TSval=3083414827 TSecr=1220597500"
"2334","38.406437","10.0.0.14","18.211.70.132","TLSv1.2","106","38.406437000","Application Data"
"2336","38.432496","10.0.0.14","104.121.10.34","TLSv1.2","713","38.432496000","[TCP Previous segment not captured] , Application Data"
"2338","38.440345","10.0.0.14","159.124.42.26","TCP","68","38.440345000","36690  >  443 [ACK] Seq=5344 Ack=3751 Win=501 Len=0 TSval=2184721442 TSecr=1968314505"
"2339","38.440561","10.0.0.14","159.124.42.26","TLSv1.2","135","38.440561000","Application Data"
"2350","38.680474","10.0.0.14","104.121.10.34","TCP","68","38.680474000","46628  >  443 [ACK] Seq=647 Ack=1735 Win=488 Len=0 TSval=3059498657 TSecr=871197747"
"2351","38.685557","10.0.0.14","104.121.10.34","TLSv1.2","735","38.685557000","Application Data"
"2373","38.805758","10.0.0.14","159.124.42.26","TLSv1.2","106","38.805758000","Application Data"
"2381","38.882310","10.0.0.14","159.124.42.26","TCP","68","38.882310000","36698  >  443 [ACK] Seq=1089 Ack=958 Win=501 Len=0 TSval=2184721884 TSecr=1968314938"
"2382","38.882466","10.0.0.14","159.124.42.26","TLSv1.2","135","38.882466000","Application Data"
"2398","38.950767","10.0.0.14","104.121.10.34","TCP","68","38.950767000","46628  >  443 [ACK] Seq=1314 Ack=3651 Win=501 Len=0 TSval=3059498928 TSecr=871198017"
"2400","38.955690","10.0.0.14","104.121.10.34","TCP","68","38.955690000","46628  >  443 [ACK] Seq=1314 Ack=6449 Win=501 Len=0 TSval=3059498933 TSecr=871198019"
"2403","38.960679","10.0.0.14","104.121.10.34","TCP","68","38.960679000","46628  >  443 [ACK] Seq=1314 Ack=9247 Win=501 Len=0 TSval=3059498938 TSecr=871198022"
"2408","38.963697","10.0.0.14","104.121.10.34","TCP","68","38.963697000","46628  >  443 [ACK] Seq=1314 Ack=12045 Win=501 Len=0 TSval=3059498941 TSecr=871198026"
"2415","39.014912","10.0.0.14","104.121.10.34","TCP","68","39.014912000","46628  >  443 [ACK] Seq=1314 Ack=13188 Win=501 Len=0 TSval=3059498992 TSecr=871198029"
"2436","39.345184","2a06:c701:472d:c000:f796:c198:3a7:a863","2407:30c0:182::aa72:3406","TCP","88","39.345184000","[TCP Dup ACK 245#7] [TCP ACKed unseen segment] 57446  >  443 [ACK] Seq=1 Ack=2 Win=501 Len=0 TSval=681376049 TSecr=3899337116"
"2445","39.561647","2a06:c701:472d:c000:f796:c198:3a7:a863","2407:30c0:182::aa72:3406","TCP","88","39.561647000","[TCP Dup ACK 256#7] [TCP ACKed unseen segment] 57458  >  443 [ACK] Seq=1 Ack=2 Win=501 Len=0 TSval=681376266 TSecr=2970038552"
"2526","41.279323","10.0.0.14","159.124.42.26","TLSv1.2","111","41.279323000","Application Data"
"2545","41.497015","10.0.0.14","159.124.42.26","TLSv1.2","111","41.497015000","Application Data"
"2566","42.110970","10.0.0.14","159.124.42.26","TCP","68","42.110970000","36690  >  443 [ACK] Seq=5497 Ack=3967 Win=501 Len=0 TSval=2184725113 TSecr=1968318008"
"2568","42.112583","10.0.0.14","159.124.42.26","TLSv1.2","106","42.112583000","Application Data"
"2569","42.112669","10.0.0.14","159.124.42.26","TLSv1.2","111","42.112669000","Application Data"
"2573","42.261662","10.0.0.14","159.124.42.26","TCP","68","42.261662000","36690  >  443 [ACK] Seq=5578 Ack=4005 Win=501 Len=0 TSval=2184725264 TSecr=1968318244"
"2576","42.265274","10.0.0.14","159.124.42.26","TCP","68","42.265274000","36690  >  443 [ACK] Seq=5578 Ack=4054 Win=501 Len=0 TSval=2184725267 TSecr=1968318262"
"2577","42.265422","10.0.0.14","159.124.42.26","TLSv1.2","135","42.265422000","Application Data"
"2589","42.553739","10.0.0.14","159.124.42.26","TLSv1.2","106","42.553739000","Application Data"
"2591","42.650482","10.0.0.14","159.124.42.26","TLSv1.2","139","42.650482000","Application Data"
"2598","42.685111","10.0.0.14","159.124.42.26","TLSv1.2","135","42.685111000","Application Data"
"2606","42.790957","10.0.0.14","159.124.42.26","TCP","68","42.790957000","36698  >  443 [ACK] Seq=1261 Ack=1045 Win=501 Len=0 TSval=2184725793 TSecr=1968318814"
"2607","42.790982","10.0.0.14","159.124.42.26","TCP","68","42.790982000","36690  >  443 [ACK] Seq=5716 Ack=4133 Win=501 Len=0 TSval=2184725793 TSecr=1968318815"
"2608","42.809130","10.0.0.14","159.124.42.26","TLSv1.2","111","42.809130000","Application Data"
"2652","43.942785","10.0.0.14","159.124.42.26","TCP","68","43.942785000","36690  >  443 [ACK] Seq=5759 Ack=4205 Win=501 Len=0 TSval=2184726945 TSecr=1968320009"
"2653","43.942951","10.0.0.14","159.124.42.26","TLSv1.2","111","43.942951000","Application Data"
"2671","44.522263","2a06:c701:472d:c000:f796:c198:3a7:a863","2407:30c0:182::aa72:3406","TCP","88","44.522263000","[TCP Dup ACK 245#8] [TCP ACKed unseen segment] 57446  >  443 [ACK] Seq=1 Ack=2 Win=501 Len=0 TSval=681381226 TSecr=3899337116"
"2681","44.725556","2a06:c701:472d:c000:f796:c198:3a7:a863","2407:30c0:182::aa72:3406","TCP","88","44.725556000","[TCP Dup ACK 256#8] [TCP ACKed unseen segment] 57458  >  443 [ACK] Seq=1 Ack=2 Win=501 Len=0 TSval=681381430 TSecr=2970038552"
"2713","45.852096","10.0.0.14","159.124.42.26","TLSv1.2","106","45.852096000","Application Data"
"2720","45.942345","10.0.0.14","159.124.42.26","TCP","68","45.942345000","36690  >  443 [ACK] Seq=5840 Ack=4292 Win=501 Len=0 TSval=2184728944 TSecr=1968321982"
"2721","45.942506","10.0.0.14","159.124.42.26","TLSv1.2","135","45.942506000","Application Data"
"2724","46.000742","10.0.0.14","159.124.42.26","TLSv1.2","823","46.000742000","Application Data"
"2731","46.134961","10.0.0.14","159.124.42.26","TCP","68","46.134961000","36690  >  443 [ACK] Seq=6662 Ack=4335 Win=501 Len=0 TSval=2184729137 TSecr=1968322141"
"2737","46.281917","10.0.0.14","159.124.42.26","TCP","68","46.281917000","36690  >  443 [ACK] Seq=6662 Ack=4394 Win=501 Len=0 TSval=2184729284 TSecr=1968322344"
"2740","46.302039","10.0.0.14","159.124.42.26","TLSv1.2","106","46.302039000","Application Data"
"2741","46.302120","10.0.0.14","159.124.42.26","TLSv1.2","111","46.302120000","Application Data"
"2743","46.328598","2a06:c701:472d:c000:f796:c198:3a7:a863","2a03:2880:f242:c8:face:b00c:0:167","TLSv1.2","1646","46.328598000","Application Data"
"2755","46.364857","10.0.0.14","159.124.42.26","TCP","68","46.364857000","36698  >  443 [ACK] Seq=1299 Ack=1083 Win=501 Len=0 TSval=2184729367 TSecr=1968322432"
"2758","46.368317","10.0.0.14","159.124.42.26","TCP","68","46.368317000","36698  >  443 [ACK] Seq=1299 Ack=1132 Win=501 Len=0 TSval=2184729370 TSecr=1968322436"
"2759","46.368482","10.0.0.14","159.124.42.26","TLSv1.2","135","46.368482000","Application Data"
"2766","46.385022","2a06:c701:472d:c000:f796:c198:3a7:a863","2a03:2880:f242:c8:face:b00c:0:167","TLSv1.2","207","46.385022000","Application Data"
"2767","46.385596","2a06:c701:472d:c000:f796:c198:3a7:a863","2a03:2880:f242:c8:face:b00c:0:167","TCP","96","46.385596000","38978  >  443 [SYN] Seq=0 Win=64800 Len=0 MSS=1440 SACK_PERM=1 TSval=1247732692 TSecr=0 WS=128"
"2773","46.447368","2a06:c701:472d:c000:f796:c198:3a7:a863","2a03:2880:f242:c8:face:b00c:0:167","TCP","88","46.447368000","38978  >  443 [ACK] Seq=1 Ack=1 Win=64896 Len=0 TSval=1247732753 TSecr=1726049139"
"2774","46.447938","2a06:c701:472d:c000:f796:c198:3a7:a863","2a03:2880:f242:c8:face:b00c:0:167","TLSv1.3","605","46.447938000","Client Hello"
"2779","46.481829","2a06:c701:472d:c000:f796:c198:3a7:a863","2a03:2880:f242:c8:face:b00c:0:167","TCP","88","46.481829000","60612  >  443 [ACK] Seq=2807 Ack=3153 Win=501 Len=0 TSval=1247732788 TSecr=2323874633"
"2785","46.505754","2a06:c701:472d:c000:f796:c198:3a7:a863","2a03:2880:f242:c8:face:b00c:0:167","TCP","88","46.505754000","38978  >  443 [ACK] Seq=518 Ack=213 Win=64768 Len=0 TSval=1247732812 TSecr=1726049204"
"2786","46.506363","2a06:c701:472d:c000:f796:c198:3a7:a863","2a03:2880:f242:c8:face:b00c:0:167","TLSv1.3","152","46.506363000","Change Cipher Spec, Application Data"
"2787","46.506638","2a06:c701:472d:c000:f796:c198:3a7:a863","2a03:2880:f242:c8:face:b00c:0:167","TLSv1.3","186","46.506638000","Application Data"
"2788","46.507738","2a06:c701:472d:c000:f796:c198:3a7:a863","2a03:2880:f242:c8:face:b00c:0:167","TLSv1.3","584","46.507738000","Application Data"
"2789","46.507909","2a06:c701:472d:c000:f796:c198:3a7:a863","2a03:2880:f242:c8:face:b00c:0:167","TLSv1.3","909","46.507909000","Application Data"
"2792","46.532746","2a06:c701:472d:c000:f796:c198:3a7:a863","2a03:2880:f242:c8:face:b00c:0:167","TCP","88","46.532746000","60612  >  443 [ACK] Seq=2807 Ack=3393 Win=500 Len=0 TSval=1247732839 TSecr=2323874689"
"2800","46.562700","2a06:c701:472d:c000:f796:c198:3a7:a863","2a03:2880:f242:c8:face:b00c:0:167","TCP","88","46.562700000","38978  >  443 [ACK] Seq=1997 Ack=524 Win=64512 Len=0 TSval=1247732869 TSecr=1726049258"
"2801","46.562910","2a06:c701:472d:c000:f796:c198:3a7:a863","2a03:2880:f242:c8:face:b00c:0:167","TLSv1.3","119","46.562910000","Application Data"
"2802","46.568374","2a06:c701:472d:c000:f796:c198:3a7:a863","2a03:2880:f242:c8:face:b00c:0:167","TLSv1.3","211","46.568374000","Application Data"
"2803","46.568484","2a06:c701:472d:c000:f796:c198:3a7:a863","2a03:2880:f242:c8:face:b00c:0:167","TLSv1.3","909","46.568484000","Application Data"
"2812","46.622341","2a06:c701:472d:c000:f796:c198:3a7:a863","2a03:2880:f242:c8:face:b00c:0:167","TCP","88","46.622341000","38978  >  443 [ACK] Seq=2972 Ack=1045 Win=64128 Len=0 TSval=1247732928 TSecr=1726049293"
"2825","46.734931","2a06:c701:472d:c000:f796:c198:3a7:a863","2a03:2880:f242:c8:face:b00c:0:167","TCP","88","46.734931000","38978  >  443 [ACK] Seq=2972 Ack=1248 Win=64128 Len=0 TSval=1247733041 TSecr=1726049354"
"2827","46.746901","10.0.0.14","159.124.42.26","TCP","68","46.746901000","36690  >  443 [ACK] Seq=6705 Ack=4466 Win=501 Len=0 TSval=2184729749 TSecr=1968322761"
"2829","46.756850","10.0.0.14","159.124.42.26","TLSv1.2","111","46.756850000","Application Data"
"3022","49.454924","10.0.0.14","159.124.42.26","TLSv1.2","272","49.454924000","Application Data"
"3030","49.542792","10.0.0.14","159.124.42.26","TCP","68","49.542792000","36690  >  443 [ACK] Seq=6952 Ack=4509 Win=501 Len=0 TSval=2184732545 TSecr=1968325604"
"3034","49.584910","2a06:c701:472d:c000:f796:c198:3a7:a863","2407:30c0:182::aa72:3406","TCP","88","49.584910000","[TCP Dup ACK 245#9] [TCP ACKed unseen segment] 57446  >  443 [ACK] Seq=1 Ack=2 Win=501 Len=0 TSval=681386289 TSecr=3899337116"
"3037","49.602170","10.0.0.14","159.124.42.26","TLSv1.2","106","49.602170000","Application Data"
"3044","49.672215","10.0.0.14","159.124.42.26","TCP","68","49.672215000","36690  >  443 [ACK] Seq=6990 Ack=4547 Win=501 Len=0 TSval=2184732674 TSecr=1968325738"
"3047","49.689562","10.0.0.14","159.124.42.26","TCP","68","49.689562000","36690  >  443 [ACK] Seq=6990 Ack=4596 Win=501 Len=0 TSval=2184732692 TSecr=1968325756"
"3048","49.689748","10.0.0.14","159.124.42.26","TLSv1.2","135","49.689748000","Application Data"
"3060","49.801997","2a06:c701:472d:c000:f796:c198:3a7:a863","2407:30c0:182::aa72:3406","TCP","88","49.801997000","[TCP Dup ACK 256#9] [TCP ACKed unseen segment] 57458  >  443 [ACK] Seq=1 Ack=2 Win=501 Len=0 TSval=681386506 TSecr=2970038552"
"3072","49.947949","10.0.0.14","159.124.42.26","TLSv1.2","111","49.947949000","Application Data"
"3079","50.085315","10.0.0.14","159.124.42.26","TLSv1.2","106","50.085315000","Application Data"
"3085","50.130448","10.0.0.14","159.124.42.26","TLSv1.2","135","50.130448000","Application Data"
"3090","50.198979","10.0.0.14","159.124.42.26","TCP","68","50.198979000","36698  >  443 [ACK] Seq=1471 Ack=1219 Win=501 Len=0 TSval=2184733201 TSecr=1968326215"
"3121","50.934920","2a06:c701:472d:c000:f796:c198:3a7:a863","2600:9000:2024:8600:e:4185:5680:93a1","TCP","88","50.934920000","[TCP Keep-Alive] 33124  >  443 [ACK] Seq=239 Ack=2099 Win=501 Len=0 TSval=2849233379 TSecr=3798703424"
"3140","51.193973","10.0.0.14","159.124.42.26","TCP","68","51.193973000","36690  >  443 [ACK] Seq=7100 Ack=4917 Win=501 Len=0 TSval=2184734196 TSecr=1968327260"
"3142","51.204414","10.0.0.14","159.124.42.26","TLSv1.2","111","51.204414000","Application Data"
"3177","51.702884","10.0.0.14","159.124.42.26","TLSv1.2","111","51.702884000","Application Data"
"3199","51.986935","10.0.0.14","159.124.42.26","TCP","68","51.986935000","36690  >  443 [ACK] Seq=7186 Ack=5061 Win=501 Len=0 TSval=2184734989 TSecr=1968328012"
"3202","52.008691","10.0.0.14","159.124.42.26","TLSv1.2","111","52.008691000","Application Data"
"3228","52.765268","2a06:c701:472d:c000:f796:c198:3a7:a863","2a03:2880:f242:c8:face:b00c:0:167","TLSv1.2","159","52.765268000","Application Data"
"3243","52.942416","10.0.0.14","159.124.42.26","TCP","68","52.942416000","36690  >  443 [ACK] Seq=7229 Ack=5133 Win=501 Len=0 TSval=2184735944 TSecr=1968329007"
"3244","52.957076","10.0.0.14","159.124.42.26","TLSv1.2","111","52.957076000","Application Data"
"3247","52.978946","10.0.0.14","52.20.115.236","TCP","68","52.978946000","[TCP Keep-Alive] 39120  >  443 [ACK] Seq=2058 Ack=6318 Win=64128 Len=0 TSval=2154585545 TSecr=872411753"
"3276","53.315921","10.0.0.14","159.124.42.26","TLSv1.2","106","53.315921000","Application Data"
"3289","53.395001","10.0.0.14","18.211.70.132","TLSv1.2","110","53.395001000","Application Data"
"3294","53.430973","10.0.0.14","159.124.42.26","TCP","68","53.430973000","36690  >  443 [ACK] Seq=7310 Ack=5171 Win=501 Len=0 TSval=2184736433 TSecr=1968329452"
"3298","53.441331","10.0.0.14","159.124.42.26","TCP","68","53.441331000","36690  >  443 [ACK] Seq=7310 Ack=5220 Win=501 Len=0 TSval=2184736443 TSecr=1968329505"
"3300","53.441361","10.0.0.14","159.124.42.26","TCP","68","53.441361000","36690  >  443 [ACK] Seq=7310 Ack=5292 Win=501 Len=0 TSval=2184736443 TSecr=1968329505"
"3301","53.441491","10.0.0.14","159.124.42.26","TLSv1.2","135","53.441491000","Application Data"
"3304","53.461544","10.0.0.14","159.124.42.26","TLSv1.2","111","53.461544000","Application Data"
"3338","53.759534","10.0.0.14","159.124.42.26","TLSv1.2","106","53.759534000","Application Data"
"3350","53.828151","10.0.0.14","159.124.42.26","TCP","68","53.828151000","36698  >  443 [ACK] Seq=1509 Ack=1257 Win=501 Len=0 TSval=2184736830 TSecr=1968329895"
"3360","53.881201","10.0.0.14","159.124.42.26","TCP","68","53.881201000","36698  >  443 [ACK] Seq=1509 Ack=1306 Win=501 Len=0 TSval=2184736883 TSecr=1968329942"
"3361","53.881396","10.0.0.14","159.124.42.26","TLSv1.2","135","53.881396000","Application Data"
"3424","54.517904","10.0.0.14","159.124.42.26","TLSv1.2","241","54.517904000","Application Data"
"3435","54.642973","10.0.0.14","159.124.42.26","TCP","68","54.642973000","36690  >  443 [ACK] Seq=7593 Ack=5335 Win=501 Len=0 TSval=2184737645 TSecr=1968330663"
"3440","54.705175","2a06:c701:472d:c000:f796:c198:3a7:a863","2407:30c0:182::aa72:3406","TCP","88","54.705175000","[TCP Dup ACK 245#10] [TCP ACKed unseen segment] 57446  >  443 [ACK] Seq=1 Ack=2 Win=501 Len=0 TSval=681391409 TSecr=3899337116"
"3459","54.920749","2a06:c701:472d:c000:f796:c198:3a7:a863","2407:30c0:182::aa72:3406","TCP","88","54.920749000","[TCP Dup ACK 256#10] [TCP ACKed unseen segment] 57458  >  443 [ACK] Seq=1 Ack=2 Win=501 Len=0 TSval=681391625 TSecr=2970038552"
"3468","55.030892","10.0.0.14","13.226.2.114","TCP","68","55.030892000","[TCP Dup ACK 844#1] 40468  >  443 [ACK] Seq=1 Ack=1 Win=501 Len=0 TSval=2631499159 TSecr=49038370"
"3500","55.500006","10.0.0.14","159.124.42.26","TLSv1.2","139","55.500006000","Application Data"
"3507","55.573575","10.0.0.14","159.124.42.26","TCP","68","55.573575000","36690  >  443 [ACK] Seq=7664 Ack=5378 Win=501 Len=0 TSval=2184738576 TSecr=1968331638"
"3509","55.573612","10.0.0.14","159.124.42.26","TCP","68","55.573612000","36690  >  443 [ACK] Seq=7664 Ack=5449 Win=501 Len=0 TSval=2184738576 TSecr=1968331638"
"3510","55.573822","10.0.0.14","159.124.42.26","TLSv1.2","111","55.573822000","Application Data"
"3575","56.316828","10.0.0.14","159.124.42.26","TLSv1.2","111","56.316828000","Application Data"
"3587","56.465081","10.0.0.14","159.124.42.26","TLSv1.2","111","56.465081000","Application Data"
"3612","56.690935","10.0.0.14","159.124.42.26","TCP","68","56.690935000","36690  >  443 [ACK] Seq=7793 Ack=5720 Win=501 Len=0 TSval=2184739693 TSecr=1968332755"
"3614","56.715938","10.0.0.14","159.124.42.26","TLSv1.2","111","56.715938000","Application Data"
"3642","57.078666","10.0.0.14","159.124.42.26","TLSv1.2","106","57.078666000","Application Data"
"3656","57.190965","10.0.0.14","159.124.42.26","TCP","68","57.190965000","36690  >  443 [ACK] Seq=7874 Ack=5758 Win=501 Len=0 TSval=2184740193 TSecr=1968333210"
"3659","57.200215","10.0.0.14","159.124.42.26","TCP","68","57.200215000","36690  >  443 [ACK] Seq=7874 Ack=5807 Win=501 Len=0 TSval=2184740202 TSecr=1968333262"
"3660","57.200407","10.0.0.14","159.124.42.26","TLSv1.2","135","57.200407000","Application Data"
"3695","57.519328","10.0.0.14","159.124.42.26","TLSv1.2","106","57.519328000","Application Data"
"3709","57.626410","10.0.0.14","159.124.42.26","TCP","68","57.626410000","36698  >  443 [ACK] Seq=1614 Ack=1393 Win=501 Len=0 TSval=2184740628 TSecr=1968333652"
"3710","57.626555","10.0.0.14","159.124.42.26","TLSv1.2","135","57.626555000","Application Data"
"3770","58.236921","10.0.0.14","159.124.42.26","TLSv1.2","111","58.236921000","Application Data"
"3790","58.478760","10.0.0.14","159.124.42.26","TLSv1.2","111","58.478760000","Application Data"
"3818","58.870976","10.0.0.14","3.211.112.161","TCP","68","58.870976000","[TCP Keep-Alive] 43448  >  443 [ACK] Seq=2949 Ack=9139 Win=64128 Len=0 TSval=288441163 TSecr=3807402181"
"3862","59.475741","10.0.0.14","159.124.42.26","TLSv1.2","111","59.475741000","Application Data"
"3876","59.750341","10.0.0.14","159.124.42.26","TLSv1.2","820","59.750341000","Application Data"
"3882","59.824676","2a06:c701:472d:c000:f796:c198:3a7:a863","2407:30c0:182::aa72:3406","TCP","88","59.824676000","[TCP Dup ACK 245#11] [TCP ACKed unseen segment] 57446  >  443 [ACK] Seq=1 Ack=2 Win=501 Len=0 TSval=681396529 TSecr=3899337116"
"3884","59.874887","10.0.0.14","159.124.42.26","TCP","68","59.874887000","36690  >  443 [ACK] Seq=8822 Ack=6066 Win=501 Len=0 TSval=2184742877 TSecr=1968335884"
"3888","59.951050","10.0.0.14","159.124.42.26","TCP","68","59.951050000","36690  >  443 [ACK] Seq=8822 Ack=6138 Win=501 Len=0 TSval=2184742953 TSecr=1968336006"
"3890","59.989624","10.0.0.14","159.124.42.26","TLSv1.2","111","59.989624000","Application Data"
"3896","60.040101","2a06:c701:472d:c000:f796:c198:3a7:a863","2407:30c0:182::aa72:3406","TCP","88","60.040101000","[TCP Dup ACK 256#11] [TCP ACKed unseen segment] 57458  >  443 [ACK] Seq=1 Ack=2 Win=501 Len=0 TSval=681396744 TSecr=2970038552"
"3914","60.200978","10.0.0.14","159.124.42.26","TCP","68","60.200978000","36690  >  443 [ACK] Seq=8865 Ack=6387 Win=501 Len=0 TSval=2184743203 TSecr=1968336260"
"3917","60.238974","10.0.0.14","159.124.42.26","TLSv1.2","111","60.238974000","Application Data"
"3948","60.477153","10.0.0.14","159.124.42.26","TLSv1.2","111","60.477153000","Application Data"
"3977","60.733788","10.0.0.14","159.124.42.26","TLSv1.2","111","60.733788000","Application Data"
"3989","60.830514","10.0.0.14","159.124.42.26","TLSv1.2","106","60.830514000","Application Data"
"4004","60.946894","10.0.0.14","159.124.42.26","TCP","68","60.946894000","36690  >  443 [ACK] Seq=9032 Ack=6569 Win=501 Len=0 TSval=2184743949 TSecr=1968336960"
"4007","60.952002","10.0.0.14","159.124.42.26","TCP","68","60.952002000","36690  >  443 [ACK] Seq=9032 Ack=6618 Win=501 Len=0 TSval=2184743954 TSecr=1968337011"
"4008","60.952201","10.0.0.14","159.124.42.26","TLSv1.2","135","60.952201000","Application Data"
"4036","61.279701","10.0.0.14","159.124.42.26","TLSv1.2","106","61.279701000","Application Data"
"4047","61.372452","10.0.0.14","159.124.42.26","TCP","68","61.372452000","36698  >  443 [ACK] Seq=1719 Ack=1480 Win=501 Len=0 TSval=2184744374 TSecr=1968337412"
"4048","61.372537","10.0.0.14","159.124.42.26","TLSv1.2","135","61.372537000","Application Data"
"4056","61.443361","10.0.0.14","159.124.42.26","TLSv1.2","111","61.443361000","Application Data"
"4115","61.982952","10.0.0.14","159.124.42.26","TCP","68","61.982952000","36690  >  443 [ACK] Seq=9142 Ack=6762 Win=501 Len=0 TSval=2184744985 TSecr=1968338006"
"4116","61.997992","10.0.0.14","159.124.42.26","TLSv1.2","111","61.997992000","Application Data"
"4207","62.946228","10.0.0.14","159.124.42.26","TCP","68","62.946228000","36690  >  443 [ACK] Seq=9185 Ack=6830 Win=501 Len=0 TSval=2184745948 TSecr=1968339012"
"4210","62.999072","10.0.0.14","159.124.42.26","TLSv1.2","111","62.999072000","Application Data"
"4263","63.702272","10.0.0.14","159.124.42.26","TCP","68","63.702272000","36690  >  443 [ACK] Seq=9228 Ack=6902 Win=501 Len=0 TSval=2184746704 TSecr=1968339763"
"4267","63.760276","10.0.0.14","159.124.42.26","TLSv1.2","111","63.760276000","Application Data"
"4284","63.940594","10.0.0.14","159.124.42.26","TCP","68","63.940594000","36690  >  443 [ACK] Seq=9271 Ack=6974 Win=501 Len=0 TSval=2184746943 TSecr=1968340007"
"4287","63.998451","10.0.0.14","159.124.42.26","TLSv1.2","111","63.998451000","Application Data"
"4293","64.074476","2a06:c701:472d:c000:f796:c198:3a7:a863","2a03:2880:f242:c8:face:b00c:0:167","TLSv1.2","158","64.074476000","Application Data"
"4311","64.256671","2a06:c701:472d:c000:f796:c198:3a7:a863","2a03:2880:f242:c8:face:b00c:0:167","TCP","88","64.256671000","60612  >  443 [ACK] Seq=2948 Ack=3465 Win=501 Len=0 TSval=1247750563 TSecr=2323892413"
"4335","64.596773","10.0.0.14","159.124.42.26","TLSv1.2","106","64.596773000","Application Data"
"4342","64.661572","10.0.0.14","159.124.42.26","TCP","68","64.661572000","36690  >  443 [ACK] Seq=9352 Ack=7012 Win=501 Len=0 TSval=2184747664 TSecr=1968340726"
"4345","64.694104","10.0.0.14","159.124.42.26","TCP","68","64.694104000","36690  >  443 [ACK] Seq=9352 Ack=7061 Win=501 Len=0 TSval=2184747696 TSecr=1968340758"
"4346","64.694291","10.0.0.14","159.124.42.26","TLSv1.2","135","64.694291000","Application Data"
"4370","64.945809","2a06:c701:472d:c000:f796:c198:3a7:a863","2407:30c0:182::aa72:3406","TCP","88","64.945809000","[TCP Dup ACK 245#12] [TCP ACKed unseen segment] 57446  >  443 [ACK] Seq=1 Ack=2 Win=501 Len=0 TSval=681401650 TSecr=3899337116"
"4379","65.055060","10.0.0.14","159.124.42.26","TLSv1.2","106","65.055060000","Application Data"
"4390","65.121491","10.0.0.14","159.124.42.26","TLSv1.2","135","65.121491000","Application Data"
"4396","65.160143","2a06:c701:472d:c000:f796:c198:3a7:a863","2407:30c0:182::aa72:3406","TCP","88","65.160143000","[TCP Dup ACK 256#12] [TCP ACKed unseen segment] 57458  >  443 [ACK] Seq=1 Ack=2 Win=501 Len=0 TSval=681401864 TSecr=2970038552"
"4442","65.697428","10.0.0.14","159.124.42.26","TLSv1.2","111","65.697428000","Application Data"
"4455","65.942638","10.0.0.14","159.124.42.26","TLSv1.2","111","65.942638000","Application Data"
"4475","66.254954","10.0.0.14","159.124.42.26","TCP","68","66.254954000","36690  >  443 [ACK] Seq=9505 Ack=7277 Win=501 Len=0 TSval=2184749257 TSecr=1968342262"
"4476","66.260815","10.0.0.14","159.124.42.26","TLSv1.2","111","66.260815000","Application Data"
"4487","66.347920","10.0.0.14","159.124.42.26","TCP","68","66.347920000","36690  >  443 [ACK] Seq=9548 Ack=7336 Win=501 Len=0 TSval=2184749350 TSecr=1968342414"
"4488","66.348118","10.0.0.14","159.124.42.26","TLSv1.2","111","66.348118000","Application Data"
"4513","66.695656","10.0.0.14","159.124.42.26","TLSv1.2","111","66.695656000","Application Data"
"4538","67.000486","10.0.0.14","100.26.119.89","TCP","76","67.000486000","59492  >  443 [SYN] Seq=0 Win=64240 Len=0 MSS=1460 SACK_PERM=1 TSval=1731123668 TSecr=0 WS=128"
"4544","67.152816","10.0.0.14","100.26.119.89","TCP","68","67.152816000","59492  >  443 [ACK] Seq=1 Ack=1 Win=64256 Len=0 TSval=1731123821 TSecr=1284742210"
"4545","67.153407","10.0.0.14","100.26.119.89","TLSv1.2","585","67.153407000","Client Hello"
"4550","67.274484","10.0.0.14","100.26.119.89","TCP","76","67.274484000","59506  >  443 [SYN] Seq=0 Win=64240 Len=0 MSS=1460 SACK_PERM=1 TSval=1731123942 TSecr=0 WS=128"
"4555","67.317210","10.0.0.14","100.26.119.89","TCP","68","67.317210000","59492  >  443 [ACK] Seq=518 Ack=157 Win=64128 Len=0 TSval=1731123985 TSecr=1284742372"
"4556","67.323624","10.0.0.14","100.26.119.89","TLSv1.2","119","67.323624000","Change Cipher Spec, Encrypted Handshake Message"
"4557","67.324258","10.0.0.14","100.26.119.89","TLSv1.2","173","67.324258000","Application Data"
"4558","67.324676","10.0.0.14","100.26.119.89","TLSv1.2","427","67.324676000","Application Data"
"4559","67.324792","10.0.0.14","100.26.119.89","TLSv1.2","609","67.324792000","Application Data, Application Data"
"4560","67.325089","10.0.0.14","100.26.119.89","TLSv1.2","578","67.325089000","Application Data"
"4564","67.426293","10.0.0.14","100.26.119.89","TCP","56","67.426293000","59506  >  443 [RST] Seq=1 Win=0 Len=0"
"4569","67.476315","10.0.0.14","100.26.119.89","TCP","68","67.476315000","59492  >  443 [ACK] Seq=2084 Ack=264 Win=64128 Len=0 TSval=1731124144 TSecr=1284742531"
"4570","67.476532","10.0.0.14","100.26.119.89","TLSv1.2","106","67.476532000","Application Data"
"4574","67.479485","10.0.0.14","100.26.119.89","TCP","68","67.479485000","59492  >  443 [ACK] Seq=2122 Ack=999 Win=64128 Len=0 TSval=1731124147 TSecr=1284742535"
"4581","67.664516","10.0.0.14","52.20.115.236","TCP","80","67.664516000","[TCP Dup ACK 693#1] 39120  >  443 [ACK] Seq=2059 Ack=6318 Win=64128 Len=0 TSval=2154600231 TSecr=872457032 SLE=6395 SRE=6396"
"4583","67.665585","10.0.0.14","52.20.115.236","TCP","80","67.665585000","39120  >  443 [ACK] Seq=2059 Ack=6364 Win=64128 Len=0 TSval=2154600232 TSecr=872471559 SLE=6395 SRE=6396"
"4585","67.665619","10.0.0.14","52.20.115.236","TCP","68","67.665619000","39120  >  443 [ACK] Seq=2059 Ack=6396 Win=64128 Len=0 TSval=2154600232 TSecr=872471559"
"4586","67.665841","10.0.0.14","52.20.115.236","TCP","68","67.665841000","39120  >  443 [FIN, ACK] Seq=2059 Ack=6396 Win=64128 Len=0 TSval=2154600232 TSecr=872471559"
"4609","67.948217","10.0.0.14","159.124.42.26","TLSv1.2","111","67.948217000","Application Data"
"4625","68.250267","10.0.0.14","159.124.42.26","TLSv1.2","139","68.250267000","Application Data"
"4635","68.325259","10.0.0.14","159.124.42.26","TCP","68","68.325259000","36690  >  443 [ACK] Seq=9748 Ack=7594 Win=501 Len=0 TSval=2184751327 TSecr=1968344384"
"4637","68.358009","10.0.0.14","159.124.42.26","TLSv1.2","106","68.358009000","Application Data"
"4638","68.358084","10.0.0.14","159.124.42.26","TLSv1.2","111","68.358084000","Application Data"
"4647","68.439479","10.0.0.14","159.124.42.26","TCP","68","68.439479000","36690  >  443 [ACK] Seq=9829 Ack=7681 Win=501 Len=0 TSval=2184751441 TSecr=1968344488"
"4648","68.439564","10.0.0.14","159.124.42.26","TLSv1.2","135","68.439564000","Application Data"
"4662","68.805285","10.0.0.14","159.124.42.26","TLSv1.2","106","68.805285000","Application Data"
"4669","68.876192","10.0.0.14","159.124.42.26","TCP","68","68.876192000","36698  >  443 [ACK] Seq=1929 Ack=1654 Win=501 Len=0 TSval=2184751878 TSecr=1968344936"
"4670","68.876278","10.0.0.14","159.124.42.26","TLSv1.2","135","68.876278000","Application Data"
"4704","69.386954","2a06:c701:472d:c000:f796:c198:3a7:a863","2a00:1450:4025:402::bc","TCP","88","69.386954000","[TCP Dup ACK 1474#1] 40856  >  443 [ACK] Seq=1 Ack=1 Win=501 Len=0 TSval=824698773 TSecr=3883660818"
"4725","69.982959","10.0.0.14","159.124.42.26","TCP","68","69.982959000","36690  >  443 [ACK] Seq=9896 Ack=7753 Win=501 Len=0 TSval=2184752985 TSecr=1968346009"
"4727","69.983469","10.0.0.14","159.124.42.26","TLSv1.2","111","69.983469000","Application Data"
"4732","70.064224","2a06:c701:472d:c000:f796:c198:3a7:a863","2407:30c0:182::aa72:3406","TCP","88","70.064224000","[TCP Dup ACK 245#13] [TCP ACKed unseen segment] 57446  >  443 [ACK] Seq=1 Ack=2 Win=501 Len=0 TSval=681406768 TSecr=3899337116"
"4739","70.280836","2a06:c701:472d:c000:f796:c198:3a7:a863","2407:30c0:182::aa72:3406","TCP","88","70.280836000","[TCP Dup ACK 256#13] [TCP ACKed unseen segment] 57458  >  443 [ACK] Seq=1 Ack=2 Win=501 Len=0 TSval=681406985 TSecr=2970038552"
"4775","71.139769","2a06:c701:472d:c000:f796:c198:3a7:a863","2a03:2880:f242:c8:face:b00c:0:167","TLSv1.2","159","71.139769000","Application Data"
"4781","71.258953","2a06:c701:472d:c000:f796:c198:3a7:a863","2a03:2880:f242:c8:face:b00c:0:167","TCP","88","71.258953000","60612  >  443 [ACK] Seq=3019 Ack=4553 Win=493 Len=0 TSval=1247757565 TSecr=2323899415"
"4791","71.563044","2a06:c701:472d:c000:f796:c198:3a7:a863","2a03:2880:f242:c8:face:b00c:0:167","TLSv1.2","184","71.563044000","Application Data"
"4798","71.750604","2a06:c701:472d:c000:f796:c198:3a7:a863","2a03:2880:f242:c8:face:b00c:0:167","TLSv1.2","196","71.750604000","Application Data"
"4804","71.898968","2a06:c701:472d:c000:f796:c198:3a7:a863","2a03:2880:f242:c8:face:b00c:0:167","TCP","88","71.898968000","60612  >  443 [ACK] Seq=3223 Ack=4648 Win=501 Len=0 TSval=1247758205 TSecr=2323900055"
"4809","72.064106","10.0.0.14","159.124.42.26","TLSv1.2","106","72.064106000","Application Data"
"4816","72.129419","10.0.0.14","159.124.42.26","TCP","68","72.129419000","36690  >  443 [ACK] Seq=9977 Ack=7791 Win=501 Len=0 TSval=2184755131 TSecr=1968348194"
"4821","72.198408","10.0.0.14","159.124.42.26","TCP","68","72.198408000","36690  >  443 [ACK] Seq=9977 Ack=7840 Win=501 Len=0 TSval=2184755200 TSecr=1968348263"
"4822","72.198586","10.0.0.14","159.124.42.26","TLSv1.2","135","72.198586000","Application Data"
"4835","72.514471","10.0.0.14","159.124.42.26","TLSv1.2","106","72.514471000","Application Data"
"4844","72.629258","10.0.0.14","159.124.42.26","TCP","68","72.629258000","36698  >  443 [ACK] Seq=2034 Ack=1741 Win=501 Len=0 TSval=2184755631 TSecr=1968348645"
"4845","72.629539","10.0.0.14","159.124.42.26","TLSv1.2","135","72.629539000","Application Data"
"4850","72.761077","2a06:c701:472d:c000:f796:c198:3a7:a863","2a03:2880:f242:c8:face:b00c:0:167","TCP","88","72.761077000","60612  >  443 [ACK] Seq=3223 Ack=4780 Win=500 Len=0 TSval=1247759067 TSecr=2323900916"
"4854","72.814758","2a06:c701:472d:c000:f796:c198:3a7:a863","2a03:2880:f242:c8:face:b00c:0:167","TLSv1.2","161","72.814758000","Application Data"
"4861","72.943445","2a06:c701:472d:c000:f796:c198:3a7:a863","2a03:2880:f242:c8:face:b00c:0:167","TCP","88","72.943445000","60612  >  443 [ACK] Seq=3296 Ack=5058 Win=499 Len=0 TSval=1247759249 TSecr=2323901100"
"4871","73.093430","2a06:c701:472d:c000:f796:c198:3a7:a863","2a03:2880:f242:c8:face:b00c:0:167","TLSv1.2","160","73.093430000","Application Data"
"4889","73.550385","10.0.0.14","159.124.42.26","TLSv1.2","816","73.550385000","Application Data"
"4894","73.662954","10.0.0.14","159.124.42.26","TCP","68","73.662954000","36690  >  443 [ACK] Seq=10792 Ack=7883 Win=501 Len=0 TSval=2184756665 TSecr=1968349685"
"4922","74.577028","2a06:c701:472d:c000:f796:c198:3a7:a863","2a03:2880:f242:c8:face:b00c:0:167","TCP","88","74.577028000","60612  >  443 [ACK] Seq=3368 Ack=5138 Win=501 Len=0 TSval=1247760883 TSecr=2323902731"
"4950","75.185325","2a06:c701:472d:c000:f796:c198:3a7:a863","2407:30c0:182::aa72:3406","TCP","88","75.185325000","[TCP Dup ACK 245#14] [TCP ACKed unseen segment] 57446  >  443 [ACK] Seq=1 Ack=2 Win=501 Len=0 TSval=681411889 TSecr=3899337116"
"4953","75.197122","10.0.0.14","159.124.42.26","TCP","68","75.197122000","36690  >  443 [ACK] Seq=10792 Ack=7955 Win=501 Len=0 TSval=2184758199 TSecr=1968351259"
"4956","75.238937","10.0.0.14","159.124.42.26","TLSv1.2","111","75.238937000","Application Data"
"4971","75.400183","2a06:c701:472d:c000:f796:c198:3a7:a863","2407:30c0:182::aa72:3406","TCP","88","75.400183000","[TCP Dup ACK 256#14] [TCP ACKed unseen segment] 57458  >  443 [ACK] Seq=1 Ack=2 Win=501 Len=0 TSval=681412104 TSecr=2970038552"
"4995","75.697667","10.0.0.14","159.124.42.26","TCP","68","75.697667000","36690  >  443 [ACK] Seq=10835 Ack=8027 Win=501 Len=0 TSval=2184758700 TSecr=1968351757"
"4997","75.758624","10.0.0.14","159.124.42.26","TLSv1.2","111","75.758624000","Application Data"
"5001","75.862174","2a06:c701:472d:c000:f796:c198:3a7:a863","2a03:2880:f242:c8:face:b00c:0:167","TCP","88","75.862174000","60612  >  443 [ACK] Seq=3368 Ack=5226 Win=501 Len=0 TSval=1247762168 TSecr=2323903975"
"5002","75.862650","10.0.0.14","159.124.42.26","TLSv1.2","106","75.862650000","Application Data"
"5003","75.868870","2a06:c701:472d:c000:f796:c198:3a7:a863","2a03:2880:f242:c8:face:b00c:0:167","TLSv1.2","160","75.868870000","Application Data"
"5012","76.003001","10.0.0.14","159.124.42.26","TCP","68","76.003001000","36690  >  443 [ACK] Seq=10916 Ack=8065 Win=501 Len=0 TSval=2184759005 TSecr=1968351992"
"5020","76.258401","10.0.0.14","159.124.42.26","TCP","80","76.258401000","[TCP Dup ACK 5012#1] 36690  >  443 [ACK] Seq=10916 Ack=8065 Win=501 Len=0 TSval=2184759260 TSecr=1968351992 SLE=8114 SRE=8186"
"5022","76.296144","10.0.0.14","159.124.42.26","TLSv1.2","106","76.296144000","Application Data"
"5034","76.464565","10.0.0.14","159.124.42.26","TCP","68","76.464565000","36698  >  443 [ACK] Seq=2139 Ack=1828 Win=501 Len=0 TSval=2184759467 TSecr=1968352428"
"5035","76.464656","10.0.0.14","159.124.42.26","TLSv1.2","135","76.464656000","Application Data"
"5042","76.540829","10.0.0.14","159.124.42.26","TCP","68","76.540829000","36690  >  443 [ACK] Seq=10916 Ack=8186 Win=501 Len=0 TSval=2184759543 TSecr=1968352596"
"5043","76.541017","10.0.0.14","159.124.42.26","TLSv1.2","135","76.541017000","Application Data"
"5044","76.541444","10.0.0.14","159.124.42.26","TLSv1.2","111","76.541444000","Application Data"
"5050","76.630487","10.0.0.14","159.124.42.26","TLSv1.2","111","76.630487000","Application Data"
"5053","76.697476","2a06:c701:472d:c000:f796:c198:3a7:a863","2a03:2880:f242:c8:face:b00c:0:167","TLSv1.2","163","76.697476000","Application Data"
"5131","76.906991","2a06:c701:472d:c000:f796:c198:3a7:a863","2a03:2880:f242:c8:face:b00c:0:167","TCP","88","76.906991000","60612  >  443 [ACK] Seq=3515 Ack=6486 Win=501 Len=0 TSval=1247763213 TSecr=2323905002"
"5383","77.977153","10.0.0.14","159.124.42.26","TLSv1.2","111","77.977153000","Application Data"
"5417","78.432217","2a06:c701:472d:c000:f796:c198:3a7:a863","2600:9000:2024:8600:e:4185:5680:93a1","TLSv1.2","156","78.432217000","Application Data"
"5418","78.433581","2a06:c701:472d:c000:f796:c198:3a7:a863","2600:9000:2024:8600:e:4185:5680:93a1","TLSv1.2","189","78.433581000","Application Data, Application Data"
"5426","78.506936","2a06:c701:472d:c000:f796:c198:3a7:a863","2600:9000:2024:8600:e:4185:5680:93a1","TCP","88","78.506936000","33124  >  443 [ACK] Seq=409 Ack=2138 Win=501 Len=0 TSval=2849260951 TSecr=3798777401"
"5431","78.527334","2a06:c701:472d:c000:f796:c198:3a7:a863","2600:9000:2024:8600:e:4185:5680:93a1","TCP","88","78.527334000","33124  >  443 [ACK] Seq=409 Ack=3166 Win=493 Len=0 TSval=2849260971 TSecr=3798777470"
"5432","78.528331","2a06:c701:472d:c000:f796:c198:3a7:a863","2600:9000:2024:8600:e:4185:5680:93a1","TLSv1.2","123","78.528331000","Application Data"
"5434","78.531783","2a06:c701:472d:c000:f796:c198:3a7:a863","2600:9000:2024:8600:e:4185:5680:93a1","TLSv1.2","123","78.531783000","Application Data"
"5501","79.482910","10.0.0.14","159.124.42.26","TCP","68","79.482910000","36690  >  443 [ACK] Seq=11112 Ack=8389 Win=501 Len=0 TSval=2184762485 TSecr=1968355504"
"5502","79.496734","10.0.0.14","159.124.42.26","TLSv1.2","111","79.496734000","Application Data"
"5511","79.596704","10.0.0.14","159.124.42.26","TLSv1.2","106","79.596704000","Application Data"
"5518","79.635119","10.0.0.14","159.124.42.26","TLSv1.2","271","79.635119000","Application Data"
"5521","79.662981","10.0.0.14","159.124.42.26","TCP","68","79.662981000","36690  >  443 [ACK] Seq=11396 Ack=8427 Win=501 Len=0 TSval=2184762665 TSecr=1968355728"
"5523","79.698418","10.0.0.14","159.124.42.26","TCP","68","79.698418000","36690  >  443 [ACK] Seq=11396 Ack=8476 Win=501 Len=0 TSval=2184762700 TSecr=1968355758"
"5524","79.698646","10.0.0.14","159.124.42.26","TLSv1.2","135","79.698646000","Application Data"
"5530","79.766909","10.0.0.14","159.124.42.26","TCP","68","79.766909000","36690  >  443 [ACK] Seq=11463 Ack=8519 Win=501 Len=0 TSval=2184762769 TSecr=1968355779"
"5548","79.962935","10.0.0.14","159.124.42.26","TCP","68","79.962935000","36690  >  443 [ACK] Seq=11463 Ack=8591 Win=501 Len=0 TSval=2184762965 TSecr=1968356012"
"5550","79.995060","10.0.0.14","159.124.42.26","TLSv1.2","111","79.995060000","Application Data"
"5555","80.038272","10.0.0.14","159.124.42.26","TLSv1.2","106","80.038272000","Application Data"
"5569","80.124082","10.0.0.14","159.124.42.26","TCP","68","80.124082000","36698  >  443 [ACK] Seq=2244 Ack=1915 Win=501 Len=0 TSval=2184763126 TSecr=1968356170"
"5570","80.124170","10.0.0.14","159.124.42.26","TLSv1.2","135","80.124170000","Application Data"
"5586","80.305324","2a06:c701:472d:c000:f796:c198:3a7:a863","2407:30c0:182::aa72:3406","TCP","88","80.305324000","[TCP Dup ACK 245#15] [TCP ACKed unseen segment] 57446  >  443 [ACK] Seq=1 Ack=2 Win=501 Len=0 TSval=681417009 TSecr=3899337116"
"5607","80.521230","2a06:c701:472d:c000:f796:c198:3a7:a863","2407:30c0:182::aa72:3406","TCP","88","80.521230000","[TCP Dup ACK 256#15] [TCP ACKed unseen segment] 57458  >  443 [ACK] Seq=1 Ack=2 Win=501 Len=0 TSval=681417225 TSecr=2970038552"
"5647","81.050671","10.0.0.14","159.124.42.26","TLSv1.2","139","81.050671000","Application Data"
"5656","81.137774","10.0.0.14","159.124.42.26","TLSv1.2","111","81.137774000","Application Data"
"5665","81.240020","10.0.0.14","159.124.42.26","TLSv1.2","111","81.240020000","Application Data"
"5704","81.738971","10.0.0.14","159.124.42.26","TCP","68","81.738971000","36690  >  443 [ACK] Seq=11663 Ack=8814 Win=501 Len=0 TSval=2184764741 TSecr=1968357759"
"5705","81.760731","10.0.0.14","159.124.42.26","TLSv1.2","111","81.760731000","Application Data"
"5771","82.679003","10.0.0.14","140.82.114.26","TCP","68","82.679003000","[TCP Keep-Alive] 37730  >  443 [ACK] Seq=31 Ack=27 Win=501 Len=0 TSval=2095789584 TSecr=80091915"
"5819","83.355935","10.0.0.14","159.124.42.26","TLSv1.2","106","83.355935000","Application Data"
"5826","83.426989","10.0.0.14","159.124.42.26","TCP","68","83.426989000","36690  >  443 [ACK] Seq=11744 Ack=8852 Win=501 Len=0 TSval=2184766429 TSecr=1968359490"
"5829","83.443051","10.0.0.14","159.124.42.26","TCP","68","83.443051000","36690  >  443 [ACK] Seq=11744 Ack=8901 Win=501 Len=0 TSval=2184766445 TSecr=1968359505"
"5830","83.443229","10.0.0.14","159.124.42.26","TLSv1.2","135","83.443229000","Application Data"
"5850","83.698992","10.0.0.14","34.237.73.95","TCP","68","83.698992000","[TCP Keep-Alive] 49870  >  443 [ACK] Seq=248 Ack=309 Win=501 Len=0 TSval=3771162323 TSecr=758266030"
"5857","83.798420","10.0.0.14","159.124.42.26","TLSv1.2","106","83.798420000","Application Data"
"5866","83.850787","10.0.0.14","34.237.73.95","TLSv1.2","316","83.850787000","Application Data"
"5868","83.861015","10.0.0.14","34.237.73.95","TLSv1.2","224","83.861015000","Application Data"
"5873","83.883020","10.0.0.14","159.124.42.26","TCP","68","83.883020000","36698  >  443 [ACK] Seq=2349 Ack=2002 Win=501 Len=0 TSval=2184766885 TSecr=1968359929"
"5874","83.883120","10.0.0.14","159.124.42.26","TLSv1.2","135","83.883120000","Application Data"
"5885","84.005635","10.0.0.14","34.237.73.95","TCP","68","84.005635000","49870  >  443 [ACK] Seq=653 Ack=579 Win=499 Len=0 TSval=3771162630 TSecr=758312634"
"5903","84.210957","10.0.0.14","104.121.10.34","TCP","68","84.210957000","[TCP Keep-Alive] 46628  >  443 [ACK] Seq=1313 Ack=13188 Win=501 Len=0 TSval=3059544188 TSecr=871198029"
"5931","84.498187","10.0.0.14","159.124.42.26","TLSv1.2","111","84.498187000","Application Data"
"5948","84.719126","2a06:c701:472d:c000:f796:c198:3a7:a863","2a03:2880:f242:c8:face:b00c:0:167","TCP","88","84.719126000","60612  >  443 [ACK] Seq=3515 Ack=6566 Win=501 Len=0 TSval=1247771025 TSecr=2323912875"
"5964","85.200493","10.0.0.14","159.124.42.26","TCP","68","85.200493000","36690  >  443 [ACK] Seq=11854 Ack=9113 Win=501 Len=0 TSval=2184768202 TSecr=1968361262"
"5965","85.200612","10.0.0.14","159.124.42.26","TLSv1.2","111","85.200612000","Application Data"
"5985","85.425180","2a06:c701:472d:c000:f796:c198:3a7:a863","2407:30c0:182::aa72:3406","TCP","88","85.425180000","[TCP Dup ACK 245#16] [TCP ACKed unseen segment] 57446  >  443 [ACK] Seq=1 Ack=2 Win=501 Len=0 TSval=681422129 TSecr=3899337116"
"6004","85.598263","10.0.0.14","159.124.42.26","TLSv1.2","111","85.598263000","Application Data"
"6013","85.639711","2a06:c701:472d:c000:f796:c198:3a7:a863","2407:30c0:182::aa72:3406","TCP","88","85.639711000","[TCP Dup ACK 256#16] [TCP ACKed unseen segment] 57458  >  443 [ACK] Seq=1 Ack=2 Win=501 Len=0 TSval=681422344 TSecr=2970038552"
